[
  {
    "bid_number": "GEM/2026/B/7069088",
    "bid_detail_url": "https://bidplus.gem.gov.in/showbidDocument/8791934",
    "bid_hover_url": "https://bidplus.gem.gov.in/bidding/bid/getSinglePacketResultView/8791934",
    "has_reverse_auction": false,
    "ra_number": null,
    "ra_detail_url": null,
    "ra_hover_url": null,
    "item": "LED Bulb 9W,Charging Bulb,Anch...",
    "quantity": 66,
    "ministry": "Ministry of Defence",
    "department": "Department of Military Affairs",
    "organisation_address": null,
    "start_datetime_raw": "04-01-2026 8:20 PM",
    "end_datetime_raw": "14-01-2026 9:00 PM",
    "start_datetime": "2026-01-04T20:20:00",
    "end_datetime": "2026-01-14T21:00:00",
    "stage": "Bid Award",
    "bid_ra_status": null,
    "technical_status": null,
    "raw_card_text": "BID NO:\u00a0GEM/2026/B/7069088\n\nStatus: Bid Award\n\nItems:\u00a0LED Bulb 9W,Charging Bulb,Anch...\nQuantity:\u00a066\nDepartment Name And Address:\u00a0\nMinistry of Defence\nDepartment of Military Affairs\nStart Date:\u00a004-01-2026 8:20 PM\nEnd Date:\u00a0\u00a0\u00a014-01-2026 9:00 PM"
  },
  {
    "bid_number": "GEM/2025/B/7050516",
    "bid_detail_url": "https://bidplus.gem.gov.in/showbidDocument/8769912",
    "bid_hover_url": "https://bidplus.gem.gov.in/bidding/bid/getBidResultView/8769912",
    "has_reverse_auction": true,
    "ra_number": "GEM/2026/R/605989",
    "ra_detail_url": "https://bidplus.gem.gov.in/showradocumentPdf/8832000",
    "ra_hover_url": "https://bidplus.gem.gov.in/bidding/bid/getBidResultView/8832000",
    "item": "JBL Professional Power PA Loud...",
    "quantity": 2,
    "ministry": "Ministry of Defence",
    "department": "Department of Military Affairs",
    "organisation_address": null,
    "start_datetime_raw": "13-01-2026 9:00 PM",
    "end_datetime_raw": "14-01-2026 9:00 PM",
    "start_datetime": "2026-01-13T21:00:00",
    "end_datetime": "2026-01-14T21:00:00",
    "stage": "Bid Award",
    "bid_ra_status": null,
    "technical_status": null,
    "raw_card_text": "Bid No.:\u00a0 GEM/2025/B/7050516\n\nRA NO:\u00a0GEM/2026/R/605989\n\nStatus: Bid Award\n\nItems:\u00a0JBL Professional Power PA Loud...\nQuantity:\u00a02\nDepartment Name And Address:\u00a0\nMinistry of Defence\nDepartment of Military Affairs\nStart Date:\u00a013-01-2026 9:00 PM\nEnd Date:\u00a0\u00a0\u00a014-01-2026 9:00 PM"
  },
  {
    "bid_number": "GEM/2026/B/7069652",
    "bid_detail_url": "https://bidplus.gem.gov.in/showbidDocument/8792537",
    "bid_hover_url": "https://bidplus.gem.gov.in/bidding/bid/getBidResultView/8792537",
    "has_reverse_auction": false,
    "ra_number": null,
    "ra_detail_url": null,
    "ra_hover_url": null,
    "item": "Drinking Water ATM / Water Ven...",
    "quantity": 1,
    "ministry": "Department of Panchayati Raj",
    "department": null,
    "organisation_address": null,
    "start_datetime_raw": "04-01-2026 2:42 PM",
    "end_datetime_raw": "14-01-2026 9:00 PM",
    "start_datetime": "2026-01-04T14:42:00",
    "end_datetime": "2026-01-14T21:00:00",
    "stage": "Bid Award",
    "bid_ra_status": null,
    "technical_status": null,
    "raw_card_text": "BID NO:\u00a0GEM/2026/B/7069652\n\nStatus: Bid Award\n\nItems:\u00a0Drinking Water ATM / Water Ven...\nQuantity:\u00a01\nDepartment Name And Address:\u00a0\nDepartment of Panchayati Raj\nStart Date:\u00a004-01-2026 2:42 PM\nEnd Date:\u00a0\u00a0\u00a014-01-2026 9:00 PM"
  },
  {
    "bid_number": "GEM/2026/B/7069647",
    "bid_detail_url": "https://bidplus.gem.gov.in/showbidDocument/8792532",
    "bid_hover_url": "https://bidplus.gem.gov.in/bidding/bid/getBidResultView/8792532",
    "has_reverse_auction": false,
    "ra_number": null,
    "ra_detail_url": null,
    "ra_hover_url": null,
    "item": "Drinking Water ATM / Water Ven...",
    "quantity": 1,
    "ministry": "Department of Panchayati Raj",
    "department": null,
    "organisation_address": null,
    "start_datetime_raw": "04-01-2026 2:44 PM",
    "end_datetime_raw": "14-01-2026 9:00 PM",
    "start_datetime": "2026-01-04T14:44:00",
    "end_datetime": "2026-01-14T21:00:00",
    "stage": "Bid Award",
    "bid_ra_status": null,
    "technical_status": null,
    "raw_card_text": "BID NO:\u00a0GEM/2026/B/7069647\n\nStatus: Bid Award\n\nItems:\u00a0Drinking Water ATM / Water Ven...\nQuantity:\u00a01\nDepartment Name And Address:\u00a0\nDepartment of Panchayati Raj\nStart Date:\u00a004-01-2026 2:44 PM\nEnd Date:\u00a0\u00a0\u00a014-01-2026 9:00 PM"
  },
  {
    "bid_number": "GEM/2026/B/7061817",
    "bid_detail_url": "https://bidplus.gem.gov.in/showbidDocument/8783553",
    "bid_hover_url": "https://bidplus.gem.gov.in/bidding/bid/getBidResultView/8783553",
    "has_reverse_auction": true,
    "ra_number": "GEM/2026/R/605969",
    "ra_detail_url": "https://bidplus.gem.gov.in/showradocumentPdf/8831868",
    "ra_hover_url": "https://bidplus.gem.gov.in/bidding/bid/getBidResultView/8831868",
    "item": "Hay Grass (Loose and Bundle)",
    "quantity": 9000,
    "ministry": "Ministry of Defence",
    "department": "Department of Military Affairs",
    "organisation_address": null,
    "start_datetime_raw": "13-01-2026 8:00 PM",
    "end_datetime_raw": "14-01-2026 8:00 PM",
    "start_datetime": "2026-01-13T20:00:00",
    "end_datetime": "2026-01-14T20:00:00",
    "stage": "Bid Award",
    "bid_ra_status": null,
    "technical_status": null,
    "raw_card_text": "Bid No.:\u00a0 GEM/2026/B/7061817\n\nRA NO:\u00a0GEM/2026/R/605969\n\nStatus: Bid Award\n\nItems:\u00a0Hay Grass (Loose and Bundle)\nQuantity:\u00a09000\nDepartment Name And Address:\u00a0\nMinistry of Defence\nDepartment of Military Affairs\nStart Date:\u00a013-01-2026 8:00 PM\nEnd Date:\u00a0\u00a0\u00a014-01-2026 8:00 PM"
  },
  {
    "bid_number": "GEM/2026/B/7069911",
    "bid_detail_url": "https://bidplus.gem.gov.in/showbidDocument/8792814",
    "bid_hover_url": "https://bidplus.gem.gov.in/bidding/bid/getBidResultView/8792814",
    "has_reverse_auction": false,
    "ra_number": null,
    "ra_detail_url": null,
    "ra_hover_url": null,
    "item": "Metal Diode,Coupling,MCB,Centr...",
    "quantity": 26,
    "ministry": "Ministry of Defence",
    "department": "Department of Military Affairs",
    "organisation_address": null,
    "start_datetime_raw": "04-01-2026 7:42 PM",
    "end_datetime_raw": "14-01-2026 8:00 PM",
    "start_datetime": "2026-01-04T19:42:00",
    "end_datetime": "2026-01-14T20:00:00",
    "stage": "Bid Award",
    "bid_ra_status": null,
    "technical_status": null,
    "raw_card_text": "BID NO:\u00a0GEM/2026/B/7069911\n\nStatus: Bid Award\n\nItems:\u00a0Metal Diode,Coupling,MCB,Centr...\nQuantity:\u00a026\nDepartment Name And Address:\u00a0\nMinistry of Defence\nDepartment of Military Affairs\nStart Date:\u00a004-01-2026 7:42 PM\nEnd Date:\u00a0\u00a0\u00a014-01-2026 8:00 PM"
  },
  {
    "bid_number": "GEM/2025/B/6939715",
    "bid_detail_url": "https://bidplus.gem.gov.in/showbidDocument/8643856",
    "bid_hover_url": "https://bidplus.gem.gov.in/bidding/bid/getBidResultView/8643856",
    "has_reverse_auction": true,
    "ra_number": "GEM/2026/R/605953",
    "ra_detail_url": "https://bidplus.gem.gov.in/showradocumentPdf/8831812",
    "ra_hover_url": "https://bidplus.gem.gov.in/bidding/bid/getBidResultView/8831812",
    "item": "Supply of Multi parameter Anal...",
    "quantity": 39,
    "ministry": "Ministry of Defence",
    "department": "Department of Military Affairs",
    "organisation_address": null,
    "start_datetime_raw": "13-01-2026 8:00 PM",
    "end_datetime_raw": "14-01-2026 8:00 PM",
    "start_datetime": "2026-01-13T20:00:00",
    "end_datetime": "2026-01-14T20:00:00",
    "stage": "Bid Award",
    "bid_ra_status": null,
    "technical_status": null,
    "raw_card_text": "Bid No.:\u00a0 GEM/2025/B/6939715\n\nRA NO:\u00a0GEM/2026/R/605953\n\nStatus: Bid Award\n\nItems:\u00a0Supply of Multi parameter Anal...\nQuantity:\u00a039\nDepartment Name And Address:\u00a0\nMinistry of Defence\nDepartment of Military Affairs\nStart Date:\u00a013-01-2026 8:00 PM\nEnd Date:\u00a0\u00a0\u00a014-01-2026 8:00 PM"
  },
  {
    "bid_number": "GEM/2026/B/7069868",
    "bid_detail_url": "https://bidplus.gem.gov.in/showbidDocument/8792769",
    "bid_hover_url": "https://bidplus.gem.gov.in/bidding/bid/getBidResultView/8792769",
    "has_reverse_auction": false,
    "ra_number": null,
    "ra_detail_url": null,
    "ra_hover_url": null,
    "item": "Rear Axle Wheel Speed Sensor A...",
    "quantity": 8,
    "ministry": "Ministry of Defence",
    "department": "Department of Military Affairs",
    "organisation_address": null,
    "start_datetime_raw": "04-01-2026 7:26 PM",
    "end_datetime_raw": "14-01-2026 8:00 PM",
    "start_datetime": "2026-01-04T19:26:00",
    "end_datetime": "2026-01-14T20:00:00",
    "stage": "Bid Award",
    "bid_ra_status": null,
    "technical_status": null,
    "raw_card_text": "BID NO:\u00a0GEM/2026/B/7069868\n\nStatus: Bid Award\n\nItems:\u00a0Rear Axle Wheel Speed Sensor A...\nQuantity:\u00a08\nDepartment Name And Address:\u00a0\nMinistry of Defence\nDepartment of Military Affairs\nStart Date:\u00a004-01-2026 7:26 PM\nEnd Date:\u00a0\u00a0\u00a014-01-2026 8:00 PM"
  },
  {
    "bid_number": "GEM/2026/B/7068967",
    "bid_detail_url": "https://bidplus.gem.gov.in/showbidDocument/8791799",
    "bid_hover_url": "https://bidplus.gem.gov.in/bidding/bid/getBidResultView/8791799",
    "has_reverse_auction": false,
    "ra_number": null,
    "ra_detail_url": null,
    "ra_hover_url": null,
    "item": "PLASTER CUTTER MACHINE,WHEEL W...",
    "quantity": 27,
    "ministry": "Ministry of Defence",
    "department": "Department of Military Affairs",
    "organisation_address": null,
    "start_datetime_raw": "03-01-2026 7:31 PM",
    "end_datetime_raw": "14-01-2026 8:00 PM",
    "start_datetime": "2026-01-03T19:31:00",
    "end_datetime": "2026-01-14T20:00:00",
    "stage": "Bid Award",
    "bid_ra_status": null,
    "technical_status": null,
    "raw_card_text": "BID NO:\u00a0GEM/2026/B/7068967\n\nStatus: Bid Award\n\nItems:\u00a0PLASTER CUTTER MACHINE,WHEEL W...\nQuantity:\u00a027\nDepartment Name And Address:\u00a0\nMinistry of Defence\nDepartment of Military Affairs\nStart Date:\u00a003-01-2026 7:31 PM\nEnd Date:\u00a0\u00a0\u00a014-01-2026 8:00 PM"
  },
  {
    "bid_number": "GEM/2026/B/7068888",
    "bid_detail_url": "https://bidplus.gem.gov.in/showbidDocument/8791706",
    "bid_hover_url": "https://bidplus.gem.gov.in/bidding/bid/getBidResultView/8791706",
    "has_reverse_auction": false,
    "ra_number": null,
    "ra_detail_url": null,
    "ra_hover_url": null,
    "item": "3x5 Flex print Plantation,Phot...",
    "quantity": 487,
    "ministry": "Ministry of Defence",
    "department": "Department of Military Affairs",
    "organisation_address": null,
    "start_datetime_raw": "03-01-2026 7:24 PM",
    "end_datetime_raw": "14-01-2026 8:00 PM",
    "start_datetime": "2026-01-03T19:24:00",
    "end_datetime": "2026-01-14T20:00:00",
    "stage": "Bid Award",
    "bid_ra_status": null,
    "technical_status": null,
    "raw_card_text": "BID NO:\u00a0GEM/2026/B/7068888\n\nStatus: Bid Award\n\nItems:\u00a03x5 Flex print Plantation,Phot...\nQuantity:\u00a0487\nDepartment Name And Address:\u00a0\nMinistry of Defence\nDepartment of Military Affairs\nStart Date:\u00a003-01-2026 7:24 PM\nEnd Date:\u00a0\u00a0\u00a014-01-2026 8:00 PM"
  },
  {
    "bid_number": "GEM/2026/B/7069873",
    "bid_detail_url": "https://bidplus.gem.gov.in/showbidDocument/8792774",
    "bid_hover_url": "https://bidplus.gem.gov.in/bidding/bid/getBidResultView/8792774",
    "has_reverse_auction": false,
    "ra_number": null,
    "ra_detail_url": null,
    "ra_hover_url": null,
    "item": "Oil Filter,Air Filter Element,...",
    "quantity": 15,
    "ministry": "Ministry of Defence",
    "department": "Department of Military Affairs",
    "organisation_address": null,
    "start_datetime_raw": "04-01-2026 7:01 PM",
    "end_datetime_raw": "14-01-2026 8:00 PM",
    "start_datetime": "2026-01-04T19:01:00",
    "end_datetime": "2026-01-14T20:00:00",
    "stage": "Bid Award",
    "bid_ra_status": null,
    "technical_status": null,
    "raw_card_text": "BID NO:\u00a0GEM/2026/B/7069873\n\nStatus: Bid Award\n\nItems:\u00a0Oil Filter,Air Filter Element,...\nQuantity:\u00a015\nDepartment Name And Address:\u00a0\nMinistry of Defence\nDepartment of Military Affairs\nStart Date:\u00a004-01-2026 7:01 PM\nEnd Date:\u00a0\u00a0\u00a014-01-2026 8:00 PM"
  },
  {
    "bid_number": "GEM/2026/B/7069918",
    "bid_detail_url": "https://bidplus.gem.gov.in/showbidDocument/8792822",
    "bid_hover_url": "https://bidplus.gem.gov.in/bidding/bid/getBidResultView/8792822",
    "has_reverse_auction": false,
    "ra_number": null,
    "ra_detail_url": null,
    "ra_hover_url": null,
    "item": "BOSCH NOZEL,PARKING BULB 12 V,...",
    "quantity": 7,
    "ministry": "Ministry of Defence",
    "department": "Department of Military Affairs",
    "organisation_address": null,
    "start_datetime_raw": "04-01-2026 7:43 PM",
    "end_datetime_raw": "14-01-2026 8:00 PM",
    "start_datetime": "2026-01-04T19:43:00",
    "end_datetime": "2026-01-14T20:00:00",
    "stage": "Bid Award",
    "bid_ra_status": null,
    "technical_status": null,
    "raw_card_text": "BID NO:\u00a0GEM/2026/B/7069918\n\nStatus: Bid Award\n\nItems:\u00a0BOSCH NOZEL,PARKING BULB 12 V,...\nQuantity:\u00a07\nDepartment Name And Address:\u00a0\nMinistry of Defence\nDepartment of Military Affairs\nStart Date:\u00a004-01-2026 7:43 PM\nEnd Date:\u00a0\u00a0\u00a014-01-2026 8:00 PM"
  },
  {
    "bid_number": "GEM/2026/B/7065095",
    "bid_detail_url": "https://bidplus.gem.gov.in/showbidDocument/8787464",
    "bid_hover_url": "https://bidplus.gem.gov.in/bidding/bid/getBidResultView/8787464",
    "has_reverse_auction": false,
    "ra_number": null,
    "ra_detail_url": null,
    "ra_hover_url": null,
    "item": "Self Armature TATA,H7 Bulb 12 ...",
    "quantity": 46,
    "ministry": "Ministry of Defence",
    "department": "Department of Military Affairs",
    "organisation_address": null,
    "start_datetime_raw": "02-01-2026 7:36 PM",
    "end_datetime_raw": "14-01-2026 8:00 PM",
    "start_datetime": "2026-01-02T19:36:00",
    "end_datetime": "2026-01-14T20:00:00",
    "stage": "Bid Award",
    "bid_ra_status": null,
    "technical_status": null,
    "raw_card_text": "BID NO:\u00a0GEM/2026/B/7065095\n\nStatus: Bid Award\n\nItems:\u00a0Self Armature TATA,H7 Bulb 12 ...\nQuantity:\u00a046\nDepartment Name And Address:\u00a0\nMinistry of Defence\nDepartment of Military Affairs\nStart Date:\u00a002-01-2026 7:36 PM\nEnd Date:\u00a0\u00a0\u00a014-01-2026 8:00 PM"
  },
  {
    "bid_number": "GEM/2026/B/7069909",
    "bid_detail_url": "https://bidplus.gem.gov.in/showbidDocument/8792812",
    "bid_hover_url": "https://bidplus.gem.gov.in/bidding/bid/getBidResultView/8792812",
    "has_reverse_auction": false,
    "ra_number": null,
    "ra_detail_url": null,
    "ra_hover_url": null,
    "item": "Angle Irons 25x25x3 MM,ELCT WI...",
    "quantity": 145,
    "ministry": "Ministry of Defence",
    "department": "Department of Military Affairs",
    "organisation_address": null,
    "start_datetime_raw": "04-01-2026 7:38 PM",
    "end_datetime_raw": "14-01-2026 8:00 PM",
    "start_datetime": "2026-01-04T19:38:00",
    "end_datetime": "2026-01-14T20:00:00",
    "stage": "Bid Award",
    "bid_ra_status": null,
    "technical_status": null,
    "raw_card_text": "BID NO:\u00a0GEM/2026/B/7069909\n\nStatus: Bid Award\n\nItems:\u00a0Angle Irons 25x25x3 MM,ELCT WI...\nQuantity:\u00a0145\nDepartment Name And Address:\u00a0\nMinistry of Defence\nDepartment of Military Affairs\nStart Date:\u00a004-01-2026 7:38 PM\nEnd Date:\u00a0\u00a0\u00a014-01-2026 8:00 PM"
  },
  {
    "bid_number": "GEM/2025/B/7054305",
    "bid_detail_url": "https://bidplus.gem.gov.in/showbidDocument/8774526",
    "bid_hover_url": "https://bidplus.gem.gov.in/bidding/bid/getBidResultView/8774526",
    "has_reverse_auction": true,
    "ra_number": "GEM/2026/R/605967",
    "ra_detail_url": "https://bidplus.gem.gov.in/showradocumentPdf/8831859",
    "ra_hover_url": "https://bidplus.gem.gov.in/bidding/bid/getBidResultView/8831859",
    "item": "2530290 ATS 8 683 775 V5 R90 G...",
    "quantity": 396,
    "ministry": "Ministry of Defence",
    "department": "Department of Military Affairs",
    "organisation_address": null,
    "start_datetime_raw": "13-01-2026 8:00 PM",
    "end_datetime_raw": "14-01-2026 8:00 PM",
    "start_datetime": "2026-01-13T20:00:00",
    "end_datetime": "2026-01-14T20:00:00",
    "stage": "Bid Award",
    "bid_ra_status": null,
    "technical_status": null,
    "raw_card_text": "Bid No.:\u00a0 GEM/2025/B/7054305\n\nRA NO:\u00a0GEM/2026/R/605967\n\nStatus: Bid Award\n\nItems:\u00a02530290 ATS 8 683 775 V5 R90 G...\nQuantity:\u00a0396\nDepartment Name And Address:\u00a0\nMinistry of Defence\nDepartment of Military Affairs\nStart Date:\u00a013-01-2026 8:00 PM\nEnd Date:\u00a0\u00a0\u00a014-01-2026 8:00 PM"
  },
  {
    "bid_number": "GEM/2025/B/7054140",
    "bid_detail_url": "https://bidplus.gem.gov.in/showbidDocument/8774335",
    "bid_hover_url": "https://bidplus.gem.gov.in/bidding/bid/getBidResultView/8774335",
    "has_reverse_auction": true,
    "ra_number": "GEM/2026/R/605946",
    "ra_detail_url": "https://bidplus.gem.gov.in/showradocumentPdf/8831791",
    "ra_hover_url": "https://bidplus.gem.gov.in/bidding/bid/getBidResultView/8831791",
    "item": "2530326 54 15 031 LV1 R72 GASK...",
    "quantity": 104,
    "ministry": "Ministry of Defence",
    "department": "Department of Military Affairs",
    "organisation_address": null,
    "start_datetime_raw": "13-01-2026 8:00 PM",
    "end_datetime_raw": "14-01-2026 8:00 PM",
    "start_datetime": "2026-01-13T20:00:00",
    "end_datetime": "2026-01-14T20:00:00",
    "stage": "Bid Award",
    "bid_ra_status": null,
    "technical_status": null,
    "raw_card_text": "Bid No.:\u00a0 GEM/2025/B/7054140\n\nRA NO:\u00a0GEM/2026/R/605946\n\nStatus: Bid Award\n\nItems:\u00a02530326 54 15 031 LV1 R72 GASK...\nQuantity:\u00a0104\nDepartment Name And Address:\u00a0\nMinistry of Defence\nDepartment of Military Affairs\nStart Date:\u00a013-01-2026 8:00 PM\nEnd Date:\u00a0\u00a0\u00a014-01-2026 8:00 PM"
  },
  {
    "bid_number": "GEM/2026/B/7068912",
    "bid_detail_url": "https://bidplus.gem.gov.in/showbidDocument/8791735",
    "bid_hover_url": "https://bidplus.gem.gov.in/bidding/bid/getBidResultView/8791735",
    "has_reverse_auction": false,
    "ra_number": null,
    "ra_detail_url": null,
    "ra_hover_url": null,
    "item": "REAR VIEW MIRROR,SIDE LAMP TUR...",
    "quantity": 37,
    "ministry": "Ministry of Defence",
    "department": "Department of Military Affairs",
    "organisation_address": null,
    "start_datetime_raw": "03-01-2026 7:09 PM",
    "end_datetime_raw": "14-01-2026 8:00 PM",
    "start_datetime": "2026-01-03T19:09:00",
    "end_datetime": "2026-01-14T20:00:00",
    "stage": "Bid Award",
    "bid_ra_status": null,
    "technical_status": null,
    "raw_card_text": "BID NO:\u00a0GEM/2026/B/7068912\n\nStatus: Bid Award\n\nItems:\u00a0REAR VIEW MIRROR,SIDE LAMP TUR...\nQuantity:\u00a037\nDepartment Name And Address:\u00a0\nMinistry of Defence\nDepartment of Military Affairs\nStart Date:\u00a003-01-2026 7:09 PM\nEnd Date:\u00a0\u00a0\u00a014-01-2026 8:00 PM"
  },
  {
    "bid_number": "GEM/2025/B/7054171",
    "bid_detail_url": "https://bidplus.gem.gov.in/showbidDocument/8774372",
    "bid_hover_url": "https://bidplus.gem.gov.in/bidding/bid/getBidResultView/8774372",
    "has_reverse_auction": true,
    "ra_number": "GEM/2026/R/605961",
    "ra_detail_url": "https://bidplus.gem.gov.in/showradocumentPdf/8831836",
    "ra_hover_url": "https://bidplus.gem.gov.in/bidding/bid/getBidResultView/8831836",
    "item": "2530322 175 31 226 LV1 R72 GAS...",
    "quantity": 44,
    "ministry": "Ministry of Defence",
    "department": "Department of Military Affairs",
    "organisation_address": null,
    "start_datetime_raw": "13-01-2026 8:00 PM",
    "end_datetime_raw": "14-01-2026 8:00 PM",
    "start_datetime": "2026-01-13T20:00:00",
    "end_datetime": "2026-01-14T20:00:00",
    "stage": "Bid Award",
    "bid_ra_status": null,
    "technical_status": null,
    "raw_card_text": "Bid No.:\u00a0 GEM/2025/B/7054171\n\nRA NO:\u00a0GEM/2026/R/605961\n\nStatus: Bid Award\n\nItems:\u00a02530322 175 31 226 LV1 R72 GAS...\nQuantity:\u00a044\nDepartment Name And Address:\u00a0\nMinistry of Defence\nDepartment of Military Affairs\nStart Date:\u00a013-01-2026 8:00 PM\nEnd Date:\u00a0\u00a0\u00a014-01-2026 8:00 PM"
  },
  {
    "bid_number": "GEM/2026/B/7069850",
    "bid_detail_url": "https://bidplus.gem.gov.in/showbidDocument/8792749",
    "bid_hover_url": "https://bidplus.gem.gov.in/bidding/bid/getBidResultView/8792749",
    "has_reverse_auction": false,
    "ra_number": null,
    "ra_detail_url": null,
    "ra_hover_url": null,
    "item": "Repair of TV 55 Inch,Replace o...",
    "quantity": 5,
    "ministry": "Ministry of Defence",
    "department": "Department of Military Affairs",
    "organisation_address": null,
    "start_datetime_raw": "04-01-2026 7:01 PM",
    "end_datetime_raw": "14-01-2026 8:00 PM",
    "start_datetime": "2026-01-04T19:01:00",
    "end_datetime": "2026-01-14T20:00:00",
    "stage": "Bid Award",
    "bid_ra_status": null,
    "technical_status": null,
    "raw_card_text": "BID NO:\u00a0GEM/2026/B/7069850\n\nStatus: Bid Award\n\nItems:\u00a0Repair of TV 55 Inch,Replace o...\nQuantity:\u00a05\nDepartment Name And Address:\u00a0\nMinistry of Defence\nDepartment of Military Affairs\nStart Date:\u00a004-01-2026 7:01 PM\nEnd Date:\u00a0\u00a0\u00a014-01-2026 8:00 PM"
  },
  {
    "bid_number": "GEM/2026/B/7069861",
    "bid_detail_url": "https://bidplus.gem.gov.in/showbidDocument/8792762",
    "bid_hover_url": "https://bidplus.gem.gov.in/bidding/bid/getBidResultView/8792762",
    "has_reverse_auction": false,
    "ra_number": null,
    "ra_detail_url": null,
    "ra_hover_url": null,
    "item": "Assy Outer Handle LH,Ball Join...",
    "quantity": 22,
    "ministry": "Ministry of Defence",
    "department": "Department of Military Affairs",
    "organisation_address": null,
    "start_datetime_raw": "04-01-2026 6:52 PM",
    "end_datetime_raw": "14-01-2026 7:00 PM",
    "start_datetime": "2026-01-04T18:52:00",
    "end_datetime": "2026-01-14T19:00:00",
    "stage": "Bid Award",
    "bid_ra_status": null,
    "technical_status": null,
    "raw_card_text": "BID NO:\u00a0GEM/2026/B/7069861\n\nStatus: Bid Award\n\nItems:\u00a0Assy Outer Handle LH,Ball Join...\nQuantity:\u00a022\nDepartment Name And Address:\u00a0\nMinistry of Defence\nDepartment of Military Affairs\nStart Date:\u00a004-01-2026 6:52 PM\nEnd Date:\u00a0\u00a0\u00a014-01-2026 7:00 PM"
  },
  {
    "bid_number": "GEM/2026/B/7069803",
    "bid_detail_url": "https://bidplus.gem.gov.in/showbidDocument/8792694",
    "bid_hover_url": "https://bidplus.gem.gov.in/bidding/bid/getSinglePacketResultView/8792694",
    "has_reverse_auction": false,
    "ra_number": null,
    "ra_detail_url": null,
    "ra_hover_url": null,
    "item": "Haier TV 65 Inch 4k UHD",
    "quantity": 2,
    "ministry": "Ministry of Defence",
    "department": "Department of Military Affairs",
    "organisation_address": null,
    "start_datetime_raw": "04-01-2026 6:05 PM",
    "end_datetime_raw": "14-01-2026 7:00 PM",
    "start_datetime": "2026-01-04T18:05:00",
    "end_datetime": "2026-01-14T19:00:00",
    "stage": "Bid Award",
    "bid_ra_status": null,
    "technical_status": null,
    "raw_card_text": "BID NO:\u00a0GEM/2026/B/7069803\n\nStatus: Bid Award\n\nItems:\u00a0Haier TV 65 Inch 4k UHD\nQuantity:\u00a02\nDepartment Name And Address:\u00a0\nMinistry of Defence\nDepartment of Military Affairs\nStart Date:\u00a004-01-2026 6:05 PM\nEnd Date:\u00a0\u00a0\u00a014-01-2026 7:00 PM"
  },
  {
    "bid_number": "GEM/2026/B/7069774",
    "bid_detail_url": "https://bidplus.gem.gov.in/showbidDocument/8792662",
    "bid_hover_url": "https://bidplus.gem.gov.in/bidding/bid/getBidResultView/8792662",
    "has_reverse_auction": false,
    "ra_number": null,
    "ra_detail_url": null,
    "ra_hover_url": null,
    "item": "High Mast Lighting Tower for l...",
    "quantity": 2,
    "ministry": "Panchayat Raj Department Bihar",
    "department": null,
    "organisation_address": null,
    "start_datetime_raw": "04-01-2026 5:22 PM",
    "end_datetime_raw": "14-01-2026 7:00 PM",
    "start_datetime": "2026-01-04T17:22:00",
    "end_datetime": "2026-01-14T19:00:00",
    "stage": "Bid Award",
    "bid_ra_status": null,
    "technical_status": null,
    "raw_card_text": "BID NO:\u00a0GEM/2026/B/7069774\n\nStatus: Bid Award\n\nItems:\u00a0High Mast Lighting Tower for l...\nQuantity:\u00a02\nDepartment Name And Address:\u00a0\nPanchayat Raj Department Bihar\nStart Date:\u00a004-01-2026 5:22 PM\nEnd Date:\u00a0\u00a0\u00a014-01-2026 7:00 PM"
  },
  {
    "bid_number": "GEM/2026/B/7068876",
    "bid_detail_url": "https://bidplus.gem.gov.in/showbidDocument/8791694",
    "bid_hover_url": "https://bidplus.gem.gov.in/bidding/bid/getBidResultView/8791694",
    "has_reverse_auction": false,
    "ra_number": null,
    "ra_detail_url": null,
    "ra_hover_url": null,
    "item": "BOLT CLAMPING 10X65,FOWARED RE...",
    "quantity": 16,
    "ministry": "Ministry of Defence",
    "department": "Department of Military Affairs",
    "organisation_address": null,
    "start_datetime_raw": "03-01-2026 6:55 PM",
    "end_datetime_raw": "14-01-2026 7:00 PM",
    "start_datetime": "2026-01-03T18:55:00",
    "end_datetime": "2026-01-14T19:00:00",
    "stage": "Bid Award",
    "bid_ra_status": null,
    "technical_status": null,
    "raw_card_text": "BID NO:\u00a0GEM/2026/B/7068876\n\nStatus: Bid Award\n\nItems:\u00a0BOLT CLAMPING 10X65,FOWARED RE...\nQuantity:\u00a016\nDepartment Name And Address:\u00a0\nMinistry of Defence\nDepartment of Military Affairs\nStart Date:\u00a003-01-2026 6:55 PM\nEnd Date:\u00a0\u00a0\u00a014-01-2026 7:00 PM"
  },
  {
    "bid_number": "GEM/2025/B/7010296",
    "bid_detail_url": "https://bidplus.gem.gov.in/showbidDocument/8724215",
    "bid_hover_url": "https://bidplus.gem.gov.in/bidding/bid/getBidResultView/8724215",
    "has_reverse_auction": true,
    "ra_number": "GEM/2026/R/605934",
    "ra_detail_url": "https://bidplus.gem.gov.in/showradocumentPdf/8831721",
    "ra_hover_url": "https://bidplus.gem.gov.in/bidding/bid/getBidResultView/8831721",
    "item": "Precast culvert 2x1.5 mtr,Prec...",
    "quantity": 893,
    "ministry": "Ministry of Defence",
    "department": "Department of Defence",
    "organisation_address": null,
    "start_datetime_raw": "13-01-2026 7:00 PM",
    "end_datetime_raw": "14-01-2026 7:00 PM",
    "start_datetime": "2026-01-13T19:00:00",
    "end_datetime": "2026-01-14T19:00:00",
    "stage": "Bid Award",
    "bid_ra_status": null,
    "technical_status": null,
    "raw_card_text": "Bid No.:\u00a0 GEM/2025/B/7010296\n\nRA NO:\u00a0GEM/2026/R/605934\n\nStatus: Bid Award\n\nItems:\u00a0Precast culvert 2x1.5 mtr,Prec...\nQuantity:\u00a0893\nDepartment Name And Address:\u00a0\nMinistry of Defence\nDepartment of Defence\nStart Date:\u00a013-01-2026 7:00 PM\nEnd Date:\u00a0\u00a0\u00a014-01-2026 7:00 PM"
  },
  {
    "bid_number": "GEM/2025/B/7026986",
    "bid_detail_url": "https://bidplus.gem.gov.in/showbidDocument/8742859",
    "bid_hover_url": "https://bidplus.gem.gov.in/bidding/bid/getBidResultView/8742859",
    "has_reverse_auction": true,
    "ra_number": "GEM/2026/R/605910",
    "ra_detail_url": "https://bidplus.gem.gov.in/showradocumentPdf/8831539",
    "ra_hover_url": "https://bidplus.gem.gov.in/bidding/bid/getBidResultView/8831539",
    "item": "Goods Transport Service \u2013 Per ...",
    "quantity": 4770,
    "ministry": "Ministry of Defence",
    "department": "Department of Defence",
    "organisation_address": null,
    "start_datetime_raw": "13-01-2026 7:00 PM",
    "end_datetime_raw": "14-01-2026 7:00 PM",
    "start_datetime": "2026-01-13T19:00:00",
    "end_datetime": "2026-01-14T19:00:00",
    "stage": "Bid Award",
    "bid_ra_status": null,
    "technical_status": null,
    "raw_card_text": "Bid No.:\u00a0 GEM/2025/B/7026986\n\nRA NO:\u00a0GEM/2026/R/605910\n\nStatus: Bid Award\n\nItems:\u00a0Goods Transport Service \u2013 Per ...\nQuantity:\u00a04770\nDepartment Name And Address:\u00a0\nMinistry of Defence\nDepartment of Defence\nStart Date:\u00a013-01-2026 7:00 PM\nEnd Date:\u00a0\u00a0\u00a014-01-2026 7:00 PM"
  },
  {
    "bid_number": "GEM/2026/B/7068710",
    "bid_detail_url": "https://bidplus.gem.gov.in/showbidDocument/8791507",
    "bid_hover_url": "https://bidplus.gem.gov.in/bidding/bid/getSinglePacketResultView/8791507",
    "has_reverse_auction": false,
    "ra_number": null,
    "ra_detail_url": null,
    "ra_hover_url": null,
    "item": "Bucket Plastic,Mug Plastic,Tab...",
    "quantity": 58,
    "ministry": "Ministry of Defence",
    "department": "Department of Military Affairs",
    "organisation_address": null,
    "start_datetime_raw": "03-01-2026 6:01 PM",
    "end_datetime_raw": "14-01-2026 6:00 PM",
    "start_datetime": "2026-01-03T18:01:00",
    "end_datetime": "2026-01-14T18:00:00",
    "stage": "Bid Award",
    "bid_ra_status": null,
    "technical_status": null,
    "raw_card_text": "BID NO:\u00a0GEM/2026/B/7068710\n\nStatus: Bid Award\n\nItems:\u00a0Bucket Plastic,Mug Plastic,Tab...\nQuantity:\u00a058\nDepartment Name And Address:\u00a0\nMinistry of Defence\nDepartment of Military Affairs\nStart Date:\u00a003-01-2026 6:01 PM\nEnd Date:\u00a0\u00a0\u00a014-01-2026 6:00 PM"
  },
  {
    "bid_number": "GEM/2025/B/6950044",
    "bid_detail_url": "https://bidplus.gem.gov.in/showbidDocument/8655686",
    "bid_hover_url": "https://bidplus.gem.gov.in/bidding/bid/getBidResultView/8655686",
    "has_reverse_auction": true,
    "ra_number": "GEM/2026/R/605777",
    "ra_detail_url": "https://bidplus.gem.gov.in/showradocumentPdf/8830447",
    "ra_hover_url": "https://bidplus.gem.gov.in/bidding/bid/getBidResultView/8830447",
    "item": "Modular Table / Meeting Table ...",
    "quantity": 1173,
    "ministry": "Ministry of Home Affairs",
    "department": "Central Armed Police Forces",
    "organisation_address": null,
    "start_datetime_raw": "13-01-2026 5:00 PM",
    "end_datetime_raw": "14-01-2026 5:57 PM",
    "start_datetime": "2026-01-13T17:00:00",
    "end_datetime": "2026-01-14T17:57:00",
    "stage": "Bid Award",
    "bid_ra_status": null,
    "technical_status": null,
    "raw_card_text": "Bid No.:\u00a0 GEM/2025/B/6950044\n\nRA NO:\u00a0GEM/2026/R/605777\n\nStatus: Bid Award\n\nItems:\u00a0Modular Table / Meeting Table ...\nQuantity:\u00a01173\nDepartment Name And Address:\u00a0\nMinistry of Home Affairs\nCentral Armed Police Forces\nStart Date:\u00a013-01-2026 5:00 PM\nEnd Date:\u00a0\u00a0\u00a014-01-2026 5:57 PM"
  },
  {
    "bid_number": "GEM/2025/B/7004432",
    "bid_detail_url": "https://bidplus.gem.gov.in/showbidDocument/8717602",
    "bid_hover_url": "https://bidplus.gem.gov.in/bidding/bid/getBidResultView/8717602",
    "has_reverse_auction": true,
    "ra_number": "GEM/2026/R/605813",
    "ra_detail_url": "https://bidplus.gem.gov.in/showradocumentPdf/8830687",
    "ra_hover_url": "https://bidplus.gem.gov.in/bidding/bid/getBidResultView/8830687",
    "item": "Winter Road Line marking Stick",
    "quantity": 250,
    "ministry": "Ministry of Defence",
    "department": "Department of Defence",
    "organisation_address": null,
    "start_datetime_raw": "13-01-2026 5:00 PM",
    "end_datetime_raw": "14-01-2026 5:34 PM",
    "start_datetime": "2026-01-13T17:00:00",
    "end_datetime": "2026-01-14T17:34:00",
    "stage": "Bid Award",
    "bid_ra_status": null,
    "technical_status": null,
    "raw_card_text": "Bid No.:\u00a0 GEM/2025/B/7004432\n\nRA NO:\u00a0GEM/2026/R/605813\n\nStatus: Bid Award\n\nItems:\u00a0Winter Road Line marking Stick\nQuantity:\u00a0250\nDepartment Name And Address:\u00a0\nMinistry of Defence\nDepartment of Defence\nStart Date:\u00a013-01-2026 5:00 PM\nEnd Date:\u00a0\u00a0\u00a014-01-2026 5:34 PM"
  },
  {
    "bid_number": "GEM/2025/B/6918622",
    "bid_detail_url": "https://bidplus.gem.gov.in/showbidDocument/8619728",
    "bid_hover_url": "https://bidplus.gem.gov.in/bidding/bid/getBidResultView/8619728",
    "has_reverse_auction": true,
    "ra_number": "GEM/2026/R/605818",
    "ra_detail_url": "https://bidplus.gem.gov.in/showradocumentPdf/8830721",
    "ra_hover_url": "https://bidplus.gem.gov.in/bidding/bid/getBidResultView/8830721",
    "item": "Line Interactive UPS with AVR ...",
    "quantity": 11,
    "ministry": "Health and Family Welfare Department Delhi",
    "department": null,
    "organisation_address": null,
    "start_datetime_raw": "13-01-2026 5:00 PM",
    "end_datetime_raw": "14-01-2026 5:07 PM",
    "start_datetime": "2026-01-13T17:00:00",
    "end_datetime": "2026-01-14T17:07:00",
    "stage": "Bid Award",
    "bid_ra_status": null,
    "technical_status": null,
    "raw_card_text": "Bid No.:\u00a0 GEM/2025/B/6918622\n\nRA NO:\u00a0GEM/2026/R/605818\n\nStatus: Bid Award\n\nItems:\u00a0Line Interactive UPS with AVR ...\nQuantity:\u00a011\nDepartment Name And Address:\u00a0\nHealth and Family Welfare Department Delhi\nStart Date:\u00a013-01-2026 5:00 PM\nEnd Date:\u00a0\u00a0\u00a014-01-2026 5:07 PM"
  },
  {
    "bid_number": "GEM/2026/B/7060204",
    "bid_detail_url": "https://bidplus.gem.gov.in/showbidDocument/8781591",
    "bid_hover_url": "https://bidplus.gem.gov.in/bidding/bid/getBidResultView/8781591",
    "has_reverse_auction": true,
    "ra_number": "GEM/2026/R/605721",
    "ra_detail_url": "https://bidplus.gem.gov.in/showradocumentPdf/8829930",
    "ra_hover_url": "https://bidplus.gem.gov.in/bidding/bid/getBidResultView/8829930",
    "item": "Temperature & Humidity Sensor",
    "quantity": 20,
    "ministry": "Higher Education Department Jammu and Kashmir",
    "department": null,
    "organisation_address": null,
    "start_datetime_raw": "13-01-2026 4:00 PM",
    "end_datetime_raw": "14-01-2026 5:02 PM",
    "start_datetime": "2026-01-13T16:00:00",
    "end_datetime": "2026-01-14T17:02:00",
    "stage": "Bid Award",
    "bid_ra_status": null,
    "technical_status": null,
    "raw_card_text": "Bid No.:\u00a0 GEM/2026/B/7060204\n\nRA NO:\u00a0GEM/2026/R/605721\n\nStatus: Bid Award\n\nItems:\u00a0Temperature & Humidity Sensor\nQuantity:\u00a020\nDepartment Name And Address:\u00a0\nHigher Education Department Jammu and Kashmir\nStart Date:\u00a013-01-2026 4:00 PM\nEnd Date:\u00a0\u00a0\u00a014-01-2026 5:02 PM"
  },
  {
    "bid_number": "GEM/2025/B/7046605",
    "bid_detail_url": "https://bidplus.gem.gov.in/showbidDocument/8765381",
    "bid_hover_url": "https://bidplus.gem.gov.in/bidding/bid/getBidResultView/8765381",
    "has_reverse_auction": true,
    "ra_number": "GEM/2026/R/605667",
    "ra_detail_url": "https://bidplus.gem.gov.in/showradocumentPdf/8829639",
    "ra_hover_url": "https://bidplus.gem.gov.in/bidding/bid/getBidResultView/8829639",
    "item": "Winter Jacket,Shoes-Handicraft",
    "quantity": 4000,
    "ministry": "Housing and Urban Development Department Jammu and Kashmir",
    "department": null,
    "organisation_address": null,
    "start_datetime_raw": "13-01-2026 3:00 PM",
    "end_datetime_raw": "14-01-2026 5:01 PM",
    "start_datetime": "2026-01-13T15:00:00",
    "end_datetime": "2026-01-14T17:01:00",
    "stage": "Bid Award",
    "bid_ra_status": null,
    "technical_status": null,
    "raw_card_text": "Bid No.:\u00a0 GEM/2025/B/7046605\n\nRA NO:\u00a0GEM/2026/R/605667\n\nStatus: Bid Award\n\nItems:\u00a0Winter Jacket,Shoes-Handicraft\nQuantity:\u00a04000\nDepartment Name And Address:\u00a0\nHousing and Urban Development Department Jammu and Kashmir\nStart Date:\u00a013-01-2026 3:00 PM\nEnd Date:\u00a0\u00a0\u00a014-01-2026 5:01 PM"
  },
  {
    "bid_number": "GEM/2025/B/6960380",
    "bid_detail_url": "https://bidplus.gem.gov.in/showbidDocument/8667423",
    "bid_hover_url": "https://bidplus.gem.gov.in/bidding/bid/getBidResultView/8667423",
    "has_reverse_auction": true,
    "ra_number": "GEM/2026/R/605829",
    "ra_detail_url": "https://bidplus.gem.gov.in/showradocumentPdf/8830783",
    "ra_hover_url": "https://bidplus.gem.gov.in/bidding/bid/getBidResultView/8830783",
    "item": "MULTIPURPOSE KNOWLEDGE HUB FOR...",
    "quantity": 1,
    "ministry": "Ministry of Defence",
    "department": "Department of Military Affairs",
    "organisation_address": null,
    "start_datetime_raw": "13-01-2026 5:00 PM",
    "end_datetime_raw": "14-01-2026 5:00 PM",
    "start_datetime": "2026-01-13T17:00:00",
    "end_datetime": "2026-01-14T17:00:00",
    "stage": "Bid Award",
    "bid_ra_status": null,
    "technical_status": null,
    "raw_card_text": "Bid No.:\u00a0 GEM/2025/B/6960380\n\nRA NO:\u00a0GEM/2026/R/605829\n\nStatus: Bid Award\n\nItems:\u00a0MULTIPURPOSE KNOWLEDGE HUB FOR...\nQuantity:\u00a01\nDepartment Name And Address:\u00a0\nMinistry of Defence\nDepartment of Military Affairs\nStart Date:\u00a013-01-2026 5:00 PM\nEnd Date:\u00a0\u00a0\u00a014-01-2026 5:00 PM"
  },
  {
    "bid_number": "GEM/2025/B/7018151",
    "bid_detail_url": "https://bidplus.gem.gov.in/showbidDocument/8732934",
    "bid_hover_url": "https://bidplus.gem.gov.in/bidding/bid/getBidResultView/8732934",
    "has_reverse_auction": true,
    "ra_number": "GEM/2026/R/605790",
    "ra_detail_url": "https://bidplus.gem.gov.in/showradocumentPdf/8830529",
    "ra_hover_url": "https://bidplus.gem.gov.in/bidding/bid/getBidResultView/8830529",
    "item": "Cattle Catcher Vehicle (V4)",
    "quantity": 2,
    "ministry": "Urban Development & Housing Department Bihar",
    "department": null,
    "organisation_address": null,
    "start_datetime_raw": "13-01-2026 5:00 PM",
    "end_datetime_raw": "14-01-2026 5:00 PM",
    "start_datetime": "2026-01-13T17:00:00",
    "end_datetime": "2026-01-14T17:00:00",
    "stage": "Bid Award",
    "bid_ra_status": null,
    "technical_status": null,
    "raw_card_text": "Bid No.:\u00a0 GEM/2025/B/7018151\n\nRA NO:\u00a0GEM/2026/R/605790\n\nStatus: Bid Award\n\nItems:\u00a0Cattle Catcher Vehicle (V4)\nQuantity:\u00a02\nDepartment Name And Address:\u00a0\nUrban Development & Housing Department Bihar\nStart Date:\u00a013-01-2026 5:00 PM\nEnd Date:\u00a0\u00a0\u00a014-01-2026 5:00 PM"
  },
  {
    "bid_number": "GEM/2025/B/6980834",
    "bid_detail_url": "https://bidplus.gem.gov.in/showbidDocument/8691257",
    "bid_hover_url": "https://bidplus.gem.gov.in/bidding/bid/getBidResultView/8691257",
    "has_reverse_auction": true,
    "ra_number": "GEM/2026/R/605387",
    "ra_detail_url": "https://bidplus.gem.gov.in/showradocumentPdf/8827953",
    "ra_hover_url": "https://bidplus.gem.gov.in/bidding/bid/getBidResultView/8827953",
    "item": "PERSONAL NOTEBOOK",
    "quantity": 38,
    "ministry": "Ministry of Defence",
    "department": "Department of Military Affairs",
    "organisation_address": null,
    "start_datetime_raw": "13-01-2026 12:00 PM",
    "end_datetime_raw": "14-01-2026 4:45 PM",
    "start_datetime": "2026-01-13T12:00:00",
    "end_datetime": "2026-01-14T16:45:00",
    "stage": "Bid Award",
    "bid_ra_status": null,
    "technical_status": null,
    "raw_card_text": "Bid No.:\u00a0 GEM/2025/B/6980834\n\nRA NO:\u00a0GEM/2026/R/605387\n\nStatus: Bid Award\n\nItems:\u00a0PERSONAL NOTEBOOK\nQuantity:\u00a038\nDepartment Name And Address:\u00a0\nMinistry of Defence\nDepartment of Military Affairs\nStart Date:\u00a013-01-2026 12:00 PM\nEnd Date:\u00a0\u00a0\u00a014-01-2026 4:45 PM"
  },
  {
    "bid_number": "GEM/2025/B/7013527",
    "bid_detail_url": "https://bidplus.gem.gov.in/showbidDocument/8727774",
    "bid_hover_url": "https://bidplus.gem.gov.in/bidding/bid/getBidResultView/8727774",
    "has_reverse_auction": true,
    "ra_number": "GEM/2026/R/605740",
    "ra_detail_url": "https://bidplus.gem.gov.in/showradocumentPdf/8830186",
    "ra_hover_url": "https://bidplus.gem.gov.in/bidding/bid/getBidResultView/8830186",
    "item": "65 inch Display,UPS 1 KVA,Dual...",
    "quantity": 76,
    "ministry": "Social Welfare Department Jammu and Kashmir",
    "department": null,
    "organisation_address": null,
    "start_datetime_raw": "13-01-2026 4:00 PM",
    "end_datetime_raw": "14-01-2026 4:27 PM",
    "start_datetime": "2026-01-13T16:00:00",
    "end_datetime": "2026-01-14T16:27:00",
    "stage": "Bid Award",
    "bid_ra_status": null,
    "technical_status": null,
    "raw_card_text": "Bid No.:\u00a0 GEM/2025/B/7013527\n\nRA NO:\u00a0GEM/2026/R/605740\n\nStatus: Bid Award\n\nItems:\u00a065 inch Display,UPS 1 KVA,Dual...\nQuantity:\u00a076\nDepartment Name And Address:\u00a0\nSocial Welfare Department Jammu and Kashmir\nStart Date:\u00a013-01-2026 4:00 PM\nEnd Date:\u00a0\u00a0\u00a014-01-2026 4:27 PM"
  },
  {
    "bid_number": "GEM/2025/B/6963065",
    "bid_detail_url": "https://bidplus.gem.gov.in/showbidDocument/8670455",
    "bid_hover_url": "https://bidplus.gem.gov.in/bidding/bid/getBidResultView/8670455",
    "has_reverse_auction": true,
    "ra_number": "GEM/2026/R/605730",
    "ra_detail_url": "https://bidplus.gem.gov.in/showradocumentPdf/8830063",
    "ra_hover_url": "https://bidplus.gem.gov.in/bidding/bid/getBidResultView/8830063",
    "item": "Event or Seminar or Workshop o...",
    "quantity": 1,
    "ministry": "Ministry of Defence",
    "department": "Department of Defence",
    "organisation_address": null,
    "start_datetime_raw": "13-01-2026 4:00 PM",
    "end_datetime_raw": "14-01-2026 4:12 PM",
    "start_datetime": "2026-01-13T16:00:00",
    "end_datetime": "2026-01-14T16:12:00",
    "stage": "Bid Award",
    "bid_ra_status": null,
    "technical_status": null,
    "raw_card_text": "Bid No.:\u00a0 GEM/2025/B/6963065\n\nRA NO:\u00a0GEM/2026/R/605730\n\nStatus: Bid Award\n\nItems:\u00a0Event or Seminar or Workshop o...\nQuantity:\u00a01\nDepartment Name And Address:\u00a0\nMinistry of Defence\nDepartment of Defence\nStart Date:\u00a013-01-2026 4:00 PM\nEnd Date:\u00a0\u00a0\u00a014-01-2026 4:12 PM"
  },
  {
    "bid_number": "GEM/2025/B/6938367",
    "bid_detail_url": "https://bidplus.gem.gov.in/showbidDocument/8642340",
    "bid_hover_url": "https://bidplus.gem.gov.in/bidding/bid/getBidResultView/8642340",
    "has_reverse_auction": true,
    "ra_number": "GEM/2026/R/601217",
    "ra_detail_url": "https://bidplus.gem.gov.in/showradocumentPdf/8792355",
    "ra_hover_url": "https://bidplus.gem.gov.in/bidding/bid/getBidResultView/8792355",
    "item": "Motor tube stand and puller se...",
    "quantity": 1,
    "ministry": "Ministry of Defence",
    "department": "Department of Military Affairs",
    "organisation_address": null,
    "start_datetime_raw": "05-01-2026 1:00 PM",
    "end_datetime_raw": "14-01-2026 4:00 PM",
    "start_datetime": "2026-01-05T13:00:00",
    "end_datetime": "2026-01-14T16:00:00",
    "stage": "Bid Award",
    "bid_ra_status": null,
    "technical_status": null,
    "raw_card_text": "Bid No.:\u00a0 GEM/2025/B/6938367\n\nRA NO:\u00a0GEM/2026/R/601217\n\nStatus: Bid Award\n\nItems:\u00a0Motor tube stand and puller se...\nQuantity:\u00a01\nDepartment Name And Address:\u00a0\nMinistry of Defence\nDepartment of Military Affairs\nStart Date:\u00a005-01-2026 1:00 PM\nEnd Date:\u00a0\u00a0\u00a014-01-2026 4:00 PM"
  },
  {
    "bid_number": "GEM/2026/B/7064700",
    "bid_detail_url": "https://bidplus.gem.gov.in/showbidDocument/8787016",
    "bid_hover_url": "https://bidplus.gem.gov.in/bidding/bid/getSinglePacketResultView/8787016",
    "has_reverse_auction": false,
    "ra_number": null,
    "ra_detail_url": null,
    "ra_hover_url": null,
    "item": "VALVE RELAY AIR PRESSURE,MANUA...",
    "quantity": 10,
    "ministry": "Ministry of Defence",
    "department": "Department of Military Affairs",
    "organisation_address": null,
    "start_datetime_raw": "02-01-2026 6:09 PM",
    "end_datetime_raw": "14-01-2026 4:00 PM",
    "start_datetime": "2026-01-02T18:09:00",
    "end_datetime": "2026-01-14T16:00:00",
    "stage": "Bid Award",
    "bid_ra_status": null,
    "technical_status": null,
    "raw_card_text": "BID NO:\u00a0GEM/2026/B/7064700\n\nStatus: Bid Award\n\nItems:\u00a0VALVE RELAY AIR PRESSURE,MANUA...\nQuantity:\u00a010\nDepartment Name And Address:\u00a0\nMinistry of Defence\nDepartment of Military Affairs\nStart Date:\u00a002-01-2026 6:09 PM\nEnd Date:\u00a0\u00a0\u00a014-01-2026 4:00 PM"
  },
  {
    "bid_number": "GEM/2025/B/6960793",
    "bid_detail_url": "https://bidplus.gem.gov.in/showbidDocument/8667900",
    "bid_hover_url": "https://bidplus.gem.gov.in/bidding/bid/getBidResultView/8667900",
    "has_reverse_auction": true,
    "ra_number": "GEM/2026/R/605769",
    "ra_detail_url": "https://bidplus.gem.gov.in/showradocumentPdf/8830365",
    "ra_hover_url": "https://bidplus.gem.gov.in/bidding/bid/getBidResultView/8830365",
    "item": "Network Attached Storage (V2),...",
    "quantity": 2,
    "ministry": "Ministry of Defence",
    "department": "Department of Military Affairs",
    "organisation_address": null,
    "start_datetime_raw": "13-01-2026 4:00 PM",
    "end_datetime_raw": "14-01-2026 4:00 PM",
    "start_datetime": "2026-01-13T16:00:00",
    "end_datetime": "2026-01-14T16:00:00",
    "stage": "Bid Award",
    "bid_ra_status": null,
    "technical_status": null,
    "raw_card_text": "Bid No.:\u00a0 GEM/2025/B/6960793\n\nRA NO:\u00a0GEM/2026/R/605769\n\nStatus: Bid Award\n\nItems:\u00a0Network Attached Storage (V2),...\nQuantity:\u00a02\nDepartment Name And Address:\u00a0\nMinistry of Defence\nDepartment of Military Affairs\nStart Date:\u00a013-01-2026 4:00 PM\nEnd Date:\u00a0\u00a0\u00a014-01-2026 4:00 PM"
  },
  {
    "bid_number": "GEM/2025/B/6959374",
    "bid_detail_url": "https://bidplus.gem.gov.in/showbidDocument/8666339",
    "bid_hover_url": "https://bidplus.gem.gov.in/bidding/bid/getBidResultView/8666339",
    "has_reverse_auction": true,
    "ra_number": "GEM/2026/R/605763",
    "ra_detail_url": "https://bidplus.gem.gov.in/showradocumentPdf/8830333",
    "ra_hover_url": "https://bidplus.gem.gov.in/bidding/bid/getBidResultView/8830333",
    "item": "Professional Large Format Disp...",
    "quantity": 61,
    "ministry": "Ministry of Defence",
    "department": "Department of Military Affairs",
    "organisation_address": null,
    "start_datetime_raw": "13-01-2026 4:00 PM",
    "end_datetime_raw": "14-01-2026 4:00 PM",
    "start_datetime": "2026-01-13T16:00:00",
    "end_datetime": "2026-01-14T16:00:00",
    "stage": "Bid Award",
    "bid_ra_status": null,
    "technical_status": null,
    "raw_card_text": "Bid No.:\u00a0 GEM/2025/B/6959374\n\nRA NO:\u00a0GEM/2026/R/605763\n\nStatus: Bid Award\n\nItems:\u00a0Professional Large Format Disp...\nQuantity:\u00a061\nDepartment Name And Address:\u00a0\nMinistry of Defence\nDepartment of Military Affairs\nStart Date:\u00a013-01-2026 4:00 PM\nEnd Date:\u00a0\u00a0\u00a014-01-2026 4:00 PM"
  },
  {
    "bid_number": "GEM/2025/B/6938501",
    "bid_detail_url": "https://bidplus.gem.gov.in/showbidDocument/8642484",
    "bid_hover_url": "https://bidplus.gem.gov.in/bidding/bid/getBidResultView/8642484",
    "has_reverse_auction": true,
    "ra_number": "GEM/2026/R/601216",
    "ra_detail_url": "https://bidplus.gem.gov.in/showradocumentPdf/8792349",
    "ra_hover_url": "https://bidplus.gem.gov.in/bidding/bid/getBidResultView/8792349",
    "item": "Integration fixture for pinaka...",
    "quantity": 1,
    "ministry": "Ministry of Defence",
    "department": "Department of Military Affairs",
    "organisation_address": null,
    "start_datetime_raw": "05-01-2026 1:00 PM",
    "end_datetime_raw": "14-01-2026 4:00 PM",
    "start_datetime": "2026-01-05T13:00:00",
    "end_datetime": "2026-01-14T16:00:00",
    "stage": "Bid Award",
    "bid_ra_status": null,
    "technical_status": null,
    "raw_card_text": "Bid No.:\u00a0 GEM/2025/B/6938501\n\nRA NO:\u00a0GEM/2026/R/601216\n\nStatus: Bid Award\n\nItems:\u00a0Integration fixture for pinaka...\nQuantity:\u00a01\nDepartment Name And Address:\u00a0\nMinistry of Defence\nDepartment of Military Affairs\nStart Date:\u00a005-01-2026 1:00 PM\nEnd Date:\u00a0\u00a0\u00a014-01-2026 4:00 PM"
  },
  {
    "bid_number": "GEM/2025/B/7047753",
    "bid_detail_url": "https://bidplus.gem.gov.in/showbidDocument/8766753",
    "bid_hover_url": "https://bidplus.gem.gov.in/bidding/bid/getBidResultView/8766753",
    "has_reverse_auction": true,
    "ra_number": "GEM/2026/R/605673",
    "ra_detail_url": "https://bidplus.gem.gov.in/showradocumentPdf/8829685",
    "ra_hover_url": "https://bidplus.gem.gov.in/bidding/bid/getBidResultView/8829685",
    "item": "LV6 MT14 NIV 01 2023 TYRE TYRE...",
    "quantity": 140,
    "ministry": "Ministry of Defence",
    "department": "Department of Military Affairs",
    "organisation_address": null,
    "start_datetime_raw": "13-01-2026 3:00 PM",
    "end_datetime_raw": "14-01-2026 3:00 PM",
    "start_datetime": "2026-01-13T15:00:00",
    "end_datetime": "2026-01-14T15:00:00",
    "stage": "Bid Award",
    "bid_ra_status": null,
    "technical_status": null,
    "raw_card_text": "Bid No.:\u00a0 GEM/2025/B/7047753\n\nRA NO:\u00a0GEM/2026/R/605673\n\nStatus: Bid Award\n\nItems:\u00a0LV6 MT14 NIV 01 2023 TYRE TYRE...\nQuantity:\u00a0140\nDepartment Name And Address:\u00a0\nMinistry of Defence\nDepartment of Military Affairs\nStart Date:\u00a013-01-2026 3:00 PM\nEnd Date:\u00a0\u00a0\u00a014-01-2026 3:00 PM"
  },
  {
    "bid_number": "GEM/2026/B/7067608",
    "bid_detail_url": "https://bidplus.gem.gov.in/showbidDocument/8790280",
    "bid_hover_url": "https://bidplus.gem.gov.in/bidding/bid/getSinglePacketResultView/8790280",
    "has_reverse_auction": false,
    "ra_number": null,
    "ra_detail_url": null,
    "ra_hover_url": null,
    "item": "Signage Board (V4)",
    "quantity": 47,
    "ministry": "Ministry of Defence",
    "department": "Department of Military Affairs",
    "organisation_address": null,
    "start_datetime_raw": "03-01-2026 2:24 PM",
    "end_datetime_raw": "14-01-2026 3:00 PM",
    "start_datetime": "2026-01-03T14:24:00",
    "end_datetime": "2026-01-14T15:00:00",
    "stage": "Bid Award",
    "bid_ra_status": null,
    "technical_status": null,
    "raw_card_text": "BID NO:\u00a0GEM/2026/B/7067608\n\nStatus: Bid Award\n\nItems:\u00a0Signage Board (V4)\nQuantity:\u00a047\nDepartment Name And Address:\u00a0\nMinistry of Defence\nDepartment of Military Affairs\nStart Date:\u00a003-01-2026 2:24 PM\nEnd Date:\u00a0\u00a0\u00a014-01-2026 3:00 PM"
  },
  {
    "bid_number": "GEM/2026/B/7067572",
    "bid_detail_url": "https://bidplus.gem.gov.in/showbidDocument/8790239",
    "bid_hover_url": "https://bidplus.gem.gov.in/bidding/bid/getSinglePacketResultView/8790239",
    "has_reverse_auction": false,
    "ra_number": null,
    "ra_detail_url": null,
    "ra_hover_url": null,
    "item": "Signage Board (V4)",
    "quantity": 1,
    "ministry": "Ministry of Defence",
    "department": "Department of Military Affairs",
    "organisation_address": null,
    "start_datetime_raw": "03-01-2026 2:17 PM",
    "end_datetime_raw": "14-01-2026 3:00 PM",
    "start_datetime": "2026-01-03T14:17:00",
    "end_datetime": "2026-01-14T15:00:00",
    "stage": "Bid Award",
    "bid_ra_status": null,
    "technical_status": null,
    "raw_card_text": "BID NO:\u00a0GEM/2026/B/7067572\n\nStatus: Bid Award\n\nItems:\u00a0Signage Board (V4)\nQuantity:\u00a01\nDepartment Name And Address:\u00a0\nMinistry of Defence\nDepartment of Military Affairs\nStart Date:\u00a003-01-2026 2:17 PM\nEnd Date:\u00a0\u00a0\u00a014-01-2026 3:00 PM"
  },
  {
    "bid_number": "GEM/2025/B/7040514",
    "bid_detail_url": "https://bidplus.gem.gov.in/showbidDocument/8758386",
    "bid_hover_url": "https://bidplus.gem.gov.in/bidding/bid/getBidResultView/8758386",
    "has_reverse_auction": false,
    "ra_number": null,
    "ra_detail_url": null,
    "ra_hover_url": null,
    "item": "Online UPS (?10 KVA) With Batt...",
    "quantity": 1,
    "ministry": "Ministry of Micro Small and Medium Enterprises",
    "department": "Ministry of Micro Small and Medium Enterprises",
    "organisation_address": null,
    "start_datetime_raw": "24-12-2025 2:49 PM",
    "end_datetime_raw": "14-01-2026 3:00 PM",
    "start_datetime": "2025-12-24T14:49:00",
    "end_datetime": "2026-01-14T15:00:00",
    "stage": "Bid Award",
    "bid_ra_status": null,
    "technical_status": null,
    "raw_card_text": "BID NO:\u00a0GEM/2025/B/7040514\n\nStatus: Bid Award\n\nItems:\u00a0Online UPS (?10 KVA) With Batt...\nQuantity:\u00a01\nDepartment Name And Address:\u00a0\nMinistry of Micro Small and Medium Enterprises\nMinistry of Micro Small and Medium Enterprises\nStart Date:\u00a024-12-2025 2:49 PM\nEnd Date:\u00a0\u00a0\u00a014-01-2026 3:00 PM"
  },
  {
    "bid_number": "GEM/2025/B/7014524",
    "bid_detail_url": "https://bidplus.gem.gov.in/showbidDocument/8728877",
    "bid_hover_url": "https://bidplus.gem.gov.in/bidding/bid/getBidResultView/8728877",
    "has_reverse_auction": false,
    "ra_number": null,
    "ra_detail_url": null,
    "ra_hover_url": null,
    "item": "Chuna,Kingfog,nuvan or banner,...",
    "quantity": 25600,
    "ministry": "Urban Development Department Uttar Pradesh",
    "department": null,
    "organisation_address": null,
    "start_datetime_raw": "30-12-2025 2:46 PM",
    "end_datetime_raw": "14-01-2026 3:00 PM",
    "start_datetime": "2025-12-30T14:46:00",
    "end_datetime": "2026-01-14T15:00:00",
    "stage": "Bid Award",
    "bid_ra_status": null,
    "technical_status": null,
    "raw_card_text": "BID NO:\u00a0GEM/2025/B/7014524\n\nStatus: Bid Award\n\nItems:\u00a0Chuna,Kingfog,nuvan or banner,...\nQuantity:\u00a025600\nDepartment Name And Address:\u00a0\nUrban Development Department Uttar Pradesh\nStart Date:\u00a030-12-2025 2:46 PM\nEnd Date:\u00a0\u00a0\u00a014-01-2026 3:00 PM"
  },
  {
    "bid_number": "GEM/2025/B/7019685",
    "bid_detail_url": "https://bidplus.gem.gov.in/showbidDocument/8734626",
    "bid_hover_url": "https://bidplus.gem.gov.in/bidding/bid/getBidResultView/8734626",
    "has_reverse_auction": true,
    "ra_number": "GEM/2026/R/605662",
    "ra_detail_url": "https://bidplus.gem.gov.in/showradocumentPdf/8829620",
    "ra_hover_url": "https://bidplus.gem.gov.in/bidding/bid/getBidResultView/8829620",
    "item": "Reverse Osmosis based Water Tr...",
    "quantity": 9,
    "ministry": "Agriculture Department Uttar Pradesh",
    "department": null,
    "organisation_address": null,
    "start_datetime_raw": "13-01-2026 3:00 PM",
    "end_datetime_raw": "14-01-2026 3:00 PM",
    "start_datetime": "2026-01-13T15:00:00",
    "end_datetime": "2026-01-14T15:00:00",
    "stage": "Bid Award",
    "bid_ra_status": null,
    "technical_status": null,
    "raw_card_text": "Bid No.:\u00a0 GEM/2025/B/7019685\n\nRA NO:\u00a0GEM/2026/R/605662\n\nStatus: Bid Award\n\nItems:\u00a0Reverse Osmosis based Water Tr...\nQuantity:\u00a09\nDepartment Name And Address:\u00a0\nAgriculture Department Uttar Pradesh\nStart Date:\u00a013-01-2026 3:00 PM\nEnd Date:\u00a0\u00a0\u00a014-01-2026 3:00 PM"
  },
  {
    "bid_number": "GEM/2025/B/6755306",
    "bid_detail_url": "https://bidplus.gem.gov.in/showbidDocument/8433305",
    "bid_hover_url": "https://bidplus.gem.gov.in/bidding/bid/getBidResultView/8433305",
    "has_reverse_auction": true,
    "ra_number": "GEM/2026/R/605683",
    "ra_detail_url": "https://bidplus.gem.gov.in/showradocumentPdf/8829722",
    "ra_hover_url": "https://bidplus.gem.gov.in/bidding/bid/getBidResultView/8829722",
    "item": "Speaker,Amplifier Machine,Wire...",
    "quantity": 14,
    "ministry": "Ministry of Defence",
    "department": "Department of Military Affairs",
    "organisation_address": null,
    "start_datetime_raw": "13-01-2026 3:00 PM",
    "end_datetime_raw": "14-01-2026 3:00 PM",
    "start_datetime": "2026-01-13T15:00:00",
    "end_datetime": "2026-01-14T15:00:00",
    "stage": "Bid Award",
    "bid_ra_status": null,
    "technical_status": null,
    "raw_card_text": "Bid No.:\u00a0 GEM/2025/B/6755306\n\nRA NO:\u00a0GEM/2026/R/605683\n\nStatus: Bid Award\n\nItems:\u00a0Speaker,Amplifier Machine,Wire...\nQuantity:\u00a014\nDepartment Name And Address:\u00a0\nMinistry of Defence\nDepartment of Military Affairs\nStart Date:\u00a013-01-2026 3:00 PM\nEnd Date:\u00a0\u00a0\u00a014-01-2026 3:00 PM"
  },
  {
    "bid_number": "GEM/2025/B/7057998",
    "bid_detail_url": "https://bidplus.gem.gov.in/showbidDocument/8778959",
    "bid_hover_url": "https://bidplus.gem.gov.in/bidding/bid/getBidResultView/8778959",
    "has_reverse_auction": true,
    "ra_number": "GEM/2026/R/605557",
    "ra_detail_url": "https://bidplus.gem.gov.in/showradocumentPdf/8828934",
    "ra_hover_url": "https://bidplus.gem.gov.in/bidding/bid/getBidResultView/8828934",
    "item": "PROCUREMENT OF NORRIS DENTAL I...",
    "quantity": 25,
    "ministry": "Ministry of Defence",
    "department": "Department of Military Affairs",
    "organisation_address": null,
    "start_datetime_raw": "13-01-2026 1:00 PM",
    "end_datetime_raw": "14-01-2026 2:20 PM",
    "start_datetime": "2026-01-13T13:00:00",
    "end_datetime": "2026-01-14T14:20:00",
    "stage": "Bid Award",
    "bid_ra_status": null,
    "technical_status": null,
    "raw_card_text": "Bid No.:\u00a0 GEM/2025/B/7057998\n\nRA NO:\u00a0GEM/2026/R/605557\n\nStatus: Bid Award\n\nItems:\u00a0PROCUREMENT OF NORRIS DENTAL I...\nQuantity:\u00a025\nDepartment Name And Address:\u00a0\nMinistry of Defence\nDepartment of Military Affairs\nStart Date:\u00a013-01-2026 1:00 PM\nEnd Date:\u00a0\u00a0\u00a014-01-2026 2:20 PM"
  },
  {
    "bid_number": "GEM/2026/B/7069598",
    "bid_detail_url": "https://bidplus.gem.gov.in/showbidDocument/8792481",
    "bid_hover_url": "https://bidplus.gem.gov.in/bidding/bid/getSinglePacketResultView/8792481",
    "has_reverse_auction": false,
    "ra_number": null,
    "ra_detail_url": null,
    "ra_hover_url": null,
    "item": "eng trg Lab Display name bd si...",
    "quantity": 24,
    "ministry": "Ministry of Defence",
    "department": "Department of Military Affairs",
    "organisation_address": null,
    "start_datetime_raw": "04-01-2026 1:57 PM",
    "end_datetime_raw": "14-01-2026 2:00 PM",
    "start_datetime": "2026-01-04T13:57:00",
    "end_datetime": "2026-01-14T14:00:00",
    "stage": "Bid Award",
    "bid_ra_status": null,
    "technical_status": null,
    "raw_card_text": "BID NO:\u00a0GEM/2026/B/7069598\n\nStatus: Bid Award\n\nItems:\u00a0eng trg Lab Display name bd si...\nQuantity:\u00a024\nDepartment Name And Address:\u00a0\nMinistry of Defence\nDepartment of Military Affairs\nStart Date:\u00a004-01-2026 1:57 PM\nEnd Date:\u00a0\u00a0\u00a014-01-2026 2:00 PM"
  },
  {
    "bid_number": "GEM/2026/B/7067048",
    "bid_detail_url": "https://bidplus.gem.gov.in/showbidDocument/8789646",
    "bid_hover_url": "https://bidplus.gem.gov.in/bidding/bid/getBidResultView/8789646",
    "has_reverse_auction": false,
    "ra_number": null,
    "ra_detail_url": null,
    "ra_hover_url": null,
    "item": "Assy Wheel Cyl 44MM,Wheel Cyl ...",
    "quantity": 29,
    "ministry": "Ministry of Defence",
    "department": "Department of Military Affairs",
    "organisation_address": null,
    "start_datetime_raw": "03-01-2026 6:52 PM",
    "end_datetime_raw": "14-01-2026 2:00 PM",
    "start_datetime": "2026-01-03T18:52:00",
    "end_datetime": "2026-01-14T14:00:00",
    "stage": "Bid Award",
    "bid_ra_status": null,
    "technical_status": null,
    "raw_card_text": "BID NO:\u00a0GEM/2026/B/7067048\n\nStatus: Bid Award\n\nItems:\u00a0Assy Wheel Cyl 44MM,Wheel Cyl ...\nQuantity:\u00a029\nDepartment Name And Address:\u00a0\nMinistry of Defence\nDepartment of Military Affairs\nStart Date:\u00a003-01-2026 6:52 PM\nEnd Date:\u00a0\u00a0\u00a014-01-2026 2:00 PM"
  },
  {
    "bid_number": "GEM/2025/B/7047364",
    "bid_detail_url": "https://bidplus.gem.gov.in/showbidDocument/8766289",
    "bid_hover_url": "https://bidplus.gem.gov.in/bidding/bid/getBidResultView/8766289",
    "has_reverse_auction": true,
    "ra_number": "GEM/2026/R/604854",
    "ra_detail_url": "https://bidplus.gem.gov.in/showradocumentPdf/8824333",
    "ra_hover_url": "https://bidplus.gem.gov.in/bidding/bid/getBidResultView/8824333",
    "item": "Self Propelled Electro Hydraul...",
    "quantity": 8,
    "ministry": "Ministry of Defence",
    "department": "Department of Military Affairs",
    "organisation_address": null,
    "start_datetime_raw": "11-01-2026 2:00 PM",
    "end_datetime_raw": "14-01-2026 2:00 PM",
    "start_datetime": "2026-01-11T14:00:00",
    "end_datetime": "2026-01-14T14:00:00",
    "stage": "Bid Award",
    "bid_ra_status": null,
    "technical_status": null,
    "raw_card_text": "Bid No.:\u00a0 GEM/2025/B/7047364\n\nRA NO:\u00a0GEM/2026/R/604854\n\nStatus: Bid Award\n\nItems:\u00a0Self Propelled Electro Hydraul...\nQuantity:\u00a08\nDepartment Name And Address:\u00a0\nMinistry of Defence\nDepartment of Military Affairs\nStart Date:\u00a011-01-2026 2:00 PM\nEnd Date:\u00a0\u00a0\u00a014-01-2026 2:00 PM"
  },
  {
    "bid_number": "GEM/2025/B/7045279",
    "bid_detail_url": "https://bidplus.gem.gov.in/showbidDocument/8763841",
    "bid_hover_url": "https://bidplus.gem.gov.in/bidding/bid/getBidResultView/8763841",
    "has_reverse_auction": false,
    "ra_number": null,
    "ra_detail_url": null,
    "ra_hover_url": null,
    "item": "DIGITAL SMART SCREEN WITH ALL ...",
    "quantity": 174,
    "ministry": "Public Works Department Madhya Pradesh",
    "department": null,
    "organisation_address": null,
    "start_datetime_raw": "29-12-2025 1:08 PM",
    "end_datetime_raw": "14-01-2026 2:00 PM",
    "start_datetime": "2025-12-29T13:08:00",
    "end_datetime": "2026-01-14T14:00:00",
    "stage": "Bid Award",
    "bid_ra_status": null,
    "technical_status": null,
    "raw_card_text": "BID NO:\u00a0GEM/2025/B/7045279\n\nStatus: Bid Award\n\nItems:\u00a0DIGITAL SMART SCREEN WITH ALL ...\nQuantity:\u00a0174\nDepartment Name And Address:\u00a0\nPublic Works Department Madhya Pradesh\nStart Date:\u00a029-12-2025 1:08 PM\nEnd Date:\u00a0\u00a0\u00a014-01-2026 2:00 PM"
  },
  {
    "bid_number": "GEM/2025/B/6972381",
    "bid_detail_url": "https://bidplus.gem.gov.in/showbidDocument/8680961",
    "bid_hover_url": "https://bidplus.gem.gov.in/bidding/bid/getBidResultView/8680961",
    "has_reverse_auction": true,
    "ra_number": "GEM/2026/R/605592",
    "ra_detail_url": "https://bidplus.gem.gov.in/showradocumentPdf/8829218",
    "ra_hover_url": "https://bidplus.gem.gov.in/bidding/bid/getBidResultView/8829218",
    "item": "5 Part Automated Hematology An...",
    "quantity": 3,
    "ministry": "Panchayats and Rural Housing Department Gujarat",
    "department": null,
    "organisation_address": null,
    "start_datetime_raw": "13-01-2026 2:00 PM",
    "end_datetime_raw": "14-01-2026 2:00 PM",
    "start_datetime": "2026-01-13T14:00:00",
    "end_datetime": "2026-01-14T14:00:00",
    "stage": "Bid Award",
    "bid_ra_status": null,
    "technical_status": null,
    "raw_card_text": "Bid No.:\u00a0 GEM/2025/B/6972381\n\nRA NO:\u00a0GEM/2026/R/605592\n\nStatus: Bid Award\n\nItems:\u00a05 Part Automated Hematology An...\nQuantity:\u00a03\nDepartment Name And Address:\u00a0\nPanchayats and Rural Housing Department Gujarat\nStart Date:\u00a013-01-2026 2:00 PM\nEnd Date:\u00a0\u00a0\u00a014-01-2026 2:00 PM"
  },
  {
    "bid_number": "GEM/2025/B/6998567",
    "bid_detail_url": "https://bidplus.gem.gov.in/showbidDocument/8710851",
    "bid_hover_url": "https://bidplus.gem.gov.in/bidding/bid/getBidResultView/8710851",
    "has_reverse_auction": true,
    "ra_number": "GEM/2026/R/605595",
    "ra_detail_url": "https://bidplus.gem.gov.in/showradocumentPdf/8829240",
    "ra_hover_url": "https://bidplus.gem.gov.in/bidding/bid/getBidResultView/8829240",
    "item": "DOLOMITE GRANULES",
    "quantity": 10000,
    "ministry": "Forests and Environment Department Gujarat",
    "department": null,
    "organisation_address": null,
    "start_datetime_raw": "13-01-2026 2:00 PM",
    "end_datetime_raw": "14-01-2026 2:00 PM",
    "start_datetime": "2026-01-13T14:00:00",
    "end_datetime": "2026-01-14T14:00:00",
    "stage": "Bid Award",
    "bid_ra_status": null,
    "technical_status": null,
    "raw_card_text": "Bid No.:\u00a0 GEM/2025/B/6998567\n\nRA NO:\u00a0GEM/2026/R/605595\n\nStatus: Bid Award\n\nItems:\u00a0DOLOMITE GRANULES\nQuantity:\u00a010000\nDepartment Name And Address:\u00a0\nForests and Environment Department Gujarat\nStart Date:\u00a013-01-2026 2:00 PM\nEnd Date:\u00a0\u00a0\u00a014-01-2026 2:00 PM"
  },
  {
    "bid_number": "GEM/2025/B/7026491",
    "bid_detail_url": "https://bidplus.gem.gov.in/showbidDocument/8742290",
    "bid_hover_url": "https://bidplus.gem.gov.in/bidding/bid/getBidResultView/8742290",
    "has_reverse_auction": true,
    "ra_number": "GEM/2026/R/605624",
    "ra_detail_url": "https://bidplus.gem.gov.in/showradocumentPdf/8829408",
    "ra_hover_url": "https://bidplus.gem.gov.in/bidding/bid/getBidResultView/8829408",
    "item": "Taking down carefully unservic...",
    "quantity": 421,
    "ministry": "Ministry of Defence",
    "department": "Department of Military Affairs",
    "organisation_address": null,
    "start_datetime_raw": "13-01-2026 2:00 PM",
    "end_datetime_raw": "14-01-2026 2:00 PM",
    "start_datetime": "2026-01-13T14:00:00",
    "end_datetime": "2026-01-14T14:00:00",
    "stage": "Bid Award",
    "bid_ra_status": null,
    "technical_status": null,
    "raw_card_text": "Bid No.:\u00a0 GEM/2025/B/7026491\n\nRA NO:\u00a0GEM/2026/R/605624\n\nStatus: Bid Award\n\nItems:\u00a0Taking down carefully unservic...\nQuantity:\u00a0421\nDepartment Name And Address:\u00a0\nMinistry of Defence\nDepartment of Military Affairs\nStart Date:\u00a013-01-2026 2:00 PM\nEnd Date:\u00a0\u00a0\u00a014-01-2026 2:00 PM"
  },
  {
    "bid_number": "GEM/2025/B/6924593",
    "bid_detail_url": "https://bidplus.gem.gov.in/showbidDocument/8626625",
    "bid_hover_url": "https://bidplus.gem.gov.in/bidding/bid/getBidResultView/8626625",
    "has_reverse_auction": true,
    "ra_number": "GEM/2026/R/605501",
    "ra_detail_url": "https://bidplus.gem.gov.in/showradocumentPdf/8828626",
    "ra_hover_url": "https://bidplus.gem.gov.in/bidding/bid/getBidResultView/8828626",
    "item": "SUPPLY AND INSTALLATION OF AN ...",
    "quantity": 1,
    "ministry": "SKUAST Kashmir",
    "department": null,
    "organisation_address": null,
    "start_datetime_raw": "13-01-2026 1:00 PM",
    "end_datetime_raw": "14-01-2026 1:25 PM",
    "start_datetime": "2026-01-13T13:00:00",
    "end_datetime": "2026-01-14T13:25:00",
    "stage": "Bid Award",
    "bid_ra_status": null,
    "technical_status": null,
    "raw_card_text": "Bid No.:\u00a0 GEM/2025/B/6924593\n\nRA NO:\u00a0GEM/2026/R/605501\n\nStatus: Bid Award\n\nItems:\u00a0SUPPLY AND INSTALLATION OF AN ...\nQuantity:\u00a01\nDepartment Name And Address:\u00a0\nSKUAST Kashmir\nStart Date:\u00a013-01-2026 1:00 PM\nEnd Date:\u00a0\u00a0\u00a014-01-2026 1:25 PM"
  },
  {
    "bid_number": "GEM/2025/B/6968199",
    "bid_detail_url": "https://bidplus.gem.gov.in/showbidDocument/8676263",
    "bid_hover_url": "https://bidplus.gem.gov.in/bidding/bid/getBidResultView/8676263",
    "has_reverse_auction": true,
    "ra_number": "GEM/2026/R/605464",
    "ra_detail_url": "https://bidplus.gem.gov.in/showradocumentPdf/8828418",
    "ra_hover_url": "https://bidplus.gem.gov.in/bidding/bid/getBidResultView/8828418",
    "item": "Interactive Panels with CPU",
    "quantity": 1,
    "ministry": "Agriculture Department Himachal Pradesh",
    "department": null,
    "organisation_address": null,
    "start_datetime_raw": "13-01-2026 1:00 PM",
    "end_datetime_raw": "14-01-2026 1:01 PM",
    "start_datetime": "2026-01-13T13:00:00",
    "end_datetime": "2026-01-14T13:01:00",
    "stage": "Bid Award",
    "bid_ra_status": null,
    "technical_status": null,
    "raw_card_text": "Bid No.:\u00a0 GEM/2025/B/6968199\n\nRA NO:\u00a0GEM/2026/R/605464\n\nStatus: Bid Award\n\nItems:\u00a0Interactive Panels with CPU\nQuantity:\u00a01\nDepartment Name And Address:\u00a0\nAgriculture Department Himachal Pradesh\nStart Date:\u00a013-01-2026 1:00 PM\nEnd Date:\u00a0\u00a0\u00a014-01-2026 1:01 PM"
  },
  {
    "bid_number": "GEM/2025/B/7026725",
    "bid_detail_url": "https://bidplus.gem.gov.in/showbidDocument/8742560",
    "bid_hover_url": "https://bidplus.gem.gov.in/bidding/bid/getBidResultView/8742560",
    "has_reverse_auction": true,
    "ra_number": "GEM/2026/R/605467",
    "ra_detail_url": "https://bidplus.gem.gov.in/showradocumentPdf/8828448",
    "ra_hover_url": "https://bidplus.gem.gov.in/bidding/bid/getBidResultView/8828448",
    "item": "Polyester Blanket (V2)",
    "quantity": 10000,
    "ministry": "urban development and housing department",
    "department": null,
    "organisation_address": null,
    "start_datetime_raw": "13-01-2026 1:00 PM",
    "end_datetime_raw": "14-01-2026 1:00 PM",
    "start_datetime": "2026-01-13T13:00:00",
    "end_datetime": "2026-01-14T13:00:00",
    "stage": "Bid Award",
    "bid_ra_status": null,
    "technical_status": null,
    "raw_card_text": "Bid No.:\u00a0 GEM/2025/B/7026725\n\nRA NO:\u00a0GEM/2026/R/605467\n\nStatus: Bid Award\n\nItems:\u00a0Polyester Blanket (V2)\nQuantity:\u00a010000\nDepartment Name And Address:\u00a0\nurban development and housing department\nStart Date:\u00a013-01-2026 1:00 PM\nEnd Date:\u00a0\u00a0\u00a014-01-2026 1:00 PM"
  },
  {
    "bid_number": "GEM/2026/B/7069496",
    "bid_detail_url": "https://bidplus.gem.gov.in/showbidDocument/8792378",
    "bid_hover_url": "https://bidplus.gem.gov.in/bidding/bid/getBidResultView/8792378",
    "has_reverse_auction": false,
    "ra_number": null,
    "ra_detail_url": null,
    "ra_hover_url": null,
    "item": "OIL FILTER,AIR FILTER,FUEL FIL...",
    "quantity": 31,
    "ministry": "Ministry of Defence",
    "department": "Department of Military Affairs",
    "organisation_address": null,
    "start_datetime_raw": "04-01-2026 12:48 PM",
    "end_datetime_raw": "14-01-2026 1:00 PM",
    "start_datetime": "2026-01-04T12:48:00",
    "end_datetime": "2026-01-14T13:00:00",
    "stage": "Bid Award",
    "bid_ra_status": null,
    "technical_status": null,
    "raw_card_text": "BID NO:\u00a0GEM/2026/B/7069496\n\nStatus: Bid Award\n\nItems:\u00a0OIL FILTER,AIR FILTER,FUEL FIL...\nQuantity:\u00a031\nDepartment Name And Address:\u00a0\nMinistry of Defence\nDepartment of Military Affairs\nStart Date:\u00a004-01-2026 12:48 PM\nEnd Date:\u00a0\u00a0\u00a014-01-2026 1:00 PM"
  },
  {
    "bid_number": "GEM/2026/B/7069444",
    "bid_detail_url": "https://bidplus.gem.gov.in/showbidDocument/8792322",
    "bid_hover_url": "https://bidplus.gem.gov.in/bidding/bid/getBidResultView/8792322",
    "has_reverse_auction": false,
    "ra_number": null,
    "ra_detail_url": null,
    "ra_hover_url": null,
    "item": "CLUTCH RELEASE BEARING,CAM SHA...",
    "quantity": 54,
    "ministry": "Ministry of Defence",
    "department": "Department of Military Affairs",
    "organisation_address": null,
    "start_datetime_raw": "04-01-2026 12:28 PM",
    "end_datetime_raw": "14-01-2026 1:00 PM",
    "start_datetime": "2026-01-04T12:28:00",
    "end_datetime": "2026-01-14T13:00:00",
    "stage": "Bid Award",
    "bid_ra_status": null,
    "technical_status": null,
    "raw_card_text": "BID NO:\u00a0GEM/2026/B/7069444\n\nStatus: Bid Award\n\nItems:\u00a0CLUTCH RELEASE BEARING,CAM SHA...\nQuantity:\u00a054\nDepartment Name And Address:\u00a0\nMinistry of Defence\nDepartment of Military Affairs\nStart Date:\u00a004-01-2026 12:28 PM\nEnd Date:\u00a0\u00a0\u00a014-01-2026 1:00 PM"
  },
  {
    "bid_number": "GEM/2026/B/7069404",
    "bid_detail_url": "https://bidplus.gem.gov.in/showbidDocument/8792280",
    "bid_hover_url": "https://bidplus.gem.gov.in/bidding/bid/getBidResultView/8792280",
    "has_reverse_auction": false,
    "ra_number": null,
    "ra_detail_url": null,
    "ra_hover_url": null,
    "item": "DOOR HANDLE OUTER,THROTTLE BOD...",
    "quantity": 13,
    "ministry": "Ministry of Defence",
    "department": "Department of Military Affairs",
    "organisation_address": null,
    "start_datetime_raw": "04-01-2026 12:08 PM",
    "end_datetime_raw": "14-01-2026 1:00 PM",
    "start_datetime": "2026-01-04T12:08:00",
    "end_datetime": "2026-01-14T13:00:00",
    "stage": "Bid Award",
    "bid_ra_status": null,
    "technical_status": null,
    "raw_card_text": "BID NO:\u00a0GEM/2026/B/7069404\n\nStatus: Bid Award\n\nItems:\u00a0DOOR HANDLE OUTER,THROTTLE BOD...\nQuantity:\u00a013\nDepartment Name And Address:\u00a0\nMinistry of Defence\nDepartment of Military Affairs\nStart Date:\u00a004-01-2026 12:08 PM\nEnd Date:\u00a0\u00a0\u00a014-01-2026 1:00 PM"
  },
  {
    "bid_number": "GEM/2025/B/6873237",
    "bid_detail_url": "https://bidplus.gem.gov.in/showbidDocument/8568325",
    "bid_hover_url": "https://bidplus.gem.gov.in/bidding/bid/getBidResultView/8568325",
    "has_reverse_auction": true,
    "ra_number": "GEM/2026/R/605536",
    "ra_detail_url": "https://bidplus.gem.gov.in/showradocumentPdf/8828816",
    "ra_hover_url": "https://bidplus.gem.gov.in/bidding/bid/getBidResultView/8828816",
    "item": "VACCINE1,VACCINE2,VACCINE3,VAC...",
    "quantity": 950,
    "ministry": "Ministry of Defence",
    "department": "Department of Military Affairs",
    "organisation_address": null,
    "start_datetime_raw": "13-01-2026 1:00 PM",
    "end_datetime_raw": "14-01-2026 1:00 PM",
    "start_datetime": "2026-01-13T13:00:00",
    "end_datetime": "2026-01-14T13:00:00",
    "stage": "Bid Award",
    "bid_ra_status": null,
    "technical_status": null,
    "raw_card_text": "Bid No.:\u00a0 GEM/2025/B/6873237\n\nRA NO:\u00a0GEM/2026/R/605536\n\nStatus: Bid Award\n\nItems:\u00a0VACCINE1,VACCINE2,VACCINE3,VAC...\nQuantity:\u00a0950\nDepartment Name And Address:\u00a0\nMinistry of Defence\nDepartment of Military Affairs\nStart Date:\u00a013-01-2026 1:00 PM\nEnd Date:\u00a0\u00a0\u00a014-01-2026 1:00 PM"
  },
  {
    "bid_number": "GEM/2025/B/6598483",
    "bid_detail_url": "https://bidplus.gem.gov.in/showbidDocument/8254312",
    "bid_hover_url": "https://bidplus.gem.gov.in/bidding/bid/getBidResultView/8254312",
    "has_reverse_auction": true,
    "ra_number": "GEM/2026/R/605478",
    "ra_detail_url": "https://bidplus.gem.gov.in/showradocumentPdf/8828492",
    "ra_hover_url": "https://bidplus.gem.gov.in/bidding/bid/getBidResultView/8828492",
    "item": "Orifice assemblies as per the ...",
    "quantity": 42,
    "ministry": "PMO",
    "department": "Department of Atomic Energy",
    "organisation_address": null,
    "start_datetime_raw": "13-01-2026 1:00 PM",
    "end_datetime_raw": "14-01-2026 1:00 PM",
    "start_datetime": "2026-01-13T13:00:00",
    "end_datetime": "2026-01-14T13:00:00",
    "stage": "Bid Award",
    "bid_ra_status": null,
    "technical_status": null,
    "raw_card_text": "Bid No.:\u00a0 GEM/2025/B/6598483\n\nRA NO:\u00a0GEM/2026/R/605478\n\nStatus: Bid Award\n\nItems:\u00a0Orifice assemblies as per the ...\nQuantity:\u00a042\nDepartment Name And Address:\u00a0\nPMO\nDepartment of Atomic Energy\nStart Date:\u00a013-01-2026 1:00 PM\nEnd Date:\u00a0\u00a0\u00a014-01-2026 1:00 PM"
  },
  {
    "bid_number": "GEM/2025/B/6894470",
    "bid_detail_url": "https://bidplus.gem.gov.in/showbidDocument/8592286",
    "bid_hover_url": "https://bidplus.gem.gov.in/bidding/bid/getBidResultView/8592286",
    "has_reverse_auction": true,
    "ra_number": "GEM/2026/R/605531",
    "ra_detail_url": "https://bidplus.gem.gov.in/showradocumentPdf/8828781",
    "ra_hover_url": "https://bidplus.gem.gov.in/bidding/bid/getBidResultView/8828781",
    "item": "E - Tourist Vehicle / Golf Car...",
    "quantity": 4,
    "ministry": "Ministry of Defence",
    "department": "Department of Defence Research & Development",
    "organisation_address": null,
    "start_datetime_raw": "13-01-2026 1:00 PM",
    "end_datetime_raw": "14-01-2026 1:00 PM",
    "start_datetime": "2026-01-13T13:00:00",
    "end_datetime": "2026-01-14T13:00:00",
    "stage": "Bid Award",
    "bid_ra_status": null,
    "technical_status": null,
    "raw_card_text": "Bid No.:\u00a0 GEM/2025/B/6894470\n\nRA NO:\u00a0GEM/2026/R/605531\n\nStatus: Bid Award\n\nItems:\u00a0E - Tourist Vehicle / Golf Car...\nQuantity:\u00a04\nDepartment Name And Address:\u00a0\nMinistry of Defence\nDepartment of Defence Research & Development\nStart Date:\u00a013-01-2026 1:00 PM\nEnd Date:\u00a0\u00a0\u00a014-01-2026 1:00 PM"
  },
  {
    "bid_number": "GEM/2025/B/6913589",
    "bid_detail_url": "https://bidplus.gem.gov.in/showbidDocument/8613900",
    "bid_hover_url": "https://bidplus.gem.gov.in/bidding/bid/getBidResultView/8613900",
    "has_reverse_auction": true,
    "ra_number": "GEM/2026/R/605542",
    "ra_detail_url": "https://bidplus.gem.gov.in/showradocumentPdf/8828848",
    "ra_hover_url": "https://bidplus.gem.gov.in/bidding/bid/getBidResultView/8828848",
    "item": "Waste Container (V3)",
    "quantity": 6900,
    "ministry": "Department of Panchayati Raj",
    "department": null,
    "organisation_address": null,
    "start_datetime_raw": "13-01-2026 1:00 PM",
    "end_datetime_raw": "14-01-2026 1:00 PM",
    "start_datetime": "2026-01-13T13:00:00",
    "end_datetime": "2026-01-14T13:00:00",
    "stage": "Bid Award",
    "bid_ra_status": null,
    "technical_status": null,
    "raw_card_text": "Bid No.:\u00a0 GEM/2025/B/6913589\n\nRA NO:\u00a0GEM/2026/R/605542\n\nStatus: Bid Award\n\nItems:\u00a0Waste Container (V3)\nQuantity:\u00a06900\nDepartment Name And Address:\u00a0\nDepartment of Panchayati Raj\nStart Date:\u00a013-01-2026 1:00 PM\nEnd Date:\u00a0\u00a0\u00a014-01-2026 1:00 PM"
  },
  {
    "bid_number": "GEM/2026/B/7089585",
    "bid_detail_url": "https://bidplus.gem.gov.in/showbidDocument/8815018",
    "bid_hover_url": "https://bidplus.gem.gov.in/bidding/bid/getBidResultView/8815018",
    "has_reverse_auction": true,
    "ra_number": "GEM/2026/R/605509",
    "ra_detail_url": "https://bidplus.gem.gov.in/showradocumentPdf/8828678",
    "ra_hover_url": "https://bidplus.gem.gov.in/bidding/bid/getBidResultView/8828678",
    "item": "Event or Seminar or Workshop o...",
    "quantity": 1,
    "ministry": "Ministry of Defence",
    "department": "Department of Military Affairs",
    "organisation_address": null,
    "start_datetime_raw": "13-01-2026 1:00 PM",
    "end_datetime_raw": "14-01-2026 1:00 PM",
    "start_datetime": "2026-01-13T13:00:00",
    "end_datetime": "2026-01-14T13:00:00",
    "stage": "Bid Award",
    "bid_ra_status": null,
    "technical_status": null,
    "raw_card_text": "Bid No.:\u00a0 GEM/2026/B/7089585\n\nRA NO:\u00a0GEM/2026/R/605509\n\nStatus: Bid Award\n\nItems:\u00a0Event or Seminar or Workshop o...\nQuantity:\u00a01\nDepartment Name And Address:\u00a0\nMinistry of Defence\nDepartment of Military Affairs\nStart Date:\u00a013-01-2026 1:00 PM\nEnd Date:\u00a0\u00a0\u00a014-01-2026 1:00 PM"
  },
  {
    "bid_number": "GEM/2026/B/7069446",
    "bid_detail_url": "https://bidplus.gem.gov.in/showbidDocument/8792324",
    "bid_hover_url": "https://bidplus.gem.gov.in/bidding/bid/getBidResultView/8792324",
    "has_reverse_auction": false,
    "ra_number": null,
    "ra_detail_url": null,
    "ra_hover_url": null,
    "item": "Sprouts,Black Chana,Casew,Almo...",
    "quantity": 179,
    "ministry": "Ministry of Defence",
    "department": "Department of Military Affairs",
    "organisation_address": null,
    "start_datetime_raw": "04-01-2026 12:28 PM",
    "end_datetime_raw": "14-01-2026 1:00 PM",
    "start_datetime": "2026-01-04T12:28:00",
    "end_datetime": "2026-01-14T13:00:00",
    "stage": "Bid Award",
    "bid_ra_status": null,
    "technical_status": null,
    "raw_card_text": "BID NO:\u00a0GEM/2026/B/7069446\n\nStatus: Bid Award\n\nItems:\u00a0Sprouts,Black Chana,Casew,Almo...\nQuantity:\u00a0179\nDepartment Name And Address:\u00a0\nMinistry of Defence\nDepartment of Military Affairs\nStart Date:\u00a004-01-2026 12:28 PM\nEnd Date:\u00a0\u00a0\u00a014-01-2026 1:00 PM"
  },
  {
    "bid_number": "GEM/2025/B/7050366",
    "bid_detail_url": "https://bidplus.gem.gov.in/showbidDocument/8769734",
    "bid_hover_url": "https://bidplus.gem.gov.in/bidding/bid/getBidResultView/8769734",
    "has_reverse_auction": false,
    "ra_number": null,
    "ra_detail_url": null,
    "ra_hover_url": null,
    "item": "Drainage Pump",
    "quantity": 4,
    "ministry": "Urban Development Department Uttar Pradesh",
    "department": null,
    "organisation_address": null,
    "start_datetime_raw": "30-12-2025 2:41 PM",
    "end_datetime_raw": "14-01-2026 1:00 PM",
    "start_datetime": "2025-12-30T14:41:00",
    "end_datetime": "2026-01-14T13:00:00",
    "stage": "Bid Award",
    "bid_ra_status": null,
    "technical_status": null,
    "raw_card_text": "BID NO:\u00a0GEM/2025/B/7050366\n\nStatus: Bid Award\n\nItems:\u00a0Drainage Pump\nQuantity:\u00a04\nDepartment Name And Address:\u00a0\nUrban Development Department Uttar Pradesh\nStart Date:\u00a030-12-2025 2:41 PM\nEnd Date:\u00a0\u00a0\u00a014-01-2026 1:00 PM"
  },
  {
    "bid_number": "GEM/2025/B/7050295",
    "bid_detail_url": "https://bidplus.gem.gov.in/showbidDocument/8769659",
    "bid_hover_url": "https://bidplus.gem.gov.in/bidding/bid/getBidResultView/8769659",
    "has_reverse_auction": false,
    "ra_number": null,
    "ra_detail_url": null,
    "ra_hover_url": null,
    "item": "Modular Toilet",
    "quantity": 1,
    "ministry": "Urban Development Department Uttar Pradesh",
    "department": null,
    "organisation_address": null,
    "start_datetime_raw": "30-12-2025 2:40 PM",
    "end_datetime_raw": "14-01-2026 1:00 PM",
    "start_datetime": "2025-12-30T14:40:00",
    "end_datetime": "2026-01-14T13:00:00",
    "stage": "Bid Award",
    "bid_ra_status": null,
    "technical_status": null,
    "raw_card_text": "BID NO:\u00a0GEM/2025/B/7050295\n\nStatus: Bid Award\n\nItems:\u00a0Modular Toilet\nQuantity:\u00a01\nDepartment Name And Address:\u00a0\nUrban Development Department Uttar Pradesh\nStart Date:\u00a030-12-2025 2:40 PM\nEnd Date:\u00a0\u00a0\u00a014-01-2026 1:00 PM"
  },
  {
    "bid_number": "GEM/2025/B/7050194",
    "bid_detail_url": "https://bidplus.gem.gov.in/showbidDocument/8769543",
    "bid_hover_url": "https://bidplus.gem.gov.in/bidding/bid/getBidResultView/8769543",
    "has_reverse_auction": false,
    "ra_number": null,
    "ra_detail_url": null,
    "ra_hover_url": null,
    "item": "Steel Wheelbarrows",
    "quantity": 200,
    "ministry": "Urban Development Department Uttar Pradesh",
    "department": null,
    "organisation_address": null,
    "start_datetime_raw": "30-12-2025 2:35 PM",
    "end_datetime_raw": "14-01-2026 1:00 PM",
    "start_datetime": "2025-12-30T14:35:00",
    "end_datetime": "2026-01-14T13:00:00",
    "stage": "Bid Award",
    "bid_ra_status": null,
    "technical_status": null,
    "raw_card_text": "BID NO:\u00a0GEM/2025/B/7050194\n\nStatus: Bid Award\n\nItems:\u00a0Steel Wheelbarrows\nQuantity:\u00a0200\nDepartment Name And Address:\u00a0\nUrban Development Department Uttar Pradesh\nStart Date:\u00a030-12-2025 2:35 PM\nEnd Date:\u00a0\u00a0\u00a014-01-2026 1:00 PM"
  },
  {
    "bid_number": "GEM/2025/B/7050213",
    "bid_detail_url": "https://bidplus.gem.gov.in/showbidDocument/8769563",
    "bid_hover_url": "https://bidplus.gem.gov.in/bidding/bid/getBidResultView/8769563",
    "has_reverse_auction": false,
    "ra_number": null,
    "ra_detail_url": null,
    "ra_hover_url": null,
    "item": "Composter for Solid Waste Mana...",
    "quantity": 50,
    "ministry": "Urban Development Department Uttar Pradesh",
    "department": null,
    "organisation_address": null,
    "start_datetime_raw": "30-12-2025 2:37 PM",
    "end_datetime_raw": "14-01-2026 1:00 PM",
    "start_datetime": "2025-12-30T14:37:00",
    "end_datetime": "2026-01-14T13:00:00",
    "stage": "Bid Award",
    "bid_ra_status": null,
    "technical_status": null,
    "raw_card_text": "BID NO:\u00a0GEM/2025/B/7050213\n\nStatus: Bid Award\n\nItems:\u00a0Composter for Solid Waste Mana...\nQuantity:\u00a050\nDepartment Name And Address:\u00a0\nUrban Development Department Uttar Pradesh\nStart Date:\u00a030-12-2025 2:37 PM\nEnd Date:\u00a0\u00a0\u00a014-01-2026 1:00 PM"
  },
  {
    "bid_number": "GEM/2026/B/7069434",
    "bid_detail_url": "https://bidplus.gem.gov.in/showbidDocument/8792311",
    "bid_hover_url": "https://bidplus.gem.gov.in/bidding/bid/getBidResultView/8792311",
    "has_reverse_auction": false,
    "ra_number": null,
    "ra_detail_url": null,
    "ra_hover_url": null,
    "item": "Shaft Clutch Release Bearing,D...",
    "quantity": 19,
    "ministry": "Ministry of Defence",
    "department": "Department of Military Affairs",
    "organisation_address": null,
    "start_datetime_raw": "04-01-2026 12:23 PM",
    "end_datetime_raw": "14-01-2026 1:00 PM",
    "start_datetime": "2026-01-04T12:23:00",
    "end_datetime": "2026-01-14T13:00:00",
    "stage": "Bid Award",
    "bid_ra_status": null,
    "technical_status": null,
    "raw_card_text": "BID NO:\u00a0GEM/2026/B/7069434\n\nStatus: Bid Award\n\nItems:\u00a0Shaft Clutch Release Bearing,D...\nQuantity:\u00a019\nDepartment Name And Address:\u00a0\nMinistry of Defence\nDepartment of Military Affairs\nStart Date:\u00a004-01-2026 12:23 PM\nEnd Date:\u00a0\u00a0\u00a014-01-2026 1:00 PM"
  },
  {
    "bid_number": "GEM/2026/B/7082415",
    "bid_detail_url": "https://bidplus.gem.gov.in/showbidDocument/8807039",
    "bid_hover_url": "https://bidplus.gem.gov.in/bidding/bid/getBidResultView/8807039",
    "has_reverse_auction": false,
    "ra_number": null,
    "ra_detail_url": null,
    "ra_hover_url": null,
    "item": "Plain Copier Paper (V3) ISI Ma...",
    "quantity": 1197,
    "ministry": "Ministry of Defence",
    "department": "Department of Military Affairs",
    "organisation_address": null,
    "start_datetime_raw": "07-01-2026 12:26 PM",
    "end_datetime_raw": "14-01-2026 1:00 PM",
    "start_datetime": "2026-01-07T12:26:00",
    "end_datetime": "2026-01-14T13:00:00",
    "stage": "Bid Award",
    "bid_ra_status": null,
    "technical_status": null,
    "raw_card_text": "BID NO:\u00a0GEM/2026/B/7082415\n\nStatus: Bid Award\n\nItems:\u00a0Plain Copier Paper (V3) ISI Ma...\nQuantity:\u00a01197\nDepartment Name And Address:\u00a0\nMinistry of Defence\nDepartment of Military Affairs\nStart Date:\u00a007-01-2026 12:26 PM\nEnd Date:\u00a0\u00a0\u00a014-01-2026 1:00 PM"
  },
  {
    "bid_number": "GEM/2026/B/7069427",
    "bid_detail_url": "https://bidplus.gem.gov.in/showbidDocument/8792303",
    "bid_hover_url": "https://bidplus.gem.gov.in/bidding/bid/getBidResultView/8792303",
    "has_reverse_auction": false,
    "ra_number": null,
    "ra_detail_url": null,
    "ra_hover_url": null,
    "item": "Repair of Gear Box of Tractor,...",
    "quantity": 5,
    "ministry": "Ministry of Defence",
    "department": "Department of Military Affairs",
    "organisation_address": null,
    "start_datetime_raw": "04-01-2026 12:15 PM",
    "end_datetime_raw": "14-01-2026 1:00 PM",
    "start_datetime": "2026-01-04T12:15:00",
    "end_datetime": "2026-01-14T13:00:00",
    "stage": "Bid Award",
    "bid_ra_status": null,
    "technical_status": null,
    "raw_card_text": "BID NO:\u00a0GEM/2026/B/7069427\n\nStatus: Bid Award\n\nItems:\u00a0Repair of Gear Box of Tractor,...\nQuantity:\u00a05\nDepartment Name And Address:\u00a0\nMinistry of Defence\nDepartment of Military Affairs\nStart Date:\u00a004-01-2026 12:15 PM\nEnd Date:\u00a0\u00a0\u00a014-01-2026 1:00 PM"
  },
  {
    "bid_number": "GEM/2025/B/6907328",
    "bid_detail_url": "https://bidplus.gem.gov.in/showbidDocument/8607011",
    "bid_hover_url": "https://bidplus.gem.gov.in/bidding/bid/getBidResultView/8607011",
    "has_reverse_auction": true,
    "ra_number": "GEM/2026/R/605517",
    "ra_detail_url": "https://bidplus.gem.gov.in/showradocumentPdf/8828724",
    "ra_hover_url": "https://bidplus.gem.gov.in/bidding/bid/getBidResultView/8828724",
    "item": "LABORATORY GLASSWARE WASHER",
    "quantity": 3,
    "ministry": "Home Department Delhi",
    "department": null,
    "organisation_address": null,
    "start_datetime_raw": "13-01-2026 1:00 PM",
    "end_datetime_raw": "14-01-2026 1:00 PM",
    "start_datetime": "2026-01-13T13:00:00",
    "end_datetime": "2026-01-14T13:00:00",
    "stage": "Bid Award",
    "bid_ra_status": null,
    "technical_status": null,
    "raw_card_text": "Bid No.:\u00a0 GEM/2025/B/6907328\n\nRA NO:\u00a0GEM/2026/R/605517\n\nStatus: Bid Award\n\nItems:\u00a0LABORATORY GLASSWARE WASHER\nQuantity:\u00a03\nDepartment Name And Address:\u00a0\nHome Department Delhi\nStart Date:\u00a013-01-2026 1:00 PM\nEnd Date:\u00a0\u00a0\u00a014-01-2026 1:00 PM"
  },
  {
    "bid_number": "GEM/2026/B/7069411",
    "bid_detail_url": "https://bidplus.gem.gov.in/showbidDocument/8792287",
    "bid_hover_url": "https://bidplus.gem.gov.in/bidding/bid/getBidResultView/8792287",
    "has_reverse_auction": false,
    "ra_number": null,
    "ra_detail_url": null,
    "ra_hover_url": null,
    "item": "Repair of Turbocharger of TATA...",
    "quantity": 5,
    "ministry": "Ministry of Defence",
    "department": "Department of Military Affairs",
    "organisation_address": null,
    "start_datetime_raw": "04-01-2026 12:07 PM",
    "end_datetime_raw": "14-01-2026 1:00 PM",
    "start_datetime": "2026-01-04T12:07:00",
    "end_datetime": "2026-01-14T13:00:00",
    "stage": "Bid Award",
    "bid_ra_status": null,
    "technical_status": null,
    "raw_card_text": "BID NO:\u00a0GEM/2026/B/7069411\n\nStatus: Bid Award\n\nItems:\u00a0Repair of Turbocharger of TATA...\nQuantity:\u00a05\nDepartment Name And Address:\u00a0\nMinistry of Defence\nDepartment of Military Affairs\nStart Date:\u00a004-01-2026 12:07 PM\nEnd Date:\u00a0\u00a0\u00a014-01-2026 1:00 PM"
  },
  {
    "bid_number": "GEM/2026/B/7069425",
    "bid_detail_url": "https://bidplus.gem.gov.in/showbidDocument/8792301",
    "bid_hover_url": "https://bidplus.gem.gov.in/bidding/bid/getBidResultView/8792301",
    "has_reverse_auction": false,
    "ra_number": null,
    "ra_detail_url": null,
    "ra_hover_url": null,
    "item": "Fan Belt,Assy Tie Rod End,4x4 ...",
    "quantity": 41,
    "ministry": "Ministry of Defence",
    "department": "Department of Military Affairs",
    "organisation_address": null,
    "start_datetime_raw": "04-01-2026 12:14 PM",
    "end_datetime_raw": "14-01-2026 1:00 PM",
    "start_datetime": "2026-01-04T12:14:00",
    "end_datetime": "2026-01-14T13:00:00",
    "stage": "Bid Award",
    "bid_ra_status": null,
    "technical_status": null,
    "raw_card_text": "BID NO:\u00a0GEM/2026/B/7069425\n\nStatus: Bid Award\n\nItems:\u00a0Fan Belt,Assy Tie Rod End,4x4 ...\nQuantity:\u00a041\nDepartment Name And Address:\u00a0\nMinistry of Defence\nDepartment of Military Affairs\nStart Date:\u00a004-01-2026 12:14 PM\nEnd Date:\u00a0\u00a0\u00a014-01-2026 1:00 PM"
  },
  {
    "bid_number": "GEM/2026/B/7069408",
    "bid_detail_url": "https://bidplus.gem.gov.in/showbidDocument/8792284",
    "bid_hover_url": "https://bidplus.gem.gov.in/bidding/bid/getBidResultView/8792284",
    "has_reverse_auction": false,
    "ra_number": null,
    "ra_detail_url": null,
    "ra_hover_url": null,
    "item": "Emergency Valve Rep Kit,Soleno...",
    "quantity": 30,
    "ministry": "Ministry of Defence",
    "department": "Department of Military Affairs",
    "organisation_address": null,
    "start_datetime_raw": "04-01-2026 12:06 PM",
    "end_datetime_raw": "14-01-2026 1:00 PM",
    "start_datetime": "2026-01-04T12:06:00",
    "end_datetime": "2026-01-14T13:00:00",
    "stage": "Bid Award",
    "bid_ra_status": null,
    "technical_status": null,
    "raw_card_text": "BID NO:\u00a0GEM/2026/B/7069408\n\nStatus: Bid Award\n\nItems:\u00a0Emergency Valve Rep Kit,Soleno...\nQuantity:\u00a030\nDepartment Name And Address:\u00a0\nMinistry of Defence\nDepartment of Military Affairs\nStart Date:\u00a004-01-2026 12:06 PM\nEnd Date:\u00a0\u00a0\u00a014-01-2026 1:00 PM"
  },
  {
    "bid_number": "GEM/2025/B/6995238",
    "bid_detail_url": "https://bidplus.gem.gov.in/showbidDocument/8707140",
    "bid_hover_url": "https://bidplus.gem.gov.in/bidding/bid/getBidResultView/8707140",
    "has_reverse_auction": true,
    "ra_number": "GEM/2026/R/605328",
    "ra_detail_url": "https://bidplus.gem.gov.in/showradocumentPdf/8827611",
    "ra_hover_url": "https://bidplus.gem.gov.in/bidding/bid/getBidResultView/8827611",
    "item": "Tricycle, Hand Propelled for S...",
    "quantity": 60,
    "ministry": "Empowerment of Persons With Disabilities Department Uttar Pradesh",
    "department": null,
    "organisation_address": null,
    "start_datetime_raw": "13-01-2026 11:00 AM",
    "end_datetime_raw": "14-01-2026 12:25 PM",
    "start_datetime": "2026-01-13T11:00:00",
    "end_datetime": "2026-01-14T12:25:00",
    "stage": "Bid Award",
    "bid_ra_status": null,
    "technical_status": null,
    "raw_card_text": "Bid No.:\u00a0 GEM/2025/B/6995238\n\nRA NO:\u00a0GEM/2026/R/605328\n\nStatus: Bid Award\n\nItems:\u00a0Tricycle, Hand Propelled for S...\nQuantity:\u00a060\nDepartment Name And Address:\u00a0\nEmpowerment of Persons With Disabilities Department Uttar Pradesh\nStart Date:\u00a013-01-2026 11:00 AM\nEnd Date:\u00a0\u00a0\u00a014-01-2026 12:25 PM"
  },
  {
    "bid_number": "GEM/2025/B/7048446",
    "bid_detail_url": "https://bidplus.gem.gov.in/showbidDocument/8767553",
    "bid_hover_url": "https://bidplus.gem.gov.in/bidding/bid/getBidResultView/8767553",
    "has_reverse_auction": true,
    "ra_number": "GEM/2026/R/605342",
    "ra_detail_url": "https://bidplus.gem.gov.in/showradocumentPdf/8827693",
    "ra_hover_url": "https://bidplus.gem.gov.in/bidding/bid/getBidResultView/8827693",
    "item": "Single Use Sterile Rubber Surg...",
    "quantity": 40000,
    "ministry": "Ministry of Labour and Employment",
    "department": "Employees State Insuarnce Corporation",
    "organisation_address": null,
    "start_datetime_raw": "13-01-2026 12:00 PM",
    "end_datetime_raw": "14-01-2026 12:20 PM",
    "start_datetime": "2026-01-13T12:00:00",
    "end_datetime": "2026-01-14T12:20:00",
    "stage": "Bid Award",
    "bid_ra_status": null,
    "technical_status": null,
    "raw_card_text": "Bid No.:\u00a0 GEM/2025/B/7048446\n\nRA NO:\u00a0GEM/2026/R/605342\n\nStatus: Bid Award\n\nItems:\u00a0Single Use Sterile Rubber Surg...\nQuantity:\u00a040000\nDepartment Name And Address:\u00a0\nMinistry of Labour and Employment\nEmployees State Insuarnce Corporation\nStart Date:\u00a013-01-2026 12:00 PM\nEnd Date:\u00a0\u00a0\u00a014-01-2026 12:20 PM"
  },
  {
    "bid_number": "GEM/2025/B/7015948",
    "bid_detail_url": "https://bidplus.gem.gov.in/showbidDocument/8730449",
    "bid_hover_url": "https://bidplus.gem.gov.in/bidding/bid/getBidResultView/8730449",
    "has_reverse_auction": true,
    "ra_number": "GEM/2026/R/605368",
    "ra_detail_url": "https://bidplus.gem.gov.in/showradocumentPdf/8827849",
    "ra_hover_url": "https://bidplus.gem.gov.in/bidding/bid/getBidResultView/8827849",
    "item": "Bottled Water Dispenser (V3) I...",
    "quantity": 20,
    "ministry": "Ministry of Defence",
    "department": "Department of Military Affairs",
    "organisation_address": null,
    "start_datetime_raw": "13-01-2026 12:00 PM",
    "end_datetime_raw": "14-01-2026 12:01 PM",
    "start_datetime": "2026-01-13T12:00:00",
    "end_datetime": "2026-01-14T12:01:00",
    "stage": "Bid Award",
    "bid_ra_status": null,
    "technical_status": null,
    "raw_card_text": "Bid No.:\u00a0 GEM/2025/B/7015948\n\nRA NO:\u00a0GEM/2026/R/605368\n\nStatus: Bid Award\n\nItems:\u00a0Bottled Water Dispenser (V3) I...\nQuantity:\u00a020\nDepartment Name And Address:\u00a0\nMinistry of Defence\nDepartment of Military Affairs\nStart Date:\u00a013-01-2026 12:00 PM\nEnd Date:\u00a0\u00a0\u00a014-01-2026 12:01 PM"
  },
  {
    "bid_number": "GEM/2026/B/7069309",
    "bid_detail_url": "https://bidplus.gem.gov.in/showbidDocument/8792177",
    "bid_hover_url": "https://bidplus.gem.gov.in/bidding/bid/getBidResultView/8792177",
    "has_reverse_auction": false,
    "ra_number": null,
    "ra_detail_url": null,
    "ra_hover_url": null,
    "item": "Door Lock LH,Plate Brake Frict...",
    "quantity": 40,
    "ministry": "Ministry of Defence",
    "department": "Department of Military Affairs",
    "organisation_address": null,
    "start_datetime_raw": "04-01-2026 11:12 AM",
    "end_datetime_raw": "14-01-2026 12:00 PM",
    "start_datetime": "2026-01-04T11:12:00",
    "end_datetime": "2026-01-14T12:00:00",
    "stage": "Bid Award",
    "bid_ra_status": null,
    "technical_status": null,
    "raw_card_text": "BID NO:\u00a0GEM/2026/B/7069309\n\nStatus: Bid Award\n\nItems:\u00a0Door Lock LH,Plate Brake Frict...\nQuantity:\u00a040\nDepartment Name And Address:\u00a0\nMinistry of Defence\nDepartment of Military Affairs\nStart Date:\u00a004-01-2026 11:12 AM\nEnd Date:\u00a0\u00a0\u00a014-01-2026 12:00 PM"
  },
  {
    "bid_number": "GEM/2026/B/7069366",
    "bid_detail_url": "https://bidplus.gem.gov.in/showbidDocument/8792238",
    "bid_hover_url": "https://bidplus.gem.gov.in/bidding/bid/getBidResultView/8792238",
    "has_reverse_auction": false,
    "ra_number": null,
    "ra_detail_url": null,
    "ra_hover_url": null,
    "item": "Clutch Release Brg,Gear Box Pa...",
    "quantity": 14,
    "ministry": "Ministry of Defence",
    "department": "Department of Military Affairs",
    "organisation_address": null,
    "start_datetime_raw": "04-01-2026 11:40 AM",
    "end_datetime_raw": "14-01-2026 12:00 PM",
    "start_datetime": "2026-01-04T11:40:00",
    "end_datetime": "2026-01-14T12:00:00",
    "stage": "Bid Award",
    "bid_ra_status": null,
    "technical_status": null,
    "raw_card_text": "BID NO:\u00a0GEM/2026/B/7069366\n\nStatus: Bid Award\n\nItems:\u00a0Clutch Release Brg,Gear Box Pa...\nQuantity:\u00a014\nDepartment Name And Address:\u00a0\nMinistry of Defence\nDepartment of Military Affairs\nStart Date:\u00a004-01-2026 11:40 AM\nEnd Date:\u00a0\u00a0\u00a014-01-2026 12:00 PM"
  },
  {
    "bid_number": "GEM/2026/B/7069311",
    "bid_detail_url": "https://bidplus.gem.gov.in/showbidDocument/8792179",
    "bid_hover_url": "https://bidplus.gem.gov.in/bidding/bid/getBidResultView/8792179",
    "has_reverse_auction": false,
    "ra_number": null,
    "ra_detail_url": null,
    "ra_hover_url": null,
    "item": "MOTOR ASSY WIPER,BRG CLUTCH RE...",
    "quantity": 21,
    "ministry": "Ministry of Defence",
    "department": "Department of Military Affairs",
    "organisation_address": null,
    "start_datetime_raw": "04-01-2026 11:11 AM",
    "end_datetime_raw": "14-01-2026 12:00 PM",
    "start_datetime": "2026-01-04T11:11:00",
    "end_datetime": "2026-01-14T12:00:00",
    "stage": "Bid Award",
    "bid_ra_status": null,
    "technical_status": null,
    "raw_card_text": "BID NO:\u00a0GEM/2026/B/7069311\n\nStatus: Bid Award\n\nItems:\u00a0MOTOR ASSY WIPER,BRG CLUTCH RE...\nQuantity:\u00a021\nDepartment Name And Address:\u00a0\nMinistry of Defence\nDepartment of Military Affairs\nStart Date:\u00a004-01-2026 11:11 AM\nEnd Date:\u00a0\u00a0\u00a014-01-2026 12:00 PM"
  },
  {
    "bid_number": "GEM/2026/B/7069324",
    "bid_detail_url": "https://bidplus.gem.gov.in/showbidDocument/8792192",
    "bid_hover_url": "https://bidplus.gem.gov.in/bidding/bid/getBidResultView/8792192",
    "has_reverse_auction": false,
    "ra_number": null,
    "ra_detail_url": null,
    "ra_hover_url": null,
    "item": "RUBBER HOSE ENGINE TO RADIATOR...",
    "quantity": 10,
    "ministry": "Ministry of Defence",
    "department": "Department of Military Affairs",
