[
  {
    "bid_number": "GEM/2025/B/7047528",
    "bid_detail_url": "https://bidplus.gem.gov.in/showbidDocument/8766477",
    "bid_hover_url": "https://bidplus.gem.gov.in/bidding/bid/getBidResultView/8766477",
    "has_reverse_auction": false,
    "ra_number": null,
    "ra_detail_url": null,
    "ra_hover_url": null,
    "item": "Air Filter,Fuel Filter,Oil Fil...",
    "quantity": 14,
    "ministry": "Ministry of Defence",
    "department": "Department of Military Affairs",
    "organisation_address": null,
    "start_datetime_raw": "26-12-2025 8:02 PM",
    "end_datetime_raw": "15-01-2026 9:00 PM",
    "start_datetime": "2025-12-26T20:02:00",
    "end_datetime": "2026-01-15T21:00:00",
    "stage": "Bid Award",
    "bid_ra_status": null,
    "technical_status": null,
    "raw_card_text": "BID NO:\u00a0GEM/2025/B/7047528\n\nStatus: Bid Award\n\nItems:\u00a0Air Filter,Fuel Filter,Oil Fil...\nQuantity:\u00a014\nDepartment Name And Address:\u00a0\nMinistry of Defence\nDepartment of Military Affairs\nStart Date:\u00a026-12-2025 8:02 PM\nEnd Date:\u00a0\u00a0\u00a015-01-2026 9:00 PM"
  },
  {
    "bid_number": "GEM/2026/B/7074920",
    "bid_detail_url": "https://bidplus.gem.gov.in/showbidDocument/8798667",
    "bid_hover_url": "https://bidplus.gem.gov.in/bidding/bid/getBidResultView/8798667",
    "has_reverse_auction": false,
    "ra_number": null,
    "ra_detail_url": null,
    "ra_hover_url": null,
    "item": "OIL PIPE,OIL FILTER,AIR FILTER...",
    "quantity": 11,
    "ministry": "Ministry of Defence",
    "department": "Department of Defence",
    "organisation_address": null,
    "start_datetime_raw": "05-01-2026 8:16 PM",
    "end_datetime_raw": "15-01-2026 9:00 PM",
    "start_datetime": "2026-01-05T20:16:00",
    "end_datetime": "2026-01-15T21:00:00",
    "stage": "Bid Award",
    "bid_ra_status": null,
    "technical_status": null,
    "raw_card_text": "BID NO:\u00a0GEM/2026/B/7074920\n\nStatus: Bid Award\n\nItems:\u00a0OIL PIPE,OIL FILTER,AIR FILTER...\nQuantity:\u00a011\nDepartment Name And Address:\u00a0\nMinistry of Defence\nDepartment of Defence\nStart Date:\u00a005-01-2026 8:16 PM\nEnd Date:\u00a0\u00a0\u00a015-01-2026 9:00 PM"
  },
  {
    "bid_number": "GEM/2026/B/7065193",
    "bid_detail_url": "https://bidplus.gem.gov.in/showbidDocument/8787583",
    "bid_hover_url": "https://bidplus.gem.gov.in/bidding/bid/getBidResultView/8787583",
    "has_reverse_auction": false,
    "ra_number": null,
    "ra_detail_url": null,
    "ra_hover_url": null,
    "item": "Stove Burner,Stove Spring,Stov...",
    "quantity": 1405,
    "ministry": "Ministry of Defence",
    "department": "Department of Military Affairs",
    "organisation_address": null,
    "start_datetime_raw": "02-01-2026 8:35 PM",
    "end_datetime_raw": "15-01-2026 9:00 PM",
    "start_datetime": "2026-01-02T20:35:00",
    "end_datetime": "2026-01-15T21:00:00",
    "stage": "Bid Award",
    "bid_ra_status": null,
    "technical_status": null,
    "raw_card_text": "BID NO:\u00a0GEM/2026/B/7065193\n\nStatus: Bid Award\n\nItems:\u00a0Stove Burner,Stove Spring,Stov...\nQuantity:\u00a01405\nDepartment Name And Address:\u00a0\nMinistry of Defence\nDepartment of Military Affairs\nStart Date:\u00a002-01-2026 8:35 PM\nEnd Date:\u00a0\u00a0\u00a015-01-2026 9:00 PM"
  },
  {
    "bid_number": "GEM/2026/B/7074922",
    "bid_detail_url": "https://bidplus.gem.gov.in/showbidDocument/8798669",
    "bid_hover_url": "https://bidplus.gem.gov.in/bidding/bid/getBidResultView/8798669",
    "has_reverse_auction": false,
    "ra_number": null,
    "ra_detail_url": null,
    "ra_hover_url": null,
    "item": "Hexa Rotor Fra,e,Soldering iro...",
    "quantity": 5,
    "ministry": "Ministry of Defence",
    "department": "Department of Military Affairs",
    "organisation_address": null,
    "start_datetime_raw": "05-01-2026 8:13 PM",
    "end_datetime_raw": "15-01-2026 9:00 PM",
    "start_datetime": "2026-01-05T20:13:00",
    "end_datetime": "2026-01-15T21:00:00",
    "stage": "Bid Award",
    "bid_ra_status": null,
    "technical_status": null,
    "raw_card_text": "BID NO:\u00a0GEM/2026/B/7074922\n\nStatus: Bid Award\n\nItems:\u00a0Hexa Rotor Fra,e,Soldering iro...\nQuantity:\u00a05\nDepartment Name And Address:\u00a0\nMinistry of Defence\nDepartment of Military Affairs\nStart Date:\u00a005-01-2026 8:13 PM\nEnd Date:\u00a0\u00a0\u00a015-01-2026 9:00 PM"
  },
  {
    "bid_number": "GEM/2026/B/7074887",
    "bid_detail_url": "https://bidplus.gem.gov.in/showbidDocument/8798628",
    "bid_hover_url": "https://bidplus.gem.gov.in/bidding/bid/getBidResultView/8798628",
    "has_reverse_auction": false,
    "ra_number": null,
    "ra_detail_url": null,
    "ra_hover_url": null,
    "item": "Plastic jerry cans 35 Ltr,Wire...",
    "quantity": 81,
    "ministry": "Ministry of Defence",
    "department": "Department of Military Affairs",
    "organisation_address": null,
    "start_datetime_raw": "05-01-2026 7:51 PM",
    "end_datetime_raw": "15-01-2026 8:00 PM",
    "start_datetime": "2026-01-05T19:51:00",
    "end_datetime": "2026-01-15T20:00:00",
    "stage": "Bid Award",
    "bid_ra_status": null,
    "technical_status": null,
    "raw_card_text": "BID NO:\u00a0GEM/2026/B/7074887\n\nStatus: Bid Award\n\nItems:\u00a0Plastic jerry cans 35 Ltr,Wire...\nQuantity:\u00a081\nDepartment Name And Address:\u00a0\nMinistry of Defence\nDepartment of Military Affairs\nStart Date:\u00a005-01-2026 7:51 PM\nEnd Date:\u00a0\u00a0\u00a015-01-2026 8:00 PM"
  },
  {
    "bid_number": "GEM/2026/B/7074894",
    "bid_detail_url": "https://bidplus.gem.gov.in/showbidDocument/8798635",
    "bid_hover_url": "https://bidplus.gem.gov.in/bidding/bid/getBidResultView/8798635",
    "has_reverse_auction": false,
    "ra_number": null,
    "ra_detail_url": null,
    "ra_hover_url": null,
    "item": "FUEL PIPE,FUEL FLEXIBLE PIPE,P...",
    "quantity": 16,
    "ministry": "Ministry of Defence",
    "department": "Department of Defence",
    "organisation_address": null,
    "start_datetime_raw": "05-01-2026 7:53 PM",
    "end_datetime_raw": "15-01-2026 8:00 PM",
    "start_datetime": "2026-01-05T19:53:00",
    "end_datetime": "2026-01-15T20:00:00",
    "stage": "Bid Award",
    "bid_ra_status": null,
    "technical_status": null,
    "raw_card_text": "BID NO:\u00a0GEM/2026/B/7074894\n\nStatus: Bid Award\n\nItems:\u00a0FUEL PIPE,FUEL FLEXIBLE PIPE,P...\nQuantity:\u00a016\nDepartment Name And Address:\u00a0\nMinistry of Defence\nDepartment of Defence\nStart Date:\u00a005-01-2026 7:53 PM\nEnd Date:\u00a0\u00a0\u00a015-01-2026 8:00 PM"
  },
  {
    "bid_number": "GEM/2026/B/7074228",
    "bid_detail_url": "https://bidplus.gem.gov.in/showbidDocument/8797845",
    "bid_hover_url": "https://bidplus.gem.gov.in/bidding/bid/getBidResultView/8797845",
    "has_reverse_auction": false,
    "ra_number": null,
    "ra_detail_url": null,
    "ra_hover_url": null,
    "item": "Tab Fluralaner 1000 mg chewabl...",
    "quantity": 177,
    "ministry": "Ministry of Defence",
    "department": "Department of Military Affairs",
    "organisation_address": null,
    "start_datetime_raw": "05-01-2026 7:50 PM",
    "end_datetime_raw": "15-01-2026 8:00 PM",
    "start_datetime": "2026-01-05T19:50:00",
    "end_datetime": "2026-01-15T20:00:00",
    "stage": "Bid Award",
    "bid_ra_status": null,
    "technical_status": null,
    "raw_card_text": "BID NO:\u00a0GEM/2026/B/7074228\n\nStatus: Bid Award\n\nItems:\u00a0Tab Fluralaner 1000 mg chewabl...\nQuantity:\u00a0177\nDepartment Name And Address:\u00a0\nMinistry of Defence\nDepartment of Military Affairs\nStart Date:\u00a005-01-2026 7:50 PM\nEnd Date:\u00a0\u00a0\u00a015-01-2026 8:00 PM"
  },
  {
    "bid_number": "GEM/2026/B/7074703",
    "bid_detail_url": "https://bidplus.gem.gov.in/showbidDocument/8798408",
    "bid_hover_url": "https://bidplus.gem.gov.in/bidding/bid/getBidResultView/8798408",
    "has_reverse_auction": false,
    "ra_number": null,
    "ra_detail_url": null,
    "ra_hover_url": null,
    "item": "OIL FILTER 5 KVA,FUEL FILTER 5...",
    "quantity": 119,
    "ministry": "Ministry of Defence",
    "department": "Department of Military Affairs",
    "organisation_address": null,
    "start_datetime_raw": "05-01-2026 6:55 PM",
    "end_datetime_raw": "15-01-2026 7:00 PM",
    "start_datetime": "2026-01-05T18:55:00",
    "end_datetime": "2026-01-15T19:00:00",
    "stage": "Bid Award",
    "bid_ra_status": null,
    "technical_status": null,
    "raw_card_text": "BID NO:\u00a0GEM/2026/B/7074703\n\nStatus: Bid Award\n\nItems:\u00a0OIL FILTER 5 KVA,FUEL FILTER 5...\nQuantity:\u00a0119\nDepartment Name And Address:\u00a0\nMinistry of Defence\nDepartment of Military Affairs\nStart Date:\u00a005-01-2026 6:55 PM\nEnd Date:\u00a0\u00a0\u00a015-01-2026 7:00 PM"
  },
  {
    "bid_number": "GEM/2026/B/7074448",
    "bid_detail_url": "https://bidplus.gem.gov.in/showbidDocument/8798100",
    "bid_hover_url": "https://bidplus.gem.gov.in/bidding/bid/getBidResultView/8798100",
    "has_reverse_auction": false,
    "ra_number": null,
    "ra_detail_url": null,
    "ra_hover_url": null,
    "item": "Fan belt,bin Lifting Pump Kit,...",
    "quantity": 6,
    "ministry": "Ministry of Defence",
    "department": "Department of Military Affairs",
    "organisation_address": null,
    "start_datetime_raw": "05-01-2026 6:18 PM",
    "end_datetime_raw": "15-01-2026 7:00 PM",
    "start_datetime": "2026-01-05T18:18:00",
    "end_datetime": "2026-01-15T19:00:00",
    "stage": "Bid Award",
    "bid_ra_status": null,
    "technical_status": null,
    "raw_card_text": "BID NO:\u00a0GEM/2026/B/7074448\n\nStatus: Bid Award\n\nItems:\u00a0Fan belt,bin Lifting Pump Kit,...\nQuantity:\u00a06\nDepartment Name And Address:\u00a0\nMinistry of Defence\nDepartment of Military Affairs\nStart Date:\u00a005-01-2026 6:18 PM\nEnd Date:\u00a0\u00a0\u00a015-01-2026 7:00 PM"
  },
  {
    "bid_number": "GEM/2026/B/7074465",
    "bid_detail_url": "https://bidplus.gem.gov.in/showbidDocument/8798123",
    "bid_hover_url": "https://bidplus.gem.gov.in/bidding/bid/getBidResultView/8798123",
    "has_reverse_auction": false,
    "ra_number": null,
    "ra_detail_url": null,
    "ra_hover_url": null,
    "item": "YONEX BADMINTON RACKET,SINTEX ...",
    "quantity": 11,
    "ministry": "Ministry of Defence",
    "department": "Department of Military Affairs",
    "organisation_address": null,
    "start_datetime_raw": "05-01-2026 6:09 PM",
    "end_datetime_raw": "15-01-2026 7:00 PM",
    "start_datetime": "2026-01-05T18:09:00",
    "end_datetime": "2026-01-15T19:00:00",
    "stage": "Bid Award",
    "bid_ra_status": null,
    "technical_status": null,
    "raw_card_text": "BID NO:\u00a0GEM/2026/B/7074465\n\nStatus: Bid Award\n\nItems:\u00a0YONEX BADMINTON RACKET,SINTEX ...\nQuantity:\u00a011\nDepartment Name And Address:\u00a0\nMinistry of Defence\nDepartment of Military Affairs\nStart Date:\u00a005-01-2026 6:09 PM\nEnd Date:\u00a0\u00a0\u00a015-01-2026 7:00 PM"
  },
  {
    "bid_number": "GEM/2026/B/7074363",
    "bid_detail_url": "https://bidplus.gem.gov.in/showbidDocument/8797995",
    "bid_hover_url": "https://bidplus.gem.gov.in/bidding/bid/getSinglePacketResultView/8797995",
    "has_reverse_auction": false,
    "ra_number": null,
    "ra_detail_url": null,
    "ra_hover_url": null,
    "item": "GPS for cross flight,GPS,7 inc...",
    "quantity": 34,
    "ministry": "Ministry of Defence",
    "department": "Department of Military Affairs",
    "organisation_address": null,
    "start_datetime_raw": "05-01-2026 6:56 PM",
    "end_datetime_raw": "15-01-2026 7:00 PM",
    "start_datetime": "2026-01-05T18:56:00",
    "end_datetime": "2026-01-15T19:00:00",
    "stage": "Bid Award",
    "bid_ra_status": null,
    "technical_status": null,
    "raw_card_text": "BID NO:\u00a0GEM/2026/B/7074363\n\nStatus: Bid Award\n\nItems:\u00a0GPS for cross flight,GPS,7 inc...\nQuantity:\u00a034\nDepartment Name And Address:\u00a0\nMinistry of Defence\nDepartment of Military Affairs\nStart Date:\u00a005-01-2026 6:56 PM\nEnd Date:\u00a0\u00a0\u00a015-01-2026 7:00 PM"
  },
  {
    "bid_number": "GEM/2026/B/7103218",
    "bid_detail_url": "https://bidplus.gem.gov.in/showbidDocument/8830696",
    "bid_hover_url": "https://bidplus.gem.gov.in/bidding/bid/getBidResultView/8830696",
    "has_reverse_auction": false,
    "ra_number": null,
    "ra_detail_url": null,
    "ra_hover_url": null,
    "item": "Monthly Basis Cab & Taxi Hirin...",
    "quantity": 1,
    "ministry": "Ministry of Housing & Urban Affairs (MoHUA)",
    "department": "Central Public Works Department",
    "organisation_address": null,
    "start_datetime_raw": "12-01-2026 6:49 PM",
    "end_datetime_raw": "15-01-2026 7:00 PM",
    "start_datetime": "2026-01-12T18:49:00",
    "end_datetime": "2026-01-15T19:00:00",
    "stage": "Bid Award",
    "bid_ra_status": null,
    "technical_status": null,
    "raw_card_text": "BID NO:\u00a0GEM/2026/B/7103218\n\nStatus: Bid Award\n\nItems:\u00a0Monthly Basis Cab & Taxi Hirin...\nQuantity:\u00a01\nDepartment Name And Address:\u00a0\nMinistry of Housing & Urban Affairs (MoHUA)\nCentral Public Works Department\nStart Date:\u00a012-01-2026 6:49 PM\nEnd Date:\u00a0\u00a0\u00a015-01-2026 7:00 PM"
  },
  {
    "bid_number": "GEM/2026/B/7074603",
    "bid_detail_url": "https://bidplus.gem.gov.in/showbidDocument/8798289",
    "bid_hover_url": "https://bidplus.gem.gov.in/bidding/bid/getBidResultView/8798289",
    "has_reverse_auction": false,
    "ra_number": null,
    "ra_detail_url": null,
    "ra_hover_url": null,
    "item": "Table Tennis Bat,Volley Ball S...",
    "quantity": 6,
    "ministry": "Ministry of Defence",
    "department": "Department of Military Affairs",
    "organisation_address": null,
    "start_datetime_raw": "05-01-2026 6:37 PM",
    "end_datetime_raw": "15-01-2026 7:00 PM",
    "start_datetime": "2026-01-05T18:37:00",
    "end_datetime": "2026-01-15T19:00:00",
    "stage": "Bid Award",
    "bid_ra_status": null,
    "technical_status": null,
    "raw_card_text": "BID NO:\u00a0GEM/2026/B/7074603\n\nStatus: Bid Award\n\nItems:\u00a0Table Tennis Bat,Volley Ball S...\nQuantity:\u00a06\nDepartment Name And Address:\u00a0\nMinistry of Defence\nDepartment of Military Affairs\nStart Date:\u00a005-01-2026 6:37 PM\nEnd Date:\u00a0\u00a0\u00a015-01-2026 7:00 PM"
  },
  {
    "bid_number": "GEM/2026/B/7068251",
    "bid_detail_url": "https://bidplus.gem.gov.in/showbidDocument/8790997",
    "bid_hover_url": "https://bidplus.gem.gov.in/bidding/bid/getBidResultView/8790997",
    "has_reverse_auction": true,
    "ra_number": "GEM/2026/R/606536",
    "ra_detail_url": "https://bidplus.gem.gov.in/showradocumentPdf/8837495",
    "ra_hover_url": "https://bidplus.gem.gov.in/bidding/bid/getBidResultView/8837495",
    "item": "Fish Fresh",
    "quantity": 432,
    "ministry": "Ministry of Defence",
    "department": "Department of Military Affairs",
    "organisation_address": null,
    "start_datetime_raw": "14-01-2026 7:00 PM",
    "end_datetime_raw": "15-01-2026 7:00 PM",
    "start_datetime": "2026-01-14T19:00:00",
    "end_datetime": "2026-01-15T19:00:00",
    "stage": "Bid Award",
    "bid_ra_status": null,
    "technical_status": null,
    "raw_card_text": "Bid No.:\u00a0 GEM/2026/B/7068251\n\nRA NO:\u00a0GEM/2026/R/606536\n\nStatus: Bid Award\n\nItems:\u00a0Fish Fresh\nQuantity:\u00a0432\nDepartment Name And Address:\u00a0\nMinistry of Defence\nDepartment of Military Affairs\nStart Date:\u00a014-01-2026 7:00 PM\nEnd Date:\u00a0\u00a0\u00a015-01-2026 7:00 PM"
  },
  {
    "bid_number": "GEM/2026/B/7074232",
    "bid_detail_url": "https://bidplus.gem.gov.in/showbidDocument/8797850",
    "bid_hover_url": "https://bidplus.gem.gov.in/bidding/bid/getSinglePacketResultView/8797850",
    "has_reverse_auction": false,
    "ra_number": null,
    "ra_detail_url": null,
    "ra_hover_url": null,
    "item": "Camera,Fly Sky Remote Controll...",
    "quantity": 20,
    "ministry": "Ministry of Defence",
    "department": "Department of Military Affairs",
    "organisation_address": null,
    "start_datetime_raw": "05-01-2026 6:19 PM",
    "end_datetime_raw": "15-01-2026 7:00 PM",
    "start_datetime": "2026-01-05T18:19:00",
    "end_datetime": "2026-01-15T19:00:00",
    "stage": "Bid Award",
    "bid_ra_status": null,
    "technical_status": null,
    "raw_card_text": "BID NO:\u00a0GEM/2026/B/7074232\n\nStatus: Bid Award\n\nItems:\u00a0Camera,Fly Sky Remote Controll...\nQuantity:\u00a020\nDepartment Name And Address:\u00a0\nMinistry of Defence\nDepartment of Military Affairs\nStart Date:\u00a005-01-2026 6:19 PM\nEnd Date:\u00a0\u00a0\u00a015-01-2026 7:00 PM"
  },
  {
    "bid_number": "GEM/2026/B/7074464",
    "bid_detail_url": "https://bidplus.gem.gov.in/showbidDocument/8798122",
    "bid_hover_url": "https://bidplus.gem.gov.in/bidding/bid/getBidResultView/8798122",
    "has_reverse_auction": false,
    "ra_number": null,
    "ra_detail_url": null,
    "ra_hover_url": null,
    "item": "Chain Spoket Kit,Rubber Bush,G...",
    "quantity": 19,
    "ministry": "Ministry of Defence",
    "department": "Department of Military Affairs",
    "organisation_address": null,
    "start_datetime_raw": "05-01-2026 6:18 PM",
    "end_datetime_raw": "15-01-2026 7:00 PM",
    "start_datetime": "2026-01-05T18:18:00",
    "end_datetime": "2026-01-15T19:00:00",
    "stage": "Bid Award",
    "bid_ra_status": null,
    "technical_status": null,
    "raw_card_text": "BID NO:\u00a0GEM/2026/B/7074464\n\nStatus: Bid Award\n\nItems:\u00a0Chain Spoket Kit,Rubber Bush,G...\nQuantity:\u00a019\nDepartment Name And Address:\u00a0\nMinistry of Defence\nDepartment of Military Affairs\nStart Date:\u00a005-01-2026 6:18 PM\nEnd Date:\u00a0\u00a0\u00a015-01-2026 7:00 PM"
  },
  {
    "bid_number": "GEM/2026/B/7103936",
    "bid_detail_url": "https://bidplus.gem.gov.in/showbidDocument/8831499",
    "bid_hover_url": "https://bidplus.gem.gov.in/bidding/bid/getBidResultView/8831499",
    "has_reverse_auction": false,
    "ra_number": null,
    "ra_detail_url": null,
    "ra_hover_url": null,
    "item": "Repair and Overhauling Service...",
    "quantity": 1,
    "ministry": "Ministry of Defence",
    "department": "Department of Military Affairs",
    "organisation_address": null,
    "start_datetime_raw": "12-01-2026 6:07 PM",
    "end_datetime_raw": "15-01-2026 7:00 PM",
    "start_datetime": "2026-01-12T18:07:00",
    "end_datetime": "2026-01-15T19:00:00",
    "stage": "Bid Award",
    "bid_ra_status": null,
    "technical_status": null,
    "raw_card_text": "BID NO:\u00a0GEM/2026/B/7103936\n\nStatus: Bid Award\n\nItems:\u00a0Repair and Overhauling Service...\nQuantity:\u00a01\nDepartment Name And Address:\u00a0\nMinistry of Defence\nDepartment of Military Affairs\nStart Date:\u00a012-01-2026 6:07 PM\nEnd Date:\u00a0\u00a0\u00a015-01-2026 7:00 PM"
  },
  {
    "bid_number": "GEM/2026/B/7103912",
    "bid_detail_url": "https://bidplus.gem.gov.in/showbidDocument/8831472",
    "bid_hover_url": "https://bidplus.gem.gov.in/bidding/bid/getBidResultView/8831472",
    "has_reverse_auction": false,
    "ra_number": null,
    "ra_detail_url": null,
    "ra_hover_url": null,
    "item": "Repair and Overhauling Service...",
    "quantity": 1,
    "ministry": "Ministry of Defence",
    "department": "Department of Military Affairs",
    "organisation_address": null,
    "start_datetime_raw": "12-01-2026 6:02 PM",
    "end_datetime_raw": "15-01-2026 7:00 PM",
    "start_datetime": "2026-01-12T18:02:00",
    "end_datetime": "2026-01-15T19:00:00",
    "stage": "Bid Award",
    "bid_ra_status": null,
    "technical_status": null,
    "raw_card_text": "BID NO:\u00a0GEM/2026/B/7103912\n\nStatus: Bid Award\n\nItems:\u00a0Repair and Overhauling Service...\nQuantity:\u00a01\nDepartment Name And Address:\u00a0\nMinistry of Defence\nDepartment of Military Affairs\nStart Date:\u00a012-01-2026 6:02 PM\nEnd Date:\u00a0\u00a0\u00a015-01-2026 7:00 PM"
  },
  {
    "bid_number": "GEM/2026/B/7074452",
    "bid_detail_url": "https://bidplus.gem.gov.in/showbidDocument/8798106",
    "bid_hover_url": "https://bidplus.gem.gov.in/bidding/bid/getSinglePacketResultView/8798106",
    "has_reverse_auction": false,
    "ra_number": null,
    "ra_detail_url": null,
    "ra_hover_url": null,
    "item": "Monthly Basis Cab & Taxi Hirin...",
    "quantity": 2,
    "ministry": "Ministry of Railways",
    "department": "Indian Railways",
    "organisation_address": null,
    "start_datetime_raw": "05-01-2026 6:25 PM",
    "end_datetime_raw": "15-01-2026 7:00 PM",
    "start_datetime": "2026-01-05T18:25:00",
    "end_datetime": "2026-01-15T19:00:00",
    "stage": "Bid Award",
    "bid_ra_status": null,
    "technical_status": null,
    "raw_card_text": "BID NO:\u00a0GEM/2026/B/7074452\n\nStatus: Bid Award\n\nItems:\u00a0Monthly Basis Cab & Taxi Hirin...\nQuantity:\u00a02\nDepartment Name And Address:\u00a0\nMinistry of Railways\nIndian Railways\nStart Date:\u00a005-01-2026 6:25 PM\nEnd Date:\u00a0\u00a0\u00a015-01-2026 7:00 PM"
  },
  {
    "bid_number": "GEM/2026/B/7074511",
    "bid_detail_url": "https://bidplus.gem.gov.in/showbidDocument/8798176",
    "bid_hover_url": "https://bidplus.gem.gov.in/bidding/bid/getSinglePacketResultView/8798176",
    "has_reverse_auction": false,
    "ra_number": null,
    "ra_detail_url": null,
    "ra_hover_url": null,
    "item": "TIE ROD END,ELCTRONIC POINT LE...",
    "quantity": 26,
    "ministry": "Ministry of Defence",
    "department": "Department of Military Affairs",
    "organisation_address": null,
    "start_datetime_raw": "05-01-2026 6:16 PM",
    "end_datetime_raw": "15-01-2026 7:00 PM",
    "start_datetime": "2026-01-05T18:16:00",
    "end_datetime": "2026-01-15T19:00:00",
    "stage": "Bid Award",
    "bid_ra_status": null,
    "technical_status": null,
    "raw_card_text": "BID NO:\u00a0GEM/2026/B/7074511\n\nStatus: Bid Award\n\nItems:\u00a0TIE ROD END,ELCTRONIC POINT LE...\nQuantity:\u00a026\nDepartment Name And Address:\u00a0\nMinistry of Defence\nDepartment of Military Affairs\nStart Date:\u00a005-01-2026 6:16 PM\nEnd Date:\u00a0\u00a0\u00a015-01-2026 7:00 PM"
  },
  {
    "bid_number": "GEM/2026/B/7072596",
    "bid_detail_url": "https://bidplus.gem.gov.in/showbidDocument/8796010",
    "bid_hover_url": "https://bidplus.gem.gov.in/bidding/bid/getSinglePacketResultView/8796010",
    "has_reverse_auction": false,
    "ra_number": null,
    "ra_detail_url": null,
    "ra_hover_url": null,
    "item": "WATER PUMP ASSY,ASSY CLUTCH MA...",
    "quantity": 43,
    "ministry": "Ministry of Defence",
    "department": "Department of Military Affairs",
    "organisation_address": null,
    "start_datetime_raw": "05-01-2026 6:11 PM",
    "end_datetime_raw": "15-01-2026 7:00 PM",
    "start_datetime": "2026-01-05T18:11:00",
    "end_datetime": "2026-01-15T19:00:00",
    "stage": "Bid Award",
    "bid_ra_status": null,
    "technical_status": null,
    "raw_card_text": "BID NO:\u00a0GEM/2026/B/7072596\n\nStatus: Bid Award\n\nItems:\u00a0WATER PUMP ASSY,ASSY CLUTCH MA...\nQuantity:\u00a043\nDepartment Name And Address:\u00a0\nMinistry of Defence\nDepartment of Military Affairs\nStart Date:\u00a005-01-2026 6:11 PM\nEnd Date:\u00a0\u00a0\u00a015-01-2026 7:00 PM"
  },
  {
    "bid_number": "GEM/2025/B/6999596",
    "bid_detail_url": "https://bidplus.gem.gov.in/showbidDocument/8712006",
    "bid_hover_url": "https://bidplus.gem.gov.in/bidding/bid/getBidResultView/8712006",
    "has_reverse_auction": false,
    "ra_number": null,
    "ra_detail_url": null,
    "ra_hover_url": null,
    "item": "Custom Bid for Services - PURC...",
    "quantity": 1,
    "ministry": "Ministry of Petroleum and Natural Gas",
    "department": "Bharat Petroleum Corporation Ltd",
    "organisation_address": null,
    "start_datetime_raw": "13-12-2025 4:11 PM",
    "end_datetime_raw": "15-01-2026 7:00 PM",
    "start_datetime": "2025-12-13T16:11:00",
    "end_datetime": "2026-01-15T19:00:00",
    "stage": "Bid Award",
    "bid_ra_status": null,
    "technical_status": null,
    "raw_card_text": "BID NO:\u00a0GEM/2025/B/6999596\n\nStatus: Bid Award\n\nItems:\u00a0Custom Bid for Services - PURC...\nQuantity:\u00a01\nDepartment Name And Address:\u00a0\nMinistry of Petroleum and Natural Gas\nBharat Petroleum Corporation Ltd\nStart Date:\u00a013-12-2025 4:11 PM\nEnd Date:\u00a0\u00a0\u00a015-01-2026 7:00 PM"
  },
  {
    "bid_number": "GEM/2026/B/7074477",
    "bid_detail_url": "https://bidplus.gem.gov.in/showbidDocument/8798139",
    "bid_hover_url": "https://bidplus.gem.gov.in/bidding/bid/getBidResultView/8798139",
    "has_reverse_auction": false,
    "ra_number": null,
    "ra_detail_url": null,
    "ra_hover_url": null,
    "item": "RECEIVER SIMULATOR MODULE",
    "quantity": 1,
    "ministry": "Ministry of Defence",
    "department": "Department of Military Affairs",
    "organisation_address": null,
    "start_datetime_raw": "05-01-2026 6:13 PM",
    "end_datetime_raw": "15-01-2026 7:00 PM",
    "start_datetime": "2026-01-05T18:13:00",
    "end_datetime": "2026-01-15T19:00:00",
    "stage": "Bid Award",
    "bid_ra_status": null,
    "technical_status": null,
    "raw_card_text": "BID NO:\u00a0GEM/2026/B/7074477\n\nStatus: Bid Award\n\nItems:\u00a0RECEIVER SIMULATOR MODULE\nQuantity:\u00a01\nDepartment Name And Address:\u00a0\nMinistry of Defence\nDepartment of Military Affairs\nStart Date:\u00a005-01-2026 6:13 PM\nEnd Date:\u00a0\u00a0\u00a015-01-2026 7:00 PM"
  },
  {
    "bid_number": "GEM/2026/B/7103982",
    "bid_detail_url": "https://bidplus.gem.gov.in/showbidDocument/8831559",
    "bid_hover_url": "https://bidplus.gem.gov.in/bidding/bid/getBidResultView/8831559",
    "has_reverse_auction": false,
    "ra_number": null,
    "ra_detail_url": null,
    "ra_hover_url": null,
    "item": "Repair and Overhauling Service...",
    "quantity": 1,
    "ministry": "Ministry of Defence",
    "department": "Department of Military Affairs",
    "organisation_address": null,
    "start_datetime_raw": "12-01-2026 6:19 PM",
    "end_datetime_raw": "15-01-2026 7:00 PM",
    "start_datetime": "2026-01-12T18:19:00",
    "end_datetime": "2026-01-15T19:00:00",
    "stage": "Bid Award",
    "bid_ra_status": null,
    "technical_status": null,
    "raw_card_text": "BID NO:\u00a0GEM/2026/B/7103982\n\nStatus: Bid Award\n\nItems:\u00a0Repair and Overhauling Service...\nQuantity:\u00a01\nDepartment Name And Address:\u00a0\nMinistry of Defence\nDepartment of Military Affairs\nStart Date:\u00a012-01-2026 6:19 PM\nEnd Date:\u00a0\u00a0\u00a015-01-2026 7:00 PM"
  },
  {
    "bid_number": "GEM/2026/B/7103951",
    "bid_detail_url": "https://bidplus.gem.gov.in/showbidDocument/8831522",
    "bid_hover_url": "https://bidplus.gem.gov.in/bidding/bid/getBidResultView/8831522",
    "has_reverse_auction": false,
    "ra_number": null,
    "ra_detail_url": null,
    "ra_hover_url": null,
    "item": "Repair and Overhauling Service...",
    "quantity": 1,
    "ministry": "Ministry of Defence",
    "department": "Department of Military Affairs",
    "organisation_address": null,
    "start_datetime_raw": "12-01-2026 6:13 PM",
    "end_datetime_raw": "15-01-2026 7:00 PM",
    "start_datetime": "2026-01-12T18:13:00",
    "end_datetime": "2026-01-15T19:00:00",
    "stage": "Bid Award",
    "bid_ra_status": null,
    "technical_status": null,
    "raw_card_text": "BID NO:\u00a0GEM/2026/B/7103951\n\nStatus: Bid Award\n\nItems:\u00a0Repair and Overhauling Service...\nQuantity:\u00a01\nDepartment Name And Address:\u00a0\nMinistry of Defence\nDepartment of Military Affairs\nStart Date:\u00a012-01-2026 6:13 PM\nEnd Date:\u00a0\u00a0\u00a015-01-2026 7:00 PM"
  },
  {
    "bid_number": "GEM/2026/B/7065577",
    "bid_detail_url": "https://bidplus.gem.gov.in/showbidDocument/8787998",
    "bid_hover_url": "https://bidplus.gem.gov.in/bidding/bid/getBidResultView/8787998",
    "has_reverse_auction": true,
    "ra_number": "GEM/2026/R/606535",
    "ra_detail_url": "https://bidplus.gem.gov.in/showradocumentPdf/8837478",
    "ra_hover_url": "https://bidplus.gem.gov.in/bidding/bid/getBidResultView/8837478",
    "item": "Repair and Overhauling Service...",
    "quantity": 1,
    "ministry": "Ministry of Defence",
    "department": "Department of Military Affairs",
    "organisation_address": null,
    "start_datetime_raw": "14-01-2026 7:00 PM",
    "end_datetime_raw": "15-01-2026 7:00 PM",
    "start_datetime": "2026-01-14T19:00:00",
    "end_datetime": "2026-01-15T19:00:00",
    "stage": "Bid Award",
    "bid_ra_status": null,
    "technical_status": null,
    "raw_card_text": "Bid No.:\u00a0 GEM/2026/B/7065577\n\nRA NO:\u00a0GEM/2026/R/606535\n\nStatus: Bid Award\n\nItems:\u00a0Repair and Overhauling Service...\nQuantity:\u00a01\nDepartment Name And Address:\u00a0\nMinistry of Defence\nDepartment of Military Affairs\nStart Date:\u00a014-01-2026 7:00 PM\nEnd Date:\u00a0\u00a0\u00a015-01-2026 7:00 PM"
  },
  {
    "bid_number": "GEM/2025/B/6823075",
    "bid_detail_url": "https://bidplus.gem.gov.in/showbidDocument/8510499",
    "bid_hover_url": "https://bidplus.gem.gov.in/bidding/bid/getBidResultView/8510499",
    "has_reverse_auction": true,
    "ra_number": "GEM/2026/R/606440",
    "ra_detail_url": "https://bidplus.gem.gov.in/showradocumentPdf/8836374",
    "ra_hover_url": "https://bidplus.gem.gov.in/bidding/bid/getBidResultView/8836374",
    "item": "Bus Hiring Service - Short Ter...",
    "quantity": 4,
    "ministry": "Ministry of Defence",
    "department": "Department of Defence",
    "organisation_address": null,
    "start_datetime_raw": "14-01-2026 5:00 PM",
    "end_datetime_raw": "15-01-2026 6:42 PM",
    "start_datetime": "2026-01-14T17:00:00",
    "end_datetime": "2026-01-15T18:42:00",
    "stage": "Bid Award",
    "bid_ra_status": null,
    "technical_status": null,
    "raw_card_text": "Bid No.:\u00a0 GEM/2025/B/6823075\n\nRA NO:\u00a0GEM/2026/R/606440\n\nStatus: Bid Award\n\nItems:\u00a0Bus Hiring Service - Short Ter...\nQuantity:\u00a04\nDepartment Name And Address:\u00a0\nMinistry of Defence\nDepartment of Defence\nStart Date:\u00a014-01-2026 5:00 PM\nEnd Date:\u00a0\u00a0\u00a015-01-2026 6:42 PM"
  },
  {
    "bid_number": "GEM/2026/B/7074199",
    "bid_detail_url": "https://bidplus.gem.gov.in/showbidDocument/8797813",
    "bid_hover_url": "https://bidplus.gem.gov.in/bidding/bid/getBidResultView/8797813",
    "has_reverse_auction": false,
    "ra_number": null,
    "ra_detail_url": null,
    "ra_hover_url": null,
    "item": "expension below,oil filter,air...",
    "quantity": 8,
    "ministry": "Ministry of Defence",
    "department": "Department of Military Affairs",
    "organisation_address": null,
    "start_datetime_raw": "05-01-2026 5:33 PM",
    "end_datetime_raw": "15-01-2026 6:00 PM",
    "start_datetime": "2026-01-05T17:33:00",
    "end_datetime": "2026-01-15T18:00:00",
    "stage": "Bid Award",
    "bid_ra_status": null,
    "technical_status": null,
    "raw_card_text": "BID NO:\u00a0GEM/2026/B/7074199\n\nStatus: Bid Award\n\nItems:\u00a0expension below,oil filter,air...\nQuantity:\u00a08\nDepartment Name And Address:\u00a0\nMinistry of Defence\nDepartment of Military Affairs\nStart Date:\u00a005-01-2026 5:33 PM\nEnd Date:\u00a0\u00a0\u00a015-01-2026 6:00 PM"
  },
  {
    "bid_number": "GEM/2026/B/7074267",
    "bid_detail_url": "https://bidplus.gem.gov.in/showbidDocument/8797890",
    "bid_hover_url": "https://bidplus.gem.gov.in/bidding/bid/getBidResultView/8797890",
    "has_reverse_auction": false,
    "ra_number": null,
    "ra_detail_url": null,
    "ra_hover_url": null,
    "item": "battery motorolla,battery I co...",
    "quantity": 18,
    "ministry": "Ministry of Defence",
    "department": "Department of Military Affairs",
    "organisation_address": null,
    "start_datetime_raw": "05-01-2026 5:53 PM",
    "end_datetime_raw": "15-01-2026 6:00 PM",
    "start_datetime": "2026-01-05T17:53:00",
    "end_datetime": "2026-01-15T18:00:00",
    "stage": "Bid Award",
    "bid_ra_status": null,
    "technical_status": null,
    "raw_card_text": "BID NO:\u00a0GEM/2026/B/7074267\n\nStatus: Bid Award\n\nItems:\u00a0battery motorolla,battery I co...\nQuantity:\u00a018\nDepartment Name And Address:\u00a0\nMinistry of Defence\nDepartment of Military Affairs\nStart Date:\u00a005-01-2026 5:53 PM\nEnd Date:\u00a0\u00a0\u00a015-01-2026 6:00 PM"
  },
  {
    "bid_number": "GEM/2026/B/7074155",
    "bid_detail_url": "https://bidplus.gem.gov.in/showbidDocument/8797766",
    "bid_hover_url": "https://bidplus.gem.gov.in/bidding/bid/getSinglePacketResultView/8797766",
    "has_reverse_auction": false,
    "ra_number": null,
    "ra_detail_url": null,
    "ra_hover_url": null,
    "item": "BP CUP SINGLE,NI BP CUFF,NIBP ...",
    "quantity": 11,
    "ministry": "Ministry of Defence",
    "department": "Department of Military Affairs",
    "organisation_address": null,
    "start_datetime_raw": "05-01-2026 5:38 PM",
    "end_datetime_raw": "15-01-2026 6:00 PM",
    "start_datetime": "2026-01-05T17:38:00",
    "end_datetime": "2026-01-15T18:00:00",
    "stage": "Bid Award",
    "bid_ra_status": null,
    "technical_status": null,
    "raw_card_text": "BID NO:\u00a0GEM/2026/B/7074155\n\nStatus: Bid Award\n\nItems:\u00a0BP CUP SINGLE,NI BP CUFF,NIBP ...\nQuantity:\u00a011\nDepartment Name And Address:\u00a0\nMinistry of Defence\nDepartment of Military Affairs\nStart Date:\u00a005-01-2026 5:38 PM\nEnd Date:\u00a0\u00a0\u00a015-01-2026 6:00 PM"
  },
  {
    "bid_number": "GEM/2025/B/7051854",
    "bid_detail_url": "https://bidplus.gem.gov.in/showbidDocument/8771568",
    "bid_hover_url": "https://bidplus.gem.gov.in/bidding/bid/getBidResultView/8771568",
    "has_reverse_auction": true,
    "ra_number": "GEM/2026/R/606478",
    "ra_detail_url": "https://bidplus.gem.gov.in/showradocumentPdf/8836935",
    "ra_hover_url": "https://bidplus.gem.gov.in/bidding/bid/getBidResultView/8836935",
    "item": "Event or Seminar or Workshop o...",
    "quantity": 1,
    "ministry": "Ministry of Defence",
    "department": "Department of Defence",
    "organisation_address": null,
    "start_datetime_raw": "14-01-2026 6:00 PM",
    "end_datetime_raw": "15-01-2026 6:00 PM",
    "start_datetime": "2026-01-14T18:00:00",
    "end_datetime": "2026-01-15T18:00:00",
    "stage": "Bid Award",
    "bid_ra_status": null,
    "technical_status": null,
    "raw_card_text": "Bid No.:\u00a0 GEM/2025/B/7051854\n\nRA NO:\u00a0GEM/2026/R/606478\n\nStatus: Bid Award\n\nItems:\u00a0Event or Seminar or Workshop o...\nQuantity:\u00a01\nDepartment Name And Address:\u00a0\nMinistry of Defence\nDepartment of Defence\nStart Date:\u00a014-01-2026 6:00 PM\nEnd Date:\u00a0\u00a0\u00a015-01-2026 6:00 PM"
  },
  {
    "bid_number": "GEM/2026/B/7073971",
    "bid_detail_url": "https://bidplus.gem.gov.in/showbidDocument/8797556",
    "bid_hover_url": "https://bidplus.gem.gov.in/bidding/bid/getBidResultView/8797556",
    "has_reverse_auction": false,
    "ra_number": null,
    "ra_detail_url": null,
    "ra_hover_url": null,
    "item": "CLUTCH RELEASE BRG,HOSE ASSEMB...",
    "quantity": 15,
    "ministry": "Ministry of Defence",
    "department": "Department of Military Affairs",
    "organisation_address": null,
    "start_datetime_raw": "05-01-2026 5:34 PM",
    "end_datetime_raw": "15-01-2026 6:00 PM",
    "start_datetime": "2026-01-05T17:34:00",
    "end_datetime": "2026-01-15T18:00:00",
    "stage": "Bid Award",
    "bid_ra_status": null,
    "technical_status": null,
    "raw_card_text": "BID NO:\u00a0GEM/2026/B/7073971\n\nStatus: Bid Award\n\nItems:\u00a0CLUTCH RELEASE BRG,HOSE ASSEMB...\nQuantity:\u00a015\nDepartment Name And Address:\u00a0\nMinistry of Defence\nDepartment of Military Affairs\nStart Date:\u00a005-01-2026 5:34 PM\nEnd Date:\u00a0\u00a0\u00a015-01-2026 6:00 PM"
  },
  {
    "bid_number": "GEM/2026/B/7074180",
    "bid_detail_url": "https://bidplus.gem.gov.in/showbidDocument/8797794",
    "bid_hover_url": "https://bidplus.gem.gov.in/bidding/bid/getBidResultView/8797794",
    "has_reverse_auction": false,
    "ra_number": null,
    "ra_detail_url": null,
    "ra_hover_url": null,
    "item": "White LED Based Solar Street L...",
    "quantity": 18,
    "ministry": "Rural Development Department Uttar Pradesh",
    "department": null,
    "organisation_address": null,
    "start_datetime_raw": "05-01-2026 5:36 PM",
    "end_datetime_raw": "15-01-2026 6:00 PM",
    "start_datetime": "2026-01-05T17:36:00",
    "end_datetime": "2026-01-15T18:00:00",
    "stage": "Bid Award",
    "bid_ra_status": null,
    "technical_status": null,
    "raw_card_text": "BID NO:\u00a0GEM/2026/B/7074180\n\nStatus: Bid Award\n\nItems:\u00a0White LED Based Solar Street L...\nQuantity:\u00a018\nDepartment Name And Address:\u00a0\nRural Development Department Uttar Pradesh\nStart Date:\u00a005-01-2026 5:36 PM\nEnd Date:\u00a0\u00a0\u00a015-01-2026 6:00 PM"
  },
  {
    "bid_number": "GEM/2025/B/7047170",
    "bid_detail_url": "https://bidplus.gem.gov.in/showbidDocument/8766046",
    "bid_hover_url": "https://bidplus.gem.gov.in/bidding/bid/getBidResultView/8766046",
    "has_reverse_auction": false,
    "ra_number": null,
    "ra_detail_url": null,
    "ra_hover_url": null,
    "item": "HIGH PRESSURE LINE,CRANK AND C...",
    "quantity": 8,
    "ministry": "Ministry of Defence",
    "department": "Department of Military Affairs",
    "organisation_address": null,
    "start_datetime_raw": "26-12-2025 6:01 PM",
    "end_datetime_raw": "15-01-2026 6:00 PM",
    "start_datetime": "2025-12-26T18:01:00",
    "end_datetime": "2026-01-15T18:00:00",
    "stage": "Bid Award",
    "bid_ra_status": null,
    "technical_status": null,
    "raw_card_text": "BID NO:\u00a0GEM/2025/B/7047170\n\nStatus: Bid Award\n\nItems:\u00a0HIGH PRESSURE LINE,CRANK AND C...\nQuantity:\u00a08\nDepartment Name And Address:\u00a0\nMinistry of Defence\nDepartment of Military Affairs\nStart Date:\u00a026-12-2025 6:01 PM\nEnd Date:\u00a0\u00a0\u00a015-01-2026 6:00 PM"
  },
  {
    "bid_number": "GEM/2026/B/7103783",
    "bid_detail_url": "https://bidplus.gem.gov.in/showbidDocument/8831333",
    "bid_hover_url": "https://bidplus.gem.gov.in/bidding/bid/getBidResultView/8831333",
    "has_reverse_auction": false,
    "ra_number": null,
    "ra_detail_url": null,
    "ra_hover_url": null,
    "item": "Repair and Overhauling Service...",
    "quantity": 1,
    "ministry": "Ministry of Defence",
    "department": "Department of Military Affairs",
    "organisation_address": null,
    "start_datetime_raw": "12-01-2026 5:57 PM",
    "end_datetime_raw": "15-01-2026 6:00 PM",
    "start_datetime": "2026-01-12T17:57:00",
    "end_datetime": "2026-01-15T18:00:00",
    "stage": "Bid Award",
    "bid_ra_status": null,
    "technical_status": null,
    "raw_card_text": "BID NO:\u00a0GEM/2026/B/7103783\n\nStatus: Bid Award\n\nItems:\u00a0Repair and Overhauling Service...\nQuantity:\u00a01\nDepartment Name And Address:\u00a0\nMinistry of Defence\nDepartment of Military Affairs\nStart Date:\u00a012-01-2026 5:57 PM\nEnd Date:\u00a0\u00a0\u00a015-01-2026 6:00 PM"
  },
  {
    "bid_number": "GEM/2026/B/7074344",
    "bid_detail_url": "https://bidplus.gem.gov.in/showbidDocument/8797976",
    "bid_hover_url": "https://bidplus.gem.gov.in/bidding/bid/getBidResultView/8797976",
    "has_reverse_auction": false,
    "ra_number": null,
    "ra_detail_url": null,
    "ra_hover_url": null,
    "item": "ARMATURE ASSY,REGULATOR,CLUTCH...",
    "quantity": 10,
    "ministry": "Ministry of Defence",
    "department": "Department of Military Affairs",
    "organisation_address": null,
    "start_datetime_raw": "05-01-2026 5:51 PM",
    "end_datetime_raw": "15-01-2026 6:00 PM",
    "start_datetime": "2026-01-05T17:51:00",
    "end_datetime": "2026-01-15T18:00:00",
    "stage": "Bid Award",
    "bid_ra_status": null,
    "technical_status": null,
    "raw_card_text": "BID NO:\u00a0GEM/2026/B/7074344\n\nStatus: Bid Award\n\nItems:\u00a0ARMATURE ASSY,REGULATOR,CLUTCH...\nQuantity:\u00a010\nDepartment Name And Address:\u00a0\nMinistry of Defence\nDepartment of Military Affairs\nStart Date:\u00a005-01-2026 5:51 PM\nEnd Date:\u00a0\u00a0\u00a015-01-2026 6:00 PM"
  },
  {
    "bid_number": "GEM/2026/B/7061449",
    "bid_detail_url": "https://bidplus.gem.gov.in/showbidDocument/8783104",
    "bid_hover_url": "https://bidplus.gem.gov.in/bidding/bid/getBidResultView/8783104",
    "has_reverse_auction": false,
    "ra_number": null,
    "ra_detail_url": null,
    "ra_hover_url": null,
    "item": "SEAL KIT FOR 70360 PUMP,GASKET...",
    "quantity": 5,
    "ministry": "Ministry of Defence",
    "department": "Department of Military Affairs",
    "organisation_address": null,
    "start_datetime_raw": "01-01-2026 5:36 PM",
    "end_datetime_raw": "15-01-2026 6:00 PM",
    "start_datetime": "2026-01-01T17:36:00",
    "end_datetime": "2026-01-15T18:00:00",
    "stage": "Bid Award",
    "bid_ra_status": null,
    "technical_status": null,
    "raw_card_text": "BID NO:\u00a0GEM/2026/B/7061449\n\nStatus: Bid Award\n\nItems:\u00a0SEAL KIT FOR 70360 PUMP,GASKET...\nQuantity:\u00a05\nDepartment Name And Address:\u00a0\nMinistry of Defence\nDepartment of Military Affairs\nStart Date:\u00a001-01-2026 5:36 PM\nEnd Date:\u00a0\u00a0\u00a015-01-2026 6:00 PM"
  },
  {
    "bid_number": "GEM/2025/B/7021899",
    "bid_detail_url": "https://bidplus.gem.gov.in/showbidDocument/8737127",
    "bid_hover_url": "https://bidplus.gem.gov.in/bidding/bid/getBidResultView/8737127",
    "has_reverse_auction": false,
    "ra_number": null,
    "ra_detail_url": null,
    "ra_hover_url": null,
    "item": "Desert Earthly Neutrals Kanat,...",
    "quantity": 834,
    "ministry": "Ministry of Defence",
    "department": "Department of Military Affairs",
    "organisation_address": null,
    "start_datetime_raw": "01-01-2026 5:52 PM",
    "end_datetime_raw": "15-01-2026 6:00 PM",
    "start_datetime": "2026-01-01T17:52:00",
    "end_datetime": "2026-01-15T18:00:00",
    "stage": "Bid Award",
    "bid_ra_status": null,
    "technical_status": null,
    "raw_card_text": "BID NO:\u00a0GEM/2025/B/7021899\n\nStatus: Bid Award\n\nItems:\u00a0Desert Earthly Neutrals Kanat,...\nQuantity:\u00a0834\nDepartment Name And Address:\u00a0\nMinistry of Defence\nDepartment of Military Affairs\nStart Date:\u00a001-01-2026 5:52 PM\nEnd Date:\u00a0\u00a0\u00a015-01-2026 6:00 PM"
  },
  {
    "bid_number": "GEM/2026/B/7074218",
    "bid_detail_url": "https://bidplus.gem.gov.in/showbidDocument/8797832",
    "bid_hover_url": "https://bidplus.gem.gov.in/bidding/bid/getBidResultView/8797832",
    "has_reverse_auction": false,
    "ra_number": null,
    "ra_detail_url": null,
    "ra_hover_url": null,
    "item": "PISTON RING SET,HIGH PRESSURE ...",
    "quantity": 19,
    "ministry": "Ministry of Defence",
    "department": "Department of Military Affairs",
    "organisation_address": null,
    "start_datetime_raw": "05-01-2026 5:37 PM",
    "end_datetime_raw": "15-01-2026 6:00 PM",
    "start_datetime": "2026-01-05T17:37:00",
    "end_datetime": "2026-01-15T18:00:00",
    "stage": "Bid Award",
    "bid_ra_status": null,
    "technical_status": null,
    "raw_card_text": "BID NO:\u00a0GEM/2026/B/7074218\n\nStatus: Bid Award\n\nItems:\u00a0PISTON RING SET,HIGH PRESSURE ...\nQuantity:\u00a019\nDepartment Name And Address:\u00a0\nMinistry of Defence\nDepartment of Military Affairs\nStart Date:\u00a005-01-2026 5:37 PM\nEnd Date:\u00a0\u00a0\u00a015-01-2026 6:00 PM"
  },
  {
    "bid_number": "GEM/2026/B/7068685",
    "bid_detail_url": "https://bidplus.gem.gov.in/showbidDocument/8791479",
    "bid_hover_url": "https://bidplus.gem.gov.in/bidding/bid/getBidResultView/8791479",
    "has_reverse_auction": false,
    "ra_number": null,
    "ra_detail_url": null,
    "ra_hover_url": null,
    "item": "Wired Microphone (V2)",
    "quantity": 1,
    "ministry": "Ministry of Education",
    "department": "Department of Higher Education",
    "organisation_address": null,
    "start_datetime_raw": "03-01-2026 5:56 PM",
    "end_datetime_raw": "15-01-2026 6:00 PM",
    "start_datetime": "2026-01-03T17:56:00",
    "end_datetime": "2026-01-15T18:00:00",
    "stage": "Bid Award",
    "bid_ra_status": null,
    "technical_status": null,
    "raw_card_text": "BID NO:\u00a0GEM/2026/B/7068685\n\nStatus: Bid Award\n\nItems:\u00a0Wired Microphone (V2)\nQuantity:\u00a01\nDepartment Name And Address:\u00a0\nMinistry of Education\nDepartment of Higher Education\nStart Date:\u00a003-01-2026 5:56 PM\nEnd Date:\u00a0\u00a0\u00a015-01-2026 6:00 PM"
  },
  {
    "bid_number": "GEM/2026/B/7074248",
    "bid_detail_url": "https://bidplus.gem.gov.in/showbidDocument/8797868",
    "bid_hover_url": "https://bidplus.gem.gov.in/bidding/bid/getBidResultView/8797868",
    "has_reverse_auction": false,
    "ra_number": null,
    "ra_detail_url": null,
    "ra_hover_url": null,
    "item": "Toner Cartridges / Ink Cartrid...",
    "quantity": 83,
    "ministry": "Narmada Water Resources Water Supply and Kalpsar Department Gujarat",
    "department": null,
    "organisation_address": null,
    "start_datetime_raw": "05-01-2026 5:54 PM",
    "end_datetime_raw": "15-01-2026 6:00 PM",
    "start_datetime": "2026-01-05T17:54:00",
    "end_datetime": "2026-01-15T18:00:00",
    "stage": "Bid Award",
    "bid_ra_status": null,
    "technical_status": null,
    "raw_card_text": "BID NO:\u00a0GEM/2026/B/7074248\n\nStatus: Bid Award\n\nItems:\u00a0Toner Cartridges / Ink Cartrid...\nQuantity:\u00a083\nDepartment Name And Address:\u00a0\nNarmada Water Resources Water Supply and Kalpsar Department Gujarat\nStart Date:\u00a005-01-2026 5:54 PM\nEnd Date:\u00a0\u00a0\u00a015-01-2026 6:00 PM"
  },
  {
    "bid_number": "GEM/2025/B/7023167",
    "bid_detail_url": "https://bidplus.gem.gov.in/showbidDocument/8738547",
    "bid_hover_url": "https://bidplus.gem.gov.in/bidding/bid/getBidResultView/8738547",
    "has_reverse_auction": true,
    "ra_number": "GEM/2026/R/606446",
    "ra_detail_url": "https://bidplus.gem.gov.in/showradocumentPdf/8836454",
    "ra_hover_url": "https://bidplus.gem.gov.in/bidding/bid/getBidResultView/8836454",
    "item": "Annual Maintenance Service - D...",
    "quantity": 29,
    "ministry": "Ministry of Defence",
    "department": "Department of Defence Production",
    "organisation_address": null,
    "start_datetime_raw": "14-01-2026 5:00 PM",
    "end_datetime_raw": "15-01-2026 5:32 PM",
    "start_datetime": "2026-01-14T17:00:00",
    "end_datetime": "2026-01-15T17:32:00",
    "stage": "Bid Award",
    "bid_ra_status": null,
    "technical_status": null,
    "raw_card_text": "Bid No.:\u00a0 GEM/2025/B/7023167\n\nRA NO:\u00a0GEM/2026/R/606446\n\nStatus: Bid Award\n\nItems:\u00a0Annual Maintenance Service - D...\nQuantity:\u00a029\nDepartment Name And Address:\u00a0\nMinistry of Defence\nDepartment of Defence Production\nStart Date:\u00a014-01-2026 5:00 PM\nEnd Date:\u00a0\u00a0\u00a015-01-2026 5:32 PM"
  },
  {
    "bid_number": "GEM/2025/B/6910397",
    "bid_detail_url": "https://bidplus.gem.gov.in/showbidDocument/8610387",
    "bid_hover_url": "https://bidplus.gem.gov.in/bidding/bid/getBidResultView/8610387",
    "has_reverse_auction": true,
    "ra_number": "GEM/2026/R/606432",
    "ra_detail_url": "https://bidplus.gem.gov.in/showradocumentPdf/8836217",
    "ra_hover_url": "https://bidplus.gem.gov.in/bidding/bid/getBidResultView/8836217",
    "item": "Notebook,Notebook,Notebook,Not...",
    "quantity": 3101123,
    "ministry": "Education Department Daman and Diu",
    "department": null,
    "organisation_address": null,
    "start_datetime_raw": "14-01-2026 4:00 PM",
    "end_datetime_raw": "15-01-2026 5:14 PM",
    "start_datetime": "2026-01-14T16:00:00",
    "end_datetime": "2026-01-15T17:14:00",
    "stage": "Bid Award",
    "bid_ra_status": null,
    "technical_status": null,
    "raw_card_text": "Bid No.:\u00a0 GEM/2025/B/6910397\n\nRA NO:\u00a0GEM/2026/R/606432\n\nStatus: Bid Award\n\nItems:\u00a0Notebook,Notebook,Notebook,Not...\nQuantity:\u00a03101123\nDepartment Name And Address:\u00a0\nEducation Department Daman and Diu\nStart Date:\u00a014-01-2026 4:00 PM\nEnd Date:\u00a0\u00a0\u00a015-01-2026 5:14 PM"
  },
  {
    "bid_number": "GEM/2026/B/7109966",
    "bid_detail_url": "https://bidplus.gem.gov.in/showbidDocument/8838237",
    "bid_hover_url": "https://bidplus.gem.gov.in/bidding/bid/getSinglePacketResultView/8838237",
    "has_reverse_auction": false,
    "ra_number": null,
    "ra_detail_url": null,
    "ra_hover_url": null,
    "item": "SINUMERIK HANDHELD TERMINAL HT...",
    "quantity": 3,
    "ministry": "Ministry of Defence",
    "department": "Department of Defence Production",
    "organisation_address": null,
    "start_datetime_raw": "14-01-2026 10:49 AM",
    "end_datetime_raw": "15-01-2026 5:00 PM",
    "start_datetime": "2026-01-14T10:49:00",
    "end_datetime": "2026-01-15T17:00:00",
    "stage": "Bid Award",
    "bid_ra_status": null,
    "technical_status": null,
    "raw_card_text": "BID NO:\u00a0GEM/2026/B/7109966\n\nStatus: Bid Award\n\nItems:\u00a0SINUMERIK HANDHELD TERMINAL HT...\nQuantity:\u00a03\nDepartment Name And Address:\u00a0\nMinistry of Defence\nDepartment of Defence Production\nStart Date:\u00a014-01-2026 10:49 AM\nEnd Date:\u00a0\u00a0\u00a015-01-2026 5:00 PM"
  },
  {
    "bid_number": "GEM/2025/B/7054330",
    "bid_detail_url": "https://bidplus.gem.gov.in/showbidDocument/8774552",
    "bid_hover_url": "https://bidplus.gem.gov.in/bidding/bid/getBidResultView/8774552",
    "has_reverse_auction": false,
    "ra_number": null,
    "ra_detail_url": null,
    "ra_hover_url": null,
    "item": "Digital Multimeter,Electric So...",
    "quantity": 9176,
    "ministry": "Home Department Madhya Pradesh",
    "department": null,
    "organisation_address": null,
    "start_datetime_raw": "30-12-2025 10:34 PM",
    "end_datetime_raw": "15-01-2026 5:00 PM",
    "start_datetime": "2025-12-30T22:34:00",
    "end_datetime": "2026-01-15T17:00:00",
    "stage": "Bid Award",
    "bid_ra_status": null,
    "technical_status": null,
    "raw_card_text": "BID NO:\u00a0GEM/2025/B/7054330\n\nStatus: Bid Award\n\nItems:\u00a0Digital Multimeter,Electric So...\nQuantity:\u00a09176\nDepartment Name And Address:\u00a0\nHome Department Madhya Pradesh\nStart Date:\u00a030-12-2025 10:34 PM\nEnd Date:\u00a0\u00a0\u00a015-01-2026 5:00 PM"
  },
  {
    "bid_number": "GEM/2026/B/7063919",
    "bid_detail_url": "https://bidplus.gem.gov.in/showbidDocument/8786136",
    "bid_hover_url": "https://bidplus.gem.gov.in/bidding/bid/getBidResultView/8786136",
    "has_reverse_auction": true,
    "ra_number": "GEM/2026/R/606465",
    "ra_detail_url": "https://bidplus.gem.gov.in/showradocumentPdf/8836819",
    "ra_hover_url": "https://bidplus.gem.gov.in/bidding/bid/getBidResultView/8836819",
    "item": "Dry Erase Writing Boards (V3),...",
    "quantity": 201,
    "ministry": "Ministry of Defence",
    "department": "Department of Military Affairs",
    "organisation_address": null,
    "start_datetime_raw": "14-01-2026 5:00 PM",
    "end_datetime_raw": "15-01-2026 5:00 PM",
    "start_datetime": "2026-01-14T17:00:00",
    "end_datetime": "2026-01-15T17:00:00",
    "stage": "Bid Award",
    "bid_ra_status": null,
    "technical_status": null,
    "raw_card_text": "Bid No.:\u00a0 GEM/2026/B/7063919\n\nRA NO:\u00a0GEM/2026/R/606465\n\nStatus: Bid Award\n\nItems:\u00a0Dry Erase Writing Boards (V3),...\nQuantity:\u00a0201\nDepartment Name And Address:\u00a0\nMinistry of Defence\nDepartment of Military Affairs\nStart Date:\u00a014-01-2026 5:00 PM\nEnd Date:\u00a0\u00a0\u00a015-01-2026 5:00 PM"
  },
  {
    "bid_number": "GEM/2026/B/7066822",
    "bid_detail_url": "https://bidplus.gem.gov.in/showbidDocument/8789397",
    "bid_hover_url": "https://bidplus.gem.gov.in/bidding/bid/getBidResultView/8789397",
    "has_reverse_auction": false,
    "ra_number": null,
    "ra_detail_url": null,
    "ra_hover_url": null,
    "item": "Solar Photovoltaic Water Pumpi...",
    "quantity": 10,
    "ministry": "Revenue Department Tripura",
    "department": null,
    "organisation_address": null,
    "start_datetime_raw": "03-01-2026 1:54 PM",
    "end_datetime_raw": "15-01-2026 5:00 PM",
    "start_datetime": "2026-01-03T13:54:00",
    "end_datetime": "2026-01-15T17:00:00",
    "stage": "Bid Award",
    "bid_ra_status": null,
    "technical_status": null,
    "raw_card_text": "BID NO:\u00a0GEM/2026/B/7066822\n\nStatus: Bid Award\n\nItems:\u00a0Solar Photovoltaic Water Pumpi...\nQuantity:\u00a010\nDepartment Name And Address:\u00a0\nRevenue Department Tripura\nStart Date:\u00a003-01-2026 1:54 PM\nEnd Date:\u00a0\u00a0\u00a015-01-2026 5:00 PM"
  },
  {
    "bid_number": "GEM/2026/B/7095901",
    "bid_detail_url": "https://bidplus.gem.gov.in/showbidDocument/8822130",
    "bid_hover_url": "https://bidplus.gem.gov.in/bidding/bid/getBidResultView/8822130",
    "has_reverse_auction": true,
    "ra_number": "GEM/2026/R/606464",
    "ra_detail_url": "https://bidplus.gem.gov.in/showradocumentPdf/8836791",
    "ra_hover_url": "https://bidplus.gem.gov.in/bidding/bid/getBidResultView/8836791",
    "item": "Tentage Service Lumpsum Based ...",
    "quantity": 1,
    "ministry": "Ministry of Defence",
    "department": "Department of Defence",
    "organisation_address": null,
    "start_datetime_raw": "14-01-2026 5:00 PM",
    "end_datetime_raw": "15-01-2026 5:00 PM",
    "start_datetime": "2026-01-14T17:00:00",
    "end_datetime": "2026-01-15T17:00:00",
    "stage": "Bid Award",
    "bid_ra_status": null,
    "technical_status": null,
    "raw_card_text": "Bid No.:\u00a0 GEM/2026/B/7095901\n\nRA NO:\u00a0GEM/2026/R/606464\n\nStatus: Bid Award\n\nItems:\u00a0Tentage Service Lumpsum Based ...\nQuantity:\u00a01\nDepartment Name And Address:\u00a0\nMinistry of Defence\nDepartment of Defence\nStart Date:\u00a014-01-2026 5:00 PM\nEnd Date:\u00a0\u00a0\u00a015-01-2026 5:00 PM"
  },
  {
    "bid_number": "GEM/2025/B/7056459",
    "bid_detail_url": "https://bidplus.gem.gov.in/showbidDocument/8777103",
    "bid_hover_url": "https://bidplus.gem.gov.in/bidding/bid/getBidResultView/8777103",
    "has_reverse_auction": true,
    "ra_number": "GEM/2026/R/606454",
    "ra_detail_url": "https://bidplus.gem.gov.in/showradocumentPdf/8836587",
    "ra_hover_url": "https://bidplus.gem.gov.in/bidding/bid/getBidResultView/8836587",
    "item": "Custom Bid for Services - Repa...",
    "quantity": 1,
    "ministry": "Ministry of Defence",
    "department": "Department of Defence",
    "organisation_address": null,
    "start_datetime_raw": "14-01-2026 5:00 PM",
    "end_datetime_raw": "15-01-2026 5:00 PM",
    "start_datetime": "2026-01-14T17:00:00",
    "end_datetime": "2026-01-15T17:00:00",
    "stage": "Bid Award",
    "bid_ra_status": null,
    "technical_status": null,
    "raw_card_text": "Bid No.:\u00a0 GEM/2025/B/7056459\n\nRA NO:\u00a0GEM/2026/R/606454\n\nStatus: Bid Award\n\nItems:\u00a0Custom Bid for Services - Repa...\nQuantity:\u00a01\nDepartment Name And Address:\u00a0\nMinistry of Defence\nDepartment of Defence\nStart Date:\u00a014-01-2026 5:00 PM\nEnd Date:\u00a0\u00a0\u00a015-01-2026 5:00 PM"
  },
  {
    "bid_number": "GEM/2026/B/7103079",
    "bid_detail_url": "https://bidplus.gem.gov.in/showbidDocument/8830534",
    "bid_hover_url": "https://bidplus.gem.gov.in/bidding/bid/getSinglePacketResultView/8830534",
    "has_reverse_auction": false,
    "ra_number": null,
    "ra_detail_url": null,
    "ra_hover_url": null,
    "item": "Recruitment / Examination Soft...",
    "quantity": 2,
    "ministry": "Ministry of Defence",
    "department": "Department of Military Affairs",
    "organisation_address": null,
    "start_datetime_raw": "12-01-2026 4:22 PM",
    "end_datetime_raw": "15-01-2026 5:00 PM",
    "start_datetime": "2026-01-12T16:22:00",
    "end_datetime": "2026-01-15T17:00:00",
    "stage": "Bid Award",
    "bid_ra_status": null,
    "technical_status": null,
    "raw_card_text": "BID NO:\u00a0GEM/2026/B/7103079\n\nStatus: Bid Award\n\nItems:\u00a0Recruitment / Examination Soft...\nQuantity:\u00a02\nDepartment Name And Address:\u00a0\nMinistry of Defence\nDepartment of Military Affairs\nStart Date:\u00a012-01-2026 4:22 PM\nEnd Date:\u00a0\u00a0\u00a015-01-2026 5:00 PM"
  },
  {
    "bid_number": "GEM/2026/B/7102709",
    "bid_detail_url": "https://bidplus.gem.gov.in/showbidDocument/8830110",
    "bid_hover_url": "https://bidplus.gem.gov.in/bidding/bid/getSinglePacketResultView/8830110",
    "has_reverse_auction": false,
    "ra_number": null,
    "ra_detail_url": null,
    "ra_hover_url": null,
    "item": "Repair, Maintenance, and Insta...",
    "quantity": 1,
    "ministry": "PMO",
    "department": "Department of Atomic Energy",
    "organisation_address": null,
    "start_datetime_raw": "12-01-2026 4:00 PM",
    "end_datetime_raw": "15-01-2026 5:00 PM",
    "start_datetime": "2026-01-12T16:00:00",
    "end_datetime": "2026-01-15T17:00:00",
    "stage": "Bid Award",
    "bid_ra_status": null,
    "technical_status": null,
    "raw_card_text": "BID NO:\u00a0GEM/2026/B/7102709\n\nStatus: Bid Award\n\nItems:\u00a0Repair, Maintenance, and Insta...\nQuantity:\u00a01\nDepartment Name And Address:\u00a0\nPMO\nDepartment of Atomic Energy\nStart Date:\u00a012-01-2026 4:00 PM\nEnd Date:\u00a0\u00a0\u00a015-01-2026 5:00 PM"
  },
  {
    "bid_number": "GEM/2026/B/7072972",
    "bid_detail_url": "https://bidplus.gem.gov.in/showbidDocument/8796427",
    "bid_hover_url": "https://bidplus.gem.gov.in/bidding/bid/getSinglePacketResultView/8796427",
    "has_reverse_auction": false,
    "ra_number": null,
    "ra_detail_url": null,
    "ra_hover_url": null,
    "item": "COMP. SPRING (HW-172.104) -- F...",
    "quantity": 7,
    "ministry": "Ministry of Heavy Industries and Public Enterprises",
    "department": "Department of Heavy Industry",
    "organisation_address": null,
    "start_datetime_raw": "05-01-2026 4:16 PM",
    "end_datetime_raw": "15-01-2026 5:00 PM",
    "start_datetime": "2026-01-05T16:16:00",
    "end_datetime": "2026-01-15T17:00:00",
    "stage": "Bid Award",
    "bid_ra_status": null,
    "technical_status": null,
    "raw_card_text": "BID NO:\u00a0GEM/2026/B/7072972\n\nStatus: Bid Award\n\nItems:\u00a0COMP. SPRING (HW-172.104) -- F...\nQuantity:\u00a07\nDepartment Name And Address:\u00a0\nMinistry of Heavy Industries and Public Enterprises\nDepartment of Heavy Industry\nStart Date:\u00a005-01-2026 4:16 PM\nEnd Date:\u00a0\u00a0\u00a015-01-2026 5:00 PM"
  },
  {
    "bid_number": "GEM/2026/B/7073688",
    "bid_detail_url": "https://bidplus.gem.gov.in/showbidDocument/8797225",
    "bid_hover_url": "https://bidplus.gem.gov.in/bidding/bid/getSinglePacketResultView/8797225",
    "has_reverse_auction": false,
    "ra_number": null,
    "ra_detail_url": null,
    "ra_hover_url": null,
    "item": "PISTON SEALING VAR. 05 (HW-290...",
    "quantity": 22,
    "ministry": "Ministry of Heavy Industries and Public Enterprises",
    "department": "Department of Heavy Industry",
    "organisation_address": null,
    "start_datetime_raw": "05-01-2026 4:53 PM",
    "end_datetime_raw": "15-01-2026 5:00 PM",
    "start_datetime": "2026-01-05T16:53:00",
    "end_datetime": "2026-01-15T17:00:00",
    "stage": "Bid Award",
    "bid_ra_status": null,
    "technical_status": null,
    "raw_card_text": "BID NO:\u00a0GEM/2026/B/7073688\n\nStatus: Bid Award\n\nItems:\u00a0PISTON SEALING VAR. 05 (HW-290...\nQuantity:\u00a022\nDepartment Name And Address:\u00a0\nMinistry of Heavy Industries and Public Enterprises\nDepartment of Heavy Industry\nStart Date:\u00a005-01-2026 4:53 PM\nEnd Date:\u00a0\u00a0\u00a015-01-2026 5:00 PM"
  },
  {
    "bid_number": "GEM/2025/B/6968591",
    "bid_detail_url": "https://bidplus.gem.gov.in/showbidDocument/8676688",
    "bid_hover_url": "https://bidplus.gem.gov.in/bidding/bid/getBidResultView/8676688",
    "has_reverse_auction": true,
    "ra_number": "GEM/2026/R/605635",
    "ra_detail_url": "https://bidplus.gem.gov.in/showradocumentPdf/8829482",
    "ra_hover_url": "https://bidplus.gem.gov.in/bidding/bid/getBidResultView/8829482",
    "item": "Argon, Compressed And Liquid C...",
    "quantity": 700,
    "ministry": "Ministry of Electronics and Information Technology",
    "department": "Department of Electronics and Information Technology",
    "organisation_address": null,
    "start_datetime_raw": "13-01-2026 3:00 PM",
    "end_datetime_raw": "15-01-2026 4:21 PM",
    "start_datetime": "2026-01-13T15:00:00",
    "end_datetime": "2026-01-15T16:21:00",
    "stage": "Bid Award",
    "bid_ra_status": null,
    "technical_status": null,
    "raw_card_text": "Bid No.:\u00a0 GEM/2025/B/6968591\n\nRA NO:\u00a0GEM/2026/R/605635\n\nStatus: Bid Award\n\nItems:\u00a0Argon, Compressed And Liquid C...\nQuantity:\u00a0700\nDepartment Name And Address:\u00a0\nMinistry of Electronics and Information Technology\nDepartment of Electronics and Information Technology\nStart Date:\u00a013-01-2026 3:00 PM\nEnd Date:\u00a0\u00a0\u00a015-01-2026 4:21 PM"
  },
  {
    "bid_number": "GEM/2025/B/7017081",
    "bid_detail_url": "https://bidplus.gem.gov.in/showbidDocument/8731730",
    "bid_hover_url": "https://bidplus.gem.gov.in/bidding/bid/getBidResultView/8731730",
    "has_reverse_auction": true,
    "ra_number": "GEM/2026/R/606375",
    "ra_detail_url": "https://bidplus.gem.gov.in/showradocumentPdf/8835482",
    "ra_hover_url": "https://bidplus.gem.gov.in/bidding/bid/getBidResultView/8835482",
    "item": "LOAD BLOCK 1 TON,LOAD BLOCK 3 ...",
    "quantity": 4,
    "ministry": "Ministry of Defence",
    "department": "Department of Military Affairs",
    "organisation_address": null,
    "start_datetime_raw": "14-01-2026 3:00 PM",
    "end_datetime_raw": "15-01-2026 4:17 PM",
    "start_datetime": "2026-01-14T15:00:00",
    "end_datetime": "2026-01-15T16:17:00",
    "stage": "Bid Award",
    "bid_ra_status": null,
    "technical_status": null,
    "raw_card_text": "Bid No.:\u00a0 GEM/2025/B/7017081\n\nRA NO:\u00a0GEM/2026/R/606375\n\nStatus: Bid Award\n\nItems:\u00a0LOAD BLOCK 1 TON,LOAD BLOCK 3 ...\nQuantity:\u00a04\nDepartment Name And Address:\u00a0\nMinistry of Defence\nDepartment of Military Affairs\nStart Date:\u00a014-01-2026 3:00 PM\nEnd Date:\u00a0\u00a0\u00a015-01-2026 4:17 PM"
  },
  {
    "bid_number": "GEM/2025/B/7031101",
    "bid_detail_url": "https://bidplus.gem.gov.in/showbidDocument/8747696",
    "bid_hover_url": "https://bidplus.gem.gov.in/bidding/bid/getBidResultView/8747696",
    "has_reverse_auction": true,
    "ra_number": "GEM/2026/R/606330",
    "ra_detail_url": "https://bidplus.gem.gov.in/showradocumentPdf/8835027",
    "ra_hover_url": "https://bidplus.gem.gov.in/bidding/bid/getBidResultView/8835027",
    "item": "Entry and Mid Level Desktop Co...",
    "quantity": 6,
    "ministry": "Ministry of Education",
    "department": "Department of School Education and Literacy",
    "organisation_address": null,
    "start_datetime_raw": "14-01-2026 2:00 PM",
    "end_datetime_raw": "15-01-2026 4:16 PM",
    "start_datetime": "2026-01-14T14:00:00",
    "end_datetime": "2026-01-15T16:16:00",
    "stage": "Bid Award",
    "bid_ra_status": null,
    "technical_status": null,
    "raw_card_text": "Bid No.:\u00a0 GEM/2025/B/7031101\n\nRA NO:\u00a0GEM/2026/R/606330\n\nStatus: Bid Award\n\nItems:\u00a0Entry and Mid Level Desktop Co...\nQuantity:\u00a06\nDepartment Name And Address:\u00a0\nMinistry of Education\nDepartment of School Education and Literacy\nStart Date:\u00a014-01-2026 2:00 PM\nEnd Date:\u00a0\u00a0\u00a015-01-2026 4:16 PM"
  },
  {
    "bid_number": "GEM/2025/B/7045390",
    "bid_detail_url": "https://bidplus.gem.gov.in/showbidDocument/8763969",
    "bid_hover_url": "https://bidplus.gem.gov.in/bidding/bid/getBidResultView/8763969",
    "has_reverse_auction": true,
    "ra_number": "GEM/2026/R/606393",
    "ra_detail_url": "https://bidplus.gem.gov.in/showradocumentPdf/8835676",
    "ra_hover_url": "https://bidplus.gem.gov.in/bidding/bid/getBidResultView/8835676",
    "item": "Goods Transport Service \u2013 Per ...",
    "quantity": 10620,
    "ministry": "Ministry of Defence",
    "department": "Department of Military Affairs",
    "organisation_address": null,
    "start_datetime_raw": "14-01-2026 4:00 PM",
    "end_datetime_raw": "15-01-2026 4:00 PM",
    "start_datetime": "2026-01-14T16:00:00",
    "end_datetime": "2026-01-15T16:00:00",
    "stage": "Bid Award",
    "bid_ra_status": null,
    "technical_status": null,
    "raw_card_text": "Bid No.:\u00a0 GEM/2025/B/7045390\n\nRA NO:\u00a0GEM/2026/R/606393\n\nStatus: Bid Award\n\nItems:\u00a0Goods Transport Service \u2013 Per ...\nQuantity:\u00a010620\nDepartment Name And Address:\u00a0\nMinistry of Defence\nDepartment of Military Affairs\nStart Date:\u00a014-01-2026 4:00 PM\nEnd Date:\u00a0\u00a0\u00a015-01-2026 4:00 PM"
  },
  {
    "bid_number": "GEM/2025/B/6984612",
    "bid_detail_url": "https://bidplus.gem.gov.in/showbidDocument/8695366",
    "bid_hover_url": "https://bidplus.gem.gov.in/bidding/bid/getBidResultView/8695366",
    "has_reverse_auction": true,
    "ra_number": "GEM/2026/R/606397",
    "ra_detail_url": "https://bidplus.gem.gov.in/showradocumentPdf/8835717",
    "ra_hover_url": "https://bidplus.gem.gov.in/bidding/bid/getBidResultView/8835717",
    "item": "Malathion Emulsifiable Concent...",
    "quantity": 2500,
    "ministry": "Ministry of Consumer Affairs Food and Public Distribution",
    "department": "Department of Food and Public Distribution",
    "organisation_address": null,
    "start_datetime_raw": "14-01-2026 4:00 PM",
    "end_datetime_raw": "15-01-2026 4:00 PM",
    "start_datetime": "2026-01-14T16:00:00",
    "end_datetime": "2026-01-15T16:00:00",
    "stage": "Bid Award",
    "bid_ra_status": null,
    "technical_status": null,
    "raw_card_text": "Bid No.:\u00a0 GEM/2025/B/6984612\n\nRA NO:\u00a0GEM/2026/R/606397\n\nStatus: Bid Award\n\nItems:\u00a0Malathion Emulsifiable Concent...\nQuantity:\u00a02500\nDepartment Name And Address:\u00a0\nMinistry of Consumer Affairs Food and Public Distribution\nDepartment of Food and Public Distribution\nStart Date:\u00a014-01-2026 4:00 PM\nEnd Date:\u00a0\u00a0\u00a015-01-2026 4:00 PM"
  },
  {
    "bid_number": "GEM/2025/B/7037601",
    "bid_detail_url": "https://bidplus.gem.gov.in/showbidDocument/8755051",
    "bid_hover_url": "https://bidplus.gem.gov.in/bidding/bid/getBidResultView/8755051",
    "has_reverse_auction": true,
    "ra_number": "GEM/2026/R/606425",
    "ra_detail_url": "https://bidplus.gem.gov.in/showradocumentPdf/8836094",
    "ra_hover_url": "https://bidplus.gem.gov.in/bidding/bid/getBidResultView/8836094",
    "item": "Aldrop bolt Stainless steel 25...",
    "quantity": 4175,
    "ministry": "Ministry of Defence",
    "department": "Department of Military Affairs",
    "organisation_address": null,
    "start_datetime_raw": "14-01-2026 4:00 PM",
    "end_datetime_raw": "15-01-2026 4:00 PM",
    "start_datetime": "2026-01-14T16:00:00",
    "end_datetime": "2026-01-15T16:00:00",
    "stage": "Bid Award",
    "bid_ra_status": null,
    "technical_status": null,
    "raw_card_text": "Bid No.:\u00a0 GEM/2025/B/7037601\n\nRA NO:\u00a0GEM/2026/R/606425\n\nStatus: Bid Award\n\nItems:\u00a0Aldrop bolt Stainless steel 25...\nQuantity:\u00a04175\nDepartment Name And Address:\u00a0\nMinistry of Defence\nDepartment of Military Affairs\nStart Date:\u00a014-01-2026 4:00 PM\nEnd Date:\u00a0\u00a0\u00a015-01-2026 4:00 PM"
  },
  {
    "bid_number": "GEM/2026/B/7102426",
    "bid_detail_url": "https://bidplus.gem.gov.in/showbidDocument/8829787",
    "bid_hover_url": "https://bidplus.gem.gov.in/bidding/bid/getSinglePacketResultView/8829787",
    "has_reverse_auction": false,
    "ra_number": null,
    "ra_detail_url": null,
    "ra_hover_url": null,
    "item": "Short Term Cab & Taxi Hiring S...",
    "quantity": 18,
    "ministry": "Department of Space",
    "department": "Department of Space",
    "organisation_address": null,
    "start_datetime_raw": "12-01-2026 3:01 PM",
    "end_datetime_raw": "15-01-2026 4:00 PM",
    "start_datetime": "2026-01-12T15:01:00",
    "end_datetime": "2026-01-15T16:00:00",
    "stage": "Bid Award",
    "bid_ra_status": null,
    "technical_status": null,
    "raw_card_text": "BID NO:\u00a0GEM/2026/B/7102426\n\nStatus: Bid Award\n\nItems:\u00a0Short Term Cab & Taxi Hiring S...\nQuantity:\u00a018\nDepartment Name And Address:\u00a0\nDepartment of Space\nDepartment of Space\nStart Date:\u00a012-01-2026 3:01 PM\nEnd Date:\u00a0\u00a0\u00a015-01-2026 4:00 PM"
  },
  {
    "bid_number": "GEM/2026/B/7072841",
    "bid_detail_url": "https://bidplus.gem.gov.in/showbidDocument/8796284",
    "bid_hover_url": "https://bidplus.gem.gov.in/bidding/bid/getBidResultView/8796284",
    "has_reverse_auction": false,
    "ra_number": null,
    "ra_detail_url": null,
    "ra_hover_url": null,
    "item": "Professional Camcorder",
    "quantity": 1,
    "ministry": "Ministry of Defence",
    "department": "Department of Defence",
    "organisation_address": null,
    "start_datetime_raw": "05-01-2026 3:39 PM",
    "end_datetime_raw": "15-01-2026 4:00 PM",
    "start_datetime": "2026-01-05T15:39:00",
    "end_datetime": "2026-01-15T16:00:00",
    "stage": "Bid Award",
    "bid_ra_status": null,
    "technical_status": null,
    "raw_card_text": "BID NO:\u00a0GEM/2026/B/7072841\n\nStatus: Bid Award\n\nItems:\u00a0Professional Camcorder\nQuantity:\u00a01\nDepartment Name And Address:\u00a0\nMinistry of Defence\nDepartment of Defence\nStart Date:\u00a005-01-2026 3:39 PM\nEnd Date:\u00a0\u00a0\u00a015-01-2026 4:00 PM"
  },
  {
    "bid_number": "GEM/2026/B/7098382",
    "bid_detail_url": "https://bidplus.gem.gov.in/showbidDocument/8824987",
    "bid_hover_url": "https://bidplus.gem.gov.in/bidding/bid/getBidResultView/8824987",
    "has_reverse_auction": false,
    "ra_number": null,
    "ra_detail_url": null,
    "ra_hover_url": null,
    "item": "Toner Cartridges / Ink Cartrid...",
    "quantity": 5,
    "ministry": "Ministry of Home Affairs",
    "department": "Women Safety Division",
    "organisation_address": null,
    "start_datetime_raw": "10-01-2026 3:27 PM",
    "end_datetime_raw": "15-01-2026 4:00 PM",
    "start_datetime": "2026-01-10T15:27:00",
    "end_datetime": "2026-01-15T16:00:00",
    "stage": "Bid Award",
    "bid_ra_status": null,
    "technical_status": null,
    "raw_card_text": "BID NO:\u00a0GEM/2026/B/7098382\n\nStatus: Bid Award\n\nItems:\u00a0Toner Cartridges / Ink Cartrid...\nQuantity:\u00a05\nDepartment Name And Address:\u00a0\nMinistry of Home Affairs\nWomen Safety Division\nStart Date:\u00a010-01-2026 3:27 PM\nEnd Date:\u00a0\u00a0\u00a015-01-2026 4:00 PM"
  },
  {
    "bid_number": "GEM/2026/B/7071788",
    "bid_detail_url": "https://bidplus.gem.gov.in/showbidDocument/8795030",
    "bid_hover_url": "https://bidplus.gem.gov.in/bidding/bid/getBidResultView/8795030",
    "has_reverse_auction": false,
    "ra_number": null,
    "ra_detail_url": null,
    "ra_hover_url": null,
    "item": "Conveyor and Elevator Textile ...",
    "quantity": 1,
    "ministry": "Local Self Government Department Kerala",
    "department": null,
    "organisation_address": null,
    "start_datetime_raw": "05-01-2026 3:15 PM",
    "end_datetime_raw": "15-01-2026 4:00 PM",
    "start_datetime": "2026-01-05T15:15:00",
    "end_datetime": "2026-01-15T16:00:00",
    "stage": "Bid Award",
    "bid_ra_status": null,
    "technical_status": null,
    "raw_card_text": "BID NO:\u00a0GEM/2026/B/7071788\n\nStatus: Bid Award\n\nItems:\u00a0Conveyor and Elevator Textile ...\nQuantity:\u00a01\nDepartment Name And Address:\u00a0\nLocal Self Government Department Kerala\nStart Date:\u00a005-01-2026 3:15 PM\nEnd Date:\u00a0\u00a0\u00a015-01-2026 4:00 PM"
  },
  {
    "bid_number": "GEM/2025/B/6878369",
    "bid_detail_url": "https://bidplus.gem.gov.in/showbidDocument/8574155",
    "bid_hover_url": "https://bidplus.gem.gov.in/bidding/bid/getBidResultView/8574155",
    "has_reverse_auction": true,
    "ra_number": "GEM/2026/R/606422",
    "ra_detail_url": "https://bidplus.gem.gov.in/showradocumentPdf/8836042",
    "ra_hover_url": "https://bidplus.gem.gov.in/bidding/bid/getBidResultView/8836042",
    "item": "Laboratory Drying Oven",
    "quantity": 1,
    "ministry": "Education Department Gujarat",
    "department": null,
    "organisation_address": null,
    "start_datetime_raw": "14-01-2026 4:00 PM",
    "end_datetime_raw": "15-01-2026 4:00 PM",
    "start_datetime": "2026-01-14T16:00:00",
    "end_datetime": "2026-01-15T16:00:00",
    "stage": "Bid Award",
    "bid_ra_status": null,
    "technical_status": null,
    "raw_card_text": "Bid No.:\u00a0 GEM/2025/B/6878369\n\nRA NO:\u00a0GEM/2026/R/606422\n\nStatus: Bid Award\n\nItems:\u00a0Laboratory Drying Oven\nQuantity:\u00a01\nDepartment Name And Address:\u00a0\nEducation Department Gujarat\nStart Date:\u00a014-01-2026 4:00 PM\nEnd Date:\u00a0\u00a0\u00a015-01-2026 4:00 PM"
  },
  {
    "bid_number": "GEM/2025/B/6919041",
    "bid_detail_url": "https://bidplus.gem.gov.in/showbidDocument/8620164",
    "bid_hover_url": "https://bidplus.gem.gov.in/bidding/bid/getBidResultView/8620164",
    "has_reverse_auction": true,
    "ra_number": "GEM/2026/R/606413",
    "ra_detail_url": "https://bidplus.gem.gov.in/showradocumentPdf/8835965",
    "ra_hover_url": "https://bidplus.gem.gov.in/bidding/bid/getBidResultView/8835965",
    "item": "Enamel, Synthetic, Exterior (A...",
    "quantity": 40,
    "ministry": "Ministry of Defence",
    "department": "Department of Military Affairs",
    "organisation_address": null,
    "start_datetime_raw": "14-01-2026 4:00 PM",
    "end_datetime_raw": "15-01-2026 4:00 PM",
    "start_datetime": "2026-01-14T16:00:00",
    "end_datetime": "2026-01-15T16:00:00",
    "stage": "Bid Award",
    "bid_ra_status": null,
    "technical_status": null,
    "raw_card_text": "Bid No.:\u00a0 GEM/2025/B/6919041\n\nRA NO:\u00a0GEM/2026/R/606413\n\nStatus: Bid Award\n\nItems:\u00a0Enamel, Synthetic, Exterior (A...\nQuantity:\u00a040\nDepartment Name And Address:\u00a0\nMinistry of Defence\nDepartment of Military Affairs\nStart Date:\u00a014-01-2026 4:00 PM\nEnd Date:\u00a0\u00a0\u00a015-01-2026 4:00 PM"
  },
  {
    "bid_number": "GEM/2026/B/7072332",
    "bid_detail_url": "https://bidplus.gem.gov.in/showbidDocument/8795690",
    "bid_hover_url": "https://bidplus.gem.gov.in/bidding/bid/getBidResultView/8795690",
    "has_reverse_auction": false,
    "ra_number": null,
    "ra_detail_url": null,
    "ra_hover_url": null,
    "item": "HEAD LIGHT ASSY,CARTRIDGE LUB ...",
    "quantity": 5,
    "ministry": "Ministry of Defence",
    "department": "Department of Military Affairs",
    "organisation_address": null,
    "start_datetime_raw": "05-01-2026 2:42 PM",
    "end_datetime_raw": "15-01-2026 3:00 PM",
    "start_datetime": "2026-01-05T14:42:00",
    "end_datetime": "2026-01-15T15:00:00",
    "stage": "Bid Award",
    "bid_ra_status": null,
    "technical_status": null,
    "raw_card_text": "BID NO:\u00a0GEM/2026/B/7072332\n\nStatus: Bid Award\n\nItems:\u00a0HEAD LIGHT ASSY,CARTRIDGE LUB ...\nQuantity:\u00a05\nDepartment Name And Address:\u00a0\nMinistry of Defence\nDepartment of Military Affairs\nStart Date:\u00a005-01-2026 2:42 PM\nEnd Date:\u00a0\u00a0\u00a015-01-2026 3:00 PM"
  },
  {
    "bid_number": "GEM/2026/B/7072238",
    "bid_detail_url": "https://bidplus.gem.gov.in/showbidDocument/8795578",
    "bid_hover_url": "https://bidplus.gem.gov.in/bidding/bid/getBidResultView/8795578",
    "has_reverse_auction": false,
    "ra_number": null,
    "ra_detail_url": null,
    "ra_hover_url": null,
    "item": "RUBBER COUPLING,O RING SET,FAN...",
    "quantity": 29,
    "ministry": "Ministry of Defence",
    "department": "Department of Military Affairs",
    "organisation_address": null,
    "start_datetime_raw": "05-01-2026 2:06 PM",
    "end_datetime_raw": "15-01-2026 3:00 PM",
    "start_datetime": "2026-01-05T14:06:00",
    "end_datetime": "2026-01-15T15:00:00",
    "stage": "Bid Award",
    "bid_ra_status": null,
    "technical_status": null,
    "raw_card_text": "BID NO:\u00a0GEM/2026/B/7072238\n\nStatus: Bid Award\n\nItems:\u00a0RUBBER COUPLING,O RING SET,FAN...\nQuantity:\u00a029\nDepartment Name And Address:\u00a0\nMinistry of Defence\nDepartment of Military Affairs\nStart Date:\u00a005-01-2026 2:06 PM\nEnd Date:\u00a0\u00a0\u00a015-01-2026 3:00 PM"
  },
  {
    "bid_number": "GEM/2026/B/7067716",
    "bid_detail_url": "https://bidplus.gem.gov.in/showbidDocument/8790399",
    "bid_hover_url": "https://bidplus.gem.gov.in/bidding/bid/getBidResultView/8790399",
    "has_reverse_auction": false,
    "ra_number": null,
    "ra_detail_url": null,
    "ra_hover_url": null,
    "item": "Gasket,Ring Packing,Seal Ring ...",
    "quantity": 178,
    "ministry": "Ministry of Defence",
    "department": "Department of Military Affairs",
    "organisation_address": null,
    "start_datetime_raw": "03-01-2026 2:40 PM",
    "end_datetime_raw": "15-01-2026 3:00 PM",
    "start_datetime": "2026-01-03T14:40:00",
    "end_datetime": "2026-01-15T15:00:00",
    "stage": "Bid Award",
    "bid_ra_status": null,
    "technical_status": null,
    "raw_card_text": "BID NO:\u00a0GEM/2026/B/7067716\n\nStatus: Bid Award\n\nItems:\u00a0Gasket,Ring Packing,Seal Ring ...\nQuantity:\u00a0178\nDepartment Name And Address:\u00a0\nMinistry of Defence\nDepartment of Military Affairs\nStart Date:\u00a003-01-2026 2:40 PM\nEnd Date:\u00a0\u00a0\u00a015-01-2026 3:00 PM"
  },
  {
    "bid_number": "GEM/2026/B/7072285",
    "bid_detail_url": "https://bidplus.gem.gov.in/showbidDocument/8795631",
    "bid_hover_url": "https://bidplus.gem.gov.in/bidding/bid/getBidResultView/8795631",
    "has_reverse_auction": false,
    "ra_number": null,
    "ra_detail_url": null,
    "ra_hover_url": null,
    "item": "BTY 6V 5 AH,SEARCH LIGHT BULB,...",
    "quantity": 7,
    "ministry": "Ministry of Defence",
    "department": "Department of Military Affairs",
    "organisation_address": null,
    "start_datetime_raw": "05-01-2026 2:12 PM",
    "end_datetime_raw": "15-01-2026 3:00 PM",
    "start_datetime": "2026-01-05T14:12:00",
    "end_datetime": "2026-01-15T15:00:00",
    "stage": "Bid Award",
    "bid_ra_status": null,
    "technical_status": null,
    "raw_card_text": "BID NO:\u00a0GEM/2026/B/7072285\n\nStatus: Bid Award\n\nItems:\u00a0BTY 6V 5 AH,SEARCH LIGHT BULB,...\nQuantity:\u00a07\nDepartment Name And Address:\u00a0\nMinistry of Defence\nDepartment of Military Affairs\nStart Date:\u00a005-01-2026 2:12 PM\nEnd Date:\u00a0\u00a0\u00a015-01-2026 3:00 PM"
  },
  {
    "bid_number": "GEM/2026/B/7072276",
    "bid_detail_url": "https://bidplus.gem.gov.in/showbidDocument/8795622",
    "bid_hover_url": "https://bidplus.gem.gov.in/bidding/bid/getBidResultView/8795622",
    "has_reverse_auction": false,
    "ra_number": null,
    "ra_detail_url": null,
    "ra_hover_url": null,
    "item": "ACP Sheet,Back Lit Letters,Acr...",
    "quantity": 603,
    "ministry": "Ministry of Defence",
    "department": "Department of Military Affairs",
    "organisation_address": null,
    "start_datetime_raw": "05-01-2026 2:12 PM",
    "end_datetime_raw": "15-01-2026 3:00 PM",
    "start_datetime": "2026-01-05T14:12:00",
    "end_datetime": "2026-01-15T15:00:00",
    "stage": "Bid Award",
    "bid_ra_status": null,
    "technical_status": null,
    "raw_card_text": "BID NO:\u00a0GEM/2026/B/7072276\n\nStatus: Bid Award\n\nItems:\u00a0ACP Sheet,Back Lit Letters,Acr...\nQuantity:\u00a0603\nDepartment Name And Address:\u00a0\nMinistry of Defence\nDepartment of Military Affairs\nStart Date:\u00a005-01-2026 2:12 PM\nEnd Date:\u00a0\u00a0\u00a015-01-2026 3:00 PM"
  },
  {
    "bid_number": "GEM/2026/B/7069544",
    "bid_detail_url": "https://bidplus.gem.gov.in/showbidDocument/8792426",
    "bid_hover_url": "https://bidplus.gem.gov.in/bidding/bid/getSinglePacketResultView/8792426",
    "has_reverse_auction": false,
    "ra_number": null,
    "ra_detail_url": null,
    "ra_hover_url": null,
    "item": "Procurement of Refrigerator Si...",
    "quantity": 2,
    "ministry": "Ministry of Railways",
    "department": "Railways Public Sector Undertakings",
    "organisation_address": null,
    "start_datetime_raw": "04-01-2026 1:26 PM",
    "end_datetime_raw": "15-01-2026 3:00 PM",
    "start_datetime": "2026-01-04T13:26:00",
    "end_datetime": "2026-01-15T15:00:00",
    "stage": "Bid Award",
    "bid_ra_status": null,
    "technical_status": null,
    "raw_card_text": "BID NO:\u00a0GEM/2026/B/7069544\n\nStatus: Bid Award\n\nItems:\u00a0Procurement of Refrigerator Si...\nQuantity:\u00a02\nDepartment Name And Address:\u00a0\nMinistry of Railways\nRailways Public Sector Undertakings\nStart Date:\u00a004-01-2026 1:26 PM\nEnd Date:\u00a0\u00a0\u00a015-01-2026 3:00 PM"
  },
  {
    "bid_number": "GEM/2026/B/7069511",
    "bid_detail_url": "https://bidplus.gem.gov.in/showbidDocument/8792393",
    "bid_hover_url": "https://bidplus.gem.gov.in/bidding/bid/getSinglePacketResultView/8792393",
    "has_reverse_auction": false,
    "ra_number": null,
    "ra_detail_url": null,
    "ra_hover_url": null,
    "item": "Procurement of Mobile Thermal ...",
    "quantity": 1,
    "ministry": "Ministry of Railways",
    "department": "Railways Public Sector Undertakings",
    "organisation_address": null,
    "start_datetime_raw": "04-01-2026 1:10 PM",
    "end_datetime_raw": "15-01-2026 3:00 PM",
    "start_datetime": "2026-01-04T13:10:00",
    "end_datetime": "2026-01-15T15:00:00",
    "stage": "Bid Award",
    "bid_ra_status": null,
    "technical_status": null,
    "raw_card_text": "BID NO:\u00a0GEM/2026/B/7069511\n\nStatus: Bid Award\n\nItems:\u00a0Procurement of Mobile Thermal ...\nQuantity:\u00a01\nDepartment Name And Address:\u00a0\nMinistry of Railways\nRailways Public Sector Undertakings\nStart Date:\u00a004-01-2026 1:10 PM\nEnd Date:\u00a0\u00a0\u00a015-01-2026 3:00 PM"
  },
  {
    "bid_number": "GEM/2025/B/7000539",
    "bid_detail_url": "https://bidplus.gem.gov.in/showbidDocument/8713050",
    "bid_hover_url": "https://bidplus.gem.gov.in/bidding/bid/getBidResultView/8713050",
    "has_reverse_auction": true,
    "ra_number": "GEM/2026/R/606343",
    "ra_detail_url": "https://bidplus.gem.gov.in/showradocumentPdf/8835147",
    "ra_hover_url": "https://bidplus.gem.gov.in/bidding/bid/getBidResultView/8835147",
    "item": "LV7-STLN2815-72-0466873,LV7-ST...",
    "quantity": 169,
    "ministry": "Ministry of Defence",
    "department": "Department of Military Affairs",
    "organisation_address": null,
    "start_datetime_raw": "14-01-2026 3:00 PM",
    "end_datetime_raw": "15-01-2026 3:00 PM",
    "start_datetime": "2026-01-14T15:00:00",
    "end_datetime": "2026-01-15T15:00:00",
    "stage": "Bid Award",
    "bid_ra_status": null,
    "technical_status": null,
    "raw_card_text": "Bid No.:\u00a0 GEM/2025/B/7000539\n\nRA NO:\u00a0GEM/2026/R/606343\n\nStatus: Bid Award\n\nItems:\u00a0LV7-STLN2815-72-0466873,LV7-ST...\nQuantity:\u00a0169\nDepartment Name And Address:\u00a0\nMinistry of Defence\nDepartment of Military Affairs\nStart Date:\u00a014-01-2026 3:00 PM\nEnd Date:\u00a0\u00a0\u00a015-01-2026 3:00 PM"
  },
  {
    "bid_number": "GEM/2026/B/7072434",
    "bid_detail_url": "https://bidplus.gem.gov.in/showbidDocument/8795815",
    "bid_hover_url": "https://bidplus.gem.gov.in/bidding/bid/getSinglePacketResultView/8795815",
    "has_reverse_auction": false,
    "ra_number": null,
    "ra_detail_url": null,
    "ra_hover_url": null,
    "item": "BRACKET AGB,BOLT AGB BRACKET,F...",
    "quantity": 55,
    "ministry": "Ministry of Defence",
    "department": "Department of Military Affairs",
    "organisation_address": null,
    "start_datetime_raw": "05-01-2026 2:41 PM",
    "end_datetime_raw": "15-01-2026 3:00 PM",
    "start_datetime": "2026-01-05T14:41:00",
    "end_datetime": "2026-01-15T15:00:00",
    "stage": "Bid Award",
    "bid_ra_status": null,
    "technical_status": null,
    "raw_card_text": "BID NO:\u00a0GEM/2026/B/7072434\n\nStatus: Bid Award\n\nItems:\u00a0BRACKET AGB,BOLT AGB BRACKET,F...\nQuantity:\u00a055\nDepartment Name And Address:\u00a0\nMinistry of Defence\nDepartment of Military Affairs\nStart Date:\u00a005-01-2026 2:41 PM\nEnd Date:\u00a0\u00a0\u00a015-01-2026 3:00 PM"
  },
  {
    "bid_number": "GEM/2026/B/7072550",
    "bid_detail_url": "https://bidplus.gem.gov.in/showbidDocument/8795955",
    "bid_hover_url": "https://bidplus.gem.gov.in/bidding/bid/getSinglePacketResultView/8795955",
    "has_reverse_auction": false,
    "ra_number": null,
    "ra_detail_url": null,
    "ra_hover_url": null,
    "item": "M SEAL,ANABOND RED,INSULATION ...",
    "quantity": 232,
    "ministry": "Ministry of Defence",
    "department": "Department of Military Affairs",
    "organisation_address": null,
    "start_datetime_raw": "05-01-2026 2:52 PM",
    "end_datetime_raw": "15-01-2026 3:00 PM",
    "start_datetime": "2026-01-05T14:52:00",
    "end_datetime": "2026-01-15T15:00:00",
    "stage": "Bid Award",
    "bid_ra_status": null,
    "technical_status": null,
    "raw_card_text": "BID NO:\u00a0GEM/2026/B/7072550\n\nStatus: Bid Award\n\nItems:\u00a0M SEAL,ANABOND RED,INSULATION ...\nQuantity:\u00a0232\nDepartment Name And Address:\u00a0\nMinistry of Defence\nDepartment of Military Affairs\nStart Date:\u00a005-01-2026 2:52 PM\nEnd Date:\u00a0\u00a0\u00a015-01-2026 3:00 PM"
  },
  {
    "bid_number": "GEM/2025/B/7029918",
    "bid_detail_url": "https://bidplus.gem.gov.in/showbidDocument/8746254",
    "bid_hover_url": "https://bidplus.gem.gov.in/bidding/bid/getBidResultView/8746254",
    "has_reverse_auction": true,
    "ra_number": "GEM/2026/R/606362",
    "ra_detail_url": "https://bidplus.gem.gov.in/showradocumentPdf/8835388",
    "ra_hover_url": "https://bidplus.gem.gov.in/bidding/bid/getBidResultView/8835388",
    "item": "Smartphone (Chip A18 Pro or Hi...",
    "quantity": 1,
    "ministry": "Ministry of Defence",
    "department": "Department of Military Affairs",
    "organisation_address": null,
    "start_datetime_raw": "14-01-2026 3:00 PM",
    "end_datetime_raw": "15-01-2026 3:00 PM",
    "start_datetime": "2026-01-14T15:00:00",
    "end_datetime": "2026-01-15T15:00:00",
    "stage": "Bid Award",
    "bid_ra_status": null,
    "technical_status": null,
    "raw_card_text": "Bid No.:\u00a0 GEM/2025/B/7029918\n\nRA NO:\u00a0GEM/2026/R/606362\n\nStatus: Bid Award\n\nItems:\u00a0Smartphone (Chip A18 Pro or Hi...\nQuantity:\u00a01\nDepartment Name And Address:\u00a0\nMinistry of Defence\nDepartment of Military Affairs\nStart Date:\u00a014-01-2026 3:00 PM\nEnd Date:\u00a0\u00a0\u00a015-01-2026 3:00 PM"
  },
  {
    "bid_number": "GEM/2026/B/7067917",
    "bid_detail_url": "https://bidplus.gem.gov.in/showbidDocument/8790626",
    "bid_hover_url": "https://bidplus.gem.gov.in/bidding/bid/getBidResultView/8790626",
    "has_reverse_auction": false,
    "ra_number": null,
    "ra_detail_url": null,
    "ra_hover_url": null,
    "item": "Entry and Mid Level Desktop Co...",
    "quantity": 32,
    "ministry": "Transport Department Uttar Pradesh",
    "department": null,
    "organisation_address": null,
    "start_datetime_raw": "05-01-2026 2:15 PM",
    "end_datetime_raw": "15-01-2026 3:00 PM",
    "start_datetime": "2026-01-05T14:15:00",
    "end_datetime": "2026-01-15T15:00:00",
    "stage": "Bid Award",
    "bid_ra_status": null,
    "technical_status": null,
    "raw_card_text": "BID NO:\u00a0GEM/2026/B/7067917\n\nStatus: Bid Award\n\nItems:\u00a0Entry and Mid Level Desktop Co...\nQuantity:\u00a032\nDepartment Name And Address:\u00a0\nTransport Department Uttar Pradesh\nStart Date:\u00a005-01-2026 2:15 PM\nEnd Date:\u00a0\u00a0\u00a015-01-2026 3:00 PM"
  },
  {
    "bid_number": "GEM/2026/B/7069071",
    "bid_detail_url": "https://bidplus.gem.gov.in/showbidDocument/8791917",
    "bid_hover_url": "https://bidplus.gem.gov.in/bidding/bid/getBidResultView/8791917",
    "has_reverse_auction": false,
    "ra_number": null,
    "ra_detail_url": null,
    "ra_hover_url": null,
    "item": "Ice Bucket Wooden,Table Runner...",
    "quantity": 253,
    "ministry": "Ministry of Defence",
    "department": "Department of Military Affairs",
    "organisation_address": null,
    "start_datetime_raw": "05-01-2026 2:30 PM",
    "end_datetime_raw": "15-01-2026 3:00 PM",
    "start_datetime": "2026-01-05T14:30:00",
    "end_datetime": "2026-01-15T15:00:00",
    "stage": "Bid Award",
    "bid_ra_status": null,
    "technical_status": null,
    "raw_card_text": "BID NO:\u00a0GEM/2026/B/7069071\n\nStatus: Bid Award\n\nItems:\u00a0Ice Bucket Wooden,Table Runner...\nQuantity:\u00a0253\nDepartment Name And Address:\u00a0\nMinistry of Defence\nDepartment of Military Affairs\nStart Date:\u00a005-01-2026 2:30 PM\nEnd Date:\u00a0\u00a0\u00a015-01-2026 3:00 PM"
  },
  {
    "bid_number": "GEM/2025/B/7045716",
    "bid_detail_url": "https://bidplus.gem.gov.in/showbidDocument/8764375",
    "bid_hover_url": "https://bidplus.gem.gov.in/bidding/bid/getBidResultView/8764375",
    "has_reverse_auction": true,
    "ra_number": "GEM/2026/R/606321",
    "ra_detail_url": "https://bidplus.gem.gov.in/showradocumentPdf/8834905",
    "ra_hover_url": "https://bidplus.gem.gov.in/bidding/bid/getBidResultView/8834905",
    "item": "Single Use Sterile Rubber Surg...",
    "quantity": 30000,
    "ministry": "Ministry of Labour and Employment",
    "department": "Employees State Insuarnce Corporation",
    "organisation_address": null,
    "start_datetime_raw": "14-01-2026 2:00 PM",
    "end_datetime_raw": "15-01-2026 2:20 PM",
    "start_datetime": "2026-01-14T14:00:00",
    "end_datetime": "2026-01-15T14:20:00",
    "stage": "Bid Award",
    "bid_ra_status": null,
    "technical_status": null,
    "raw_card_text": "Bid No.:\u00a0 GEM/2025/B/7045716\n\nRA NO:\u00a0GEM/2026/R/606321\n\nStatus: Bid Award\n\nItems:\u00a0Single Use Sterile Rubber Surg...\nQuantity:\u00a030000\nDepartment Name And Address:\u00a0\nMinistry of Labour and Employment\nEmployees State Insuarnce Corporation\nStart Date:\u00a014-01-2026 2:00 PM\nEnd Date:\u00a0\u00a0\u00a015-01-2026 2:20 PM"
  },
  {
    "bid_number": "GEM/2025/B/7028813",
    "bid_detail_url": "https://bidplus.gem.gov.in/showbidDocument/8744940",
    "bid_hover_url": "https://bidplus.gem.gov.in/bidding/bid/getBidResultView/8744940",
    "has_reverse_auction": true,
    "ra_number": "GEM/2026/R/606315",
    "ra_detail_url": "https://bidplus.gem.gov.in/showradocumentPdf/8834841",
    "ra_hover_url": "https://bidplus.gem.gov.in/bidding/bid/getBidResultView/8834841",
    "item": "High End Desktop Computer,Line...",
    "quantity": 47,
    "ministry": "Ministry of Defence",
    "department": "Department of Military Affairs",
    "organisation_address": null,
    "start_datetime_raw": "14-01-2026 2:00 PM",
    "end_datetime_raw": "15-01-2026 2:00 PM",
    "start_datetime": "2026-01-14T14:00:00",
    "end_datetime": "2026-01-15T14:00:00",
    "stage": "Bid Award",
    "bid_ra_status": null,
    "technical_status": null,
    "raw_card_text": "Bid No.:\u00a0 GEM/2025/B/7028813\n\nRA NO:\u00a0GEM/2026/R/606315\n\nStatus: Bid Award\n\nItems:\u00a0High End Desktop Computer,Line...\nQuantity:\u00a047\nDepartment Name And Address:\u00a0\nMinistry of Defence\nDepartment of Military Affairs\nStart Date:\u00a014-01-2026 2:00 PM\nEnd Date:\u00a0\u00a0\u00a015-01-2026 2:00 PM"
  },
  {
    "bid_number": "GEM/2026/B/7067205",
    "bid_detail_url": "https://bidplus.gem.gov.in/showbidDocument/8789826",
    "bid_hover_url": "https://bidplus.gem.gov.in/bidding/bid/getBidResultView/8789826",
    "has_reverse_auction": false,
    "ra_number": null,
    "ra_detail_url": null,
    "ra_hover_url": null,
    "item": "Benzo Bolt 17mm,Benzo Bolt 19m...",
    "quantity": 115,
    "ministry": "Ministry of Defence",
    "department": "Department of Military Affairs",
    "organisation_address": null,
    "start_datetime_raw": "03-01-2026 1:25 PM",
    "end_datetime_raw": "15-01-2026 2:00 PM",
    "start_datetime": "2026-01-03T13:25:00",
    "end_datetime": "2026-01-15T14:00:00",
    "stage": "Bid Award",
    "bid_ra_status": null,
    "technical_status": null,
    "raw_card_text": "BID NO:\u00a0GEM/2026/B/7067205\n\nStatus: Bid Award\n\nItems:\u00a0Benzo Bolt 17mm,Benzo Bolt 19m...\nQuantity:\u00a0115\nDepartment Name And Address:\u00a0\nMinistry of Defence\nDepartment of Military Affairs\nStart Date:\u00a003-01-2026 1:25 PM\nEnd Date:\u00a0\u00a0\u00a015-01-2026 2:00 PM"
  },
  {
    "bid_number": "GEM/2026/B/7071846",
    "bid_detail_url": "https://bidplus.gem.gov.in/showbidDocument/8795099",
    "bid_hover_url": "https://bidplus.gem.gov.in/bidding/bid/getBidResultView/8795099",
    "has_reverse_auction": false,
    "ra_number": null,
    "ra_detail_url": null,
    "ra_hover_url": null,
    "item": "Cable assy 4x4,Knuckle bush,Dr...",
    "quantity": 24,
    "ministry": "Ministry of Defence",
    "department": "Department of Military Affairs",
    "organisation_address": null,
    "start_datetime_raw": "05-01-2026 1:07 PM",
    "end_datetime_raw": "15-01-2026 2:00 PM",
    "start_datetime": "2026-01-05T13:07:00",
    "end_datetime": "2026-01-15T14:00:00",
    "stage": "Bid Award",
    "bid_ra_status": null,
    "technical_status": null,
    "raw_card_text": "BID NO:\u00a0GEM/2026/B/7071846\n\nStatus: Bid Award\n\nItems:\u00a0Cable assy 4x4,Knuckle bush,Dr...\nQuantity:\u00a024\nDepartment Name And Address:\u00a0\nMinistry of Defence\nDepartment of Military Affairs\nStart Date:\u00a005-01-2026 1:07 PM\nEnd Date:\u00a0\u00a0\u00a015-01-2026 2:00 PM"
  },
  {
    "bid_number": "GEM/2026/B/7071925",
    "bid_detail_url": "https://bidplus.gem.gov.in/showbidDocument/8795191",
    "bid_hover_url": "https://bidplus.gem.gov.in/bidding/bid/getBidResultView/8795191",
    "has_reverse_auction": false,
    "ra_number": null,
    "ra_detail_url": null,
    "ra_hover_url": null,
    "item": "Pencil Cell,Generator Pull Rec...",
    "quantity": 29,
    "ministry": "Ministry of Defence",
    "department": "Department of Military Affairs",
    "organisation_address": null,
    "start_datetime_raw": "05-01-2026 1:16 PM",
    "end_datetime_raw": "15-01-2026 2:00 PM",
    "start_datetime": "2026-01-05T13:16:00",
    "end_datetime": "2026-01-15T14:00:00",
    "stage": "Bid Award",
    "bid_ra_status": null,
    "technical_status": null,
    "raw_card_text": "BID NO:\u00a0GEM/2026/B/7071925\n\nStatus: Bid Award\n\nItems:\u00a0Pencil Cell,Generator Pull Rec...\nQuantity:\u00a029\nDepartment Name And Address:\u00a0\nMinistry of Defence\nDepartment of Military Affairs\nStart Date:\u00a005-01-2026 1:16 PM\nEnd Date:\u00a0\u00a0\u00a015-01-2026 2:00 PM"
  },
  {
    "bid_number": "GEM/2026/B/7071716",
    "bid_detail_url": "https://bidplus.gem.gov.in/showbidDocument/8794943",
    "bid_hover_url": "https://bidplus.gem.gov.in/bidding/bid/getBidResultView/8794943",
    "has_reverse_auction": false,
    "ra_number": null,
    "ra_detail_url": null,
    "ra_hover_url": null,
    "item": "Driven Plate Tata Strome,Assem...",
    "quantity": 16,
    "ministry": "Ministry of Defence",
    "department": "Department of Military Affairs",
    "organisation_address": null,
    "start_datetime_raw": "05-01-2026 1:17 PM",
    "end_datetime_raw": "15-01-2026 2:00 PM",
    "start_datetime": "2026-01-05T13:17:00",
    "end_datetime": "2026-01-15T14:00:00",
    "stage": "Bid Award",
    "bid_ra_status": null,
    "technical_status": null,
    "raw_card_text": "BID NO:\u00a0GEM/2026/B/7071716\n\nStatus: Bid Award\n\nItems:\u00a0Driven Plate Tata Strome,Assem...\nQuantity:\u00a016\nDepartment Name And Address:\u00a0\nMinistry of Defence\nDepartment of Military Affairs\nStart Date:\u00a005-01-2026 1:17 PM\nEnd Date:\u00a0\u00a0\u00a015-01-2026 2:00 PM"
  },
  {
    "bid_number": "GEM/2026/B/7072078",
    "bid_detail_url": "https://bidplus.gem.gov.in/showbidDocument/8795386",
    "bid_hover_url": "https://bidplus.gem.gov.in/bidding/bid/getBidResultView/8795386",
    "has_reverse_auction": false,
    "ra_number": null,
    "ra_detail_url": null,
    "ra_hover_url": null,
    "item": "AC Fan Belt SX4,Alternator Mar...",
    "quantity": 15,
    "ministry": "Ministry of Defence",
    "department": "Department of Military Affairs",
    "organisation_address": null,
    "start_datetime_raw": "05-01-2026 1:55 PM",
    "end_datetime_raw": "15-01-2026 2:00 PM",
    "start_datetime": "2026-01-05T13:55:00",
    "end_datetime": "2026-01-15T14:00:00",
    "stage": "Bid Award",
    "bid_ra_status": null,
    "technical_status": null,
    "raw_card_text": "BID NO:\u00a0GEM/2026/B/7072078\n\nStatus: Bid Award\n\nItems:\u00a0AC Fan Belt SX4,Alternator Mar...\nQuantity:\u00a015\nDepartment Name And Address:\u00a0\nMinistry of Defence\nDepartment of Military Affairs\nStart Date:\u00a005-01-2026 1:55 PM\nEnd Date:\u00a0\u00a0\u00a015-01-2026 2:00 PM"
  },
  {
    "bid_number": "GEM/2025/B/7054998",
    "bid_detail_url": "https://bidplus.gem.gov.in/showbidDocument/8775394",
    "bid_hover_url": "https://bidplus.gem.gov.in/bidding/bid/getBidResultView/8775394",
    "has_reverse_auction": false,
    "ra_number": null,
    "ra_detail_url": null,
    "ra_hover_url": null,
    "item": "Copper wire 2 point 5 mm,cassi...",
    "quantity": 190,
    "ministry": "Ministry of Defence",
    "department": "Department of Military Affairs",
    "organisation_address": null,
    "start_datetime_raw": "30-12-2025 12:06 PM",
    "end_datetime_raw": "15-01-2026 2:00 PM",
    "start_datetime": "2025-12-30T12:06:00",
    "end_datetime": "2026-01-15T14:00:00",
    "stage": "Bid Award",
    "bid_ra_status": null,
    "technical_status": null,
    "raw_card_text": "BID NO:\u00a0GEM/2025/B/7054998\n\nStatus: Bid Award\n\nItems:\u00a0Copper wire 2 point 5 mm,cassi...\nQuantity:\u00a0190\nDepartment Name And Address:\u00a0\nMinistry of Defence\nDepartment of Military Affairs\nStart Date:\u00a030-12-2025 12:06 PM\nEnd Date:\u00a0\u00a0\u00a015-01-2026 2:00 PM"
  },
  {
    "bid_number": "GEM/2026/B/7063098",
    "bid_detail_url": "https://bidplus.gem.gov.in/showbidDocument/8785110",
    "bid_hover_url": "https://bidplus.gem.gov.in/bidding/bid/getSinglePacketResultView/8785110",
    "has_reverse_auction": false,
    "ra_number": null,
    "ra_detail_url": null,
    "ra_hover_url": null,
    "item": "Steel Tubes, Tubulars ISI mark...",
    "quantity": 6,
    "ministry": "Ministry of Railways",
    "department": "Indian Railways",
    "organisation_address": null,
    "start_datetime_raw": "02-01-2026 3:31 PM",
    "end_datetime_raw": "15-01-2026 2:00 PM",
    "start_datetime": "2026-01-02T15:31:00",
    "end_datetime": "2026-01-15T14:00:00",
    "stage": "Bid Award",
    "bid_ra_status": null,
    "technical_status": null,
    "raw_card_text": "BID NO:\u00a0GEM/2026/B/7063098\n\nStatus: Bid Award\n\nItems:\u00a0Steel Tubes, Tubulars ISI mark...\nQuantity:\u00a06\nDepartment Name And Address:\u00a0\nMinistry of Railways\nIndian Railways\nStart Date:\u00a002-01-2026 3:31 PM\nEnd Date:\u00a0\u00a0\u00a015-01-2026 2:00 PM"
  },
  {
    "bid_number": "GEM/2026/B/7071676",
    "bid_detail_url": "https://bidplus.gem.gov.in/showbidDocument/8794892",
    "bid_hover_url": "https://bidplus.gem.gov.in/bidding/bid/getSinglePacketResultView/8794892",
    "has_reverse_auction": false,
    "ra_number": null,
    "ra_detail_url": null,
    "ra_hover_url": null,
    "item": "Portable Air Compressor 9 Ltrs...",
    "quantity": 29,
    "ministry": "Ministry of Defence",
    "department": "Department of Military Affairs",
    "organisation_address": null,
    "start_datetime_raw": "05-01-2026 1:30 PM",
    "end_datetime_raw": "15-01-2026 2:00 PM",
    "start_datetime": "2026-01-05T13:30:00",
    "end_datetime": "2026-01-15T14:00:00",
    "stage": "Bid Award",
    "bid_ra_status": null,
    "technical_status": null,
